nt/cutlass_best_perf/M=2048_N=2048_K=2048/profiler_1.out



=============================
  Problem ID: 1

        Provider: [1;37mCUTLASS[0m
   OperationKind: [1;37mgemm[0m
       Operation: cutlass_simt_sgemm_128x128_8x2_nt_align1

          Status: [1;37mSuccess[0m
    Verification: [1;37mON[0m
     Disposition: [1;32mPassed[0m

reference_device: Passed
          cuBLAS: Passed

       Arguments: --gemm_kind=universal --split_k_mode=serial --m=2048 --n=2048 --k=2048 --A=f32:column --B=f32:row --C=f32:column  \
                  --alpha=1 --beta=0 --split_k_slices=1 --batch_count=1 --op_class=simt --accum=f32 --cta_m=128 --cta_n=128  \
                  --cta_k=8 --stages=2 --warps_m=4 --warps_n=2 --warps_k=1 --inst_m=1 --inst_n=1 --inst_k=1 --min_cc=50  \
                  --max_cc=1024

           Bytes: 50331648  bytes
           FLOPs: 17188257792  flops
           FLOPs/Byte: 341

         Runtime: 0.891822  ms
          Memory: 52.5609 GiB/s

            Math: 19273.2 GFLOP/s



=============================
  Problem ID: 1

        Provider: [1;37mCUTLASS[0m
   OperationKind: [1;37mgemm[0m
       Operation: cutlass_simt_sgemm_128x64_8x2_nt_align1

          Status: [1;37mSuccess[0m
    Verification: [1;37mON[0m
     Disposition: [1;32mPassed[0m

reference_device: Passed
          cuBLAS: Passed

       Arguments: --gemm_kind=universal --split_k_mode=serial --m=2048 --n=2048 --k=2048 --A=f32:column --B=f32:row --C=f32:column  \
                  --alpha=1 --beta=0 --split_k_slices=1 --batch_count=1 --op_class=simt --accum=f32 --cta_m=128 --cta_n=64  \
                  --cta_k=8 --stages=2 --warps_m=2 --warps_n=2 --warps_k=1 --inst_m=1 --inst_n=1 --inst_k=1 --min_cc=50  \
                  --max_cc=1024

           Bytes: 50331648  bytes
           FLOPs: 17188257792  flops
           FLOPs/Byte: 341

         Runtime: 0.972411  ms
          Memory: 48.2049 GiB/s

            Math: 17675.9 GFLOP/s



=============================
  Problem ID: 1

        Provider: [1;37mCUTLASS[0m
   OperationKind: [1;37mgemm[0m
       Operation: cutlass_simt_sgemm_64x128_8x2_nt_align1

          Status: [1;37mSuccess[0m
    Verification: [1;37mON[0m
     Disposition: [1;32mPassed[0m

reference_device: Passed
          cuBLAS: Passed

       Arguments: --gemm_kind=universal --split_k_mode=serial --m=2048 --n=2048 --k=2048 --A=f32:column --B=f32:row --C=f32:column  \
                  --alpha=1 --beta=0 --split_k_slices=1 --batch_count=1 --op_class=simt --accum=f32 --cta_m=64 --cta_n=128  \
                  --cta_k=8 --stages=2 --warps_m=2 --warps_n=2 --warps_k=1 --inst_m=1 --inst_n=1 --inst_k=1 --min_cc=50  \
                  --max_cc=1024

           Bytes: 50331648  bytes
           FLOPs: 17188257792  flops
           FLOPs/Byte: 341

         Runtime: 0.96937  ms
          Memory: 48.3562 GiB/s

            Math: 17731.4 GFLOP/s



=============================
  Problem ID: 1

        Provider: [1;37mCUTLASS[0m
   OperationKind: [1;37mgemm[0m
       Operation: cutlass_simt_sgemm_64x64_8x2_nt_align1

          Status: [1;37mSuccess[0m
    Verification: [1;37mON[0m
     Disposition: [1;32mPassed[0m

reference_device: Passed
          cuBLAS: Passed

       Arguments: --gemm_kind=universal --split_k_mode=serial --m=2048 --n=2048 --k=2048 --A=f32:column --B=f32:row --C=f32:column  \
                  --alpha=1 --beta=0 --split_k_slices=1 --batch_count=1 --op_class=simt --accum=f32 --cta_m=64 --cta_n=64  \
                  --cta_k=8 --stages=2 --warps_m=2 --warps_n=1 --warps_k=1 --inst_m=1 --inst_n=1 --inst_k=1 --min_cc=50  \
                  --max_cc=1024

           Bytes: 50331648  bytes
           FLOPs: 17188257792  flops
           FLOPs/Byte: 341

         Runtime: 1.02945  ms
          Memory: 45.5341 GiB/s

            Math: 16696.6 GFLOP/s



=============================
  Problem ID: 1

        Provider: [1;37mCUTLASS[0m
   OperationKind: [1;37mgemm[0m
       Operation: cutlass_simt_sgemm_128x32_8x2_nt_align1

          Status: [1;37mSuccess[0m
    Verification: [1;37mON[0m
     Disposition: [1;32mPassed[0m

reference_device: Passed
          cuBLAS: Passed

       Arguments: --gemm_kind=universal --split_k_mode=serial --m=2048 --n=2048 --k=2048 --A=f32:column --B=f32:row --C=f32:column  \
                  --alpha=1 --beta=0 --split_k_slices=1 --batch_count=1 --op_class=simt --accum=f32 --cta_m=128 --cta_n=32  \
                  --cta_k=8 --stages=2 --warps_m=2 --warps_n=1 --warps_k=1 --inst_m=1 --inst_n=1 --inst_k=1 --min_cc=50  \
                  --max_cc=1024

           Bytes: 50331648  bytes
           FLOPs: 17188257792  flops
           FLOPs/Byte: 341

         Runtime: 1.09464  ms
          Memory: 42.8225 GiB/s

            Math: 15702.3 GFLOP/s



=============================
  Problem ID: 1

        Provider: [1;37mCUTLASS[0m
   OperationKind: [1;37mgemm[0m
       Operation: cutlass_simt_sgemm_32x128_8x2_nt_align1

          Status: [1;37mSuccess[0m
    Verification: [1;37mON[0m
     Disposition: [1;32mPassed[0m

reference_device: Passed
          cuBLAS: Passed

       Arguments: --gemm_kind=universal --split_k_mode=serial --m=2048 --n=2048 --k=2048 --A=f32:column --B=f32:row --C=f32:column  \
                  --alpha=1 --beta=0 --split_k_slices=1 --batch_count=1 --op_class=simt --accum=f32 --cta_m=32 --cta_n=128  \
                  --cta_k=8 --stages=2 --warps_m=1 --warps_n=2 --warps_k=1 --inst_m=1 --inst_n=1 --inst_k=1 --min_cc=50  \
                  --max_cc=1024

           Bytes: 50331648  bytes
           FLOPs: 17188257792  flops
           FLOPs/Byte: 341

         Runtime: 1.15647  ms
          Memory: 40.5327 GiB/s

            Math: 14862.6 GFLOP/s



=============================
  Problem ID: 1

        Provider: [1;37mCUTLASS[0m
   OperationKind: [1;37mgemm[0m
       Operation: cutlass_simt_sgemm_256x128_8x5_nt_align1

          Status: [1;37mSuccess[0m
    Verification: [1;37mON[0m
     Disposition: [1;32mPassed[0m

reference_device: Passed
          cuBLAS: Passed

       Arguments: --gemm_kind=universal --split_k_mode=serial --m=2048 --n=2048 --k=2048 --A=f32:column --B=f32:row --C=f32:column  \
                  --alpha=1 --beta=0 --split_k_slices=1 --batch_count=1 --op_class=simt --accum=f32 --cta_m=256 --cta_n=128  \
                  --cta_k=8 --stages=5 --warps_m=4 --warps_n=2 --warps_k=1 --inst_m=1 --inst_n=1 --inst_k=1 --min_cc=50  \
                  --max_cc=1024

           Bytes: 50331648  bytes
           FLOPs: 17188257792  flops
           FLOPs/Byte: 341

         Runtime: 0.783176  ms
          Memory: 59.8525 GiB/s

            Math: 21946.9 GFLOP/s



=============================
  Problem ID: 1

        Provider: [1;37mCUTLASS[0m
   OperationKind: [1;37mgemm[0m
       Operation: cutlass_simt_sgemm_128x256_8x5_nt_align1

          Status: [1;37mSuccess[0m
    Verification: [1;37mON[0m
     Disposition: [1;32mPassed[0m

reference_device: Passed
          cuBLAS: Passed

       Arguments: --gemm_kind=universal --split_k_mode=serial --m=2048 --n=2048 --k=2048 --A=f32:column --B=f32:row --C=f32:column  \
                  --alpha=1 --beta=0 --split_k_slices=1 --batch_count=1 --op_class=simt --accum=f32 --cta_m=128 --cta_n=256  \
                  --cta_k=8 --stages=5 --warps_m=2 --warps_n=4 --warps_k=1 --inst_m=1 --inst_n=1 --inst_k=1 --min_cc=50  \
                  --max_cc=1024

           Bytes: 50331648  bytes
           FLOPs: 17188257792  flops
           FLOPs/Byte: 341

         Runtime: 0.794204  ms
          Memory: 59.0213 GiB/s

            Math: 21642.1 GFLOP/s



=============================
  Problem ID: 1

        Provider: [1;37mCUTLASS[0m
   OperationKind: [1;37mgemm[0m
       Operation: cutlass_simt_sgemm_128x128_8x5_nt_align1

          Status: [1;37mSuccess[0m
    Verification: [1;37mON[0m
     Disposition: [1;32mPassed[0m

reference_device: Passed
          cuBLAS: Passed

       Arguments: --gemm_kind=universal --split_k_mode=serial --m=2048 --n=2048 --k=2048 --A=f32:column --B=f32:row --C=f32:column  \
                  --alpha=1 --beta=0 --split_k_slices=1 --batch_count=1 --op_class=simt --accum=f32 --cta_m=128 --cta_n=128  \
                  --cta_k=8 --stages=5 --warps_m=4 --warps_n=2 --warps_k=1 --inst_m=1 --inst_n=1 --inst_k=1 --min_cc=50  \
                  --max_cc=1024

           Bytes: 50331648  bytes
           FLOPs: 17188257792  flops
           FLOPs/Byte: 341

         Runtime: 0.917176  ms
          Memory: 51.108 GiB/s

            Math: 18740.4 GFLOP/s



=============================
  Problem ID: 1

        Provider: [1;37mCUTLASS[0m
   OperationKind: [1;37mgemm[0m
       Operation: cutlass_simt_sgemm_256x128_8x4_nt_align1

          Status: [1;37mSuccess[0m
    Verification: [1;37mON[0m
     Disposition: [1;32mPassed[0m

reference_device: Passed
          cuBLAS: Passed

       Arguments: --gemm_kind=universal --split_k_mode=serial --m=2048 --n=2048 --k=2048 --A=f32:column --B=f32:row --C=f32:column  \
                  --alpha=1 --beta=0 --split_k_slices=1 --batch_count=1 --op_class=simt --accum=f32 --cta_m=256 --cta_n=128  \
                  --cta_k=8 --stages=4 --warps_m=4 --warps_n=2 --warps_k=1 --inst_m=1 --inst_n=1 --inst_k=1 --min_cc=50  \
                  --max_cc=1024

           Bytes: 50331648  bytes
           FLOPs: 17188257792  flops
           FLOPs/Byte: 341

         Runtime: 0.796211  ms
          Memory: 58.8726 GiB/s

            Math: 21587.6 GFLOP/s



=============================
  Problem ID: 1

        Provider: [1;37mCUTLASS[0m
   OperationKind: [1;37mgemm[0m
       Operation: cutlass_simt_sgemm_128x256_8x4_nt_align1

          Status: [1;37mSuccess[0m
    Verification: [1;37mON[0m
     Disposition: [1;32mPassed[0m

reference_device: Passed
          cuBLAS: Passed

       Arguments: --gemm_kind=universal --split_k_mode=serial --m=2048 --n=2048 --k=2048 --A=f32:column --B=f32:row --C=f32:column  \
                  --alpha=1 --beta=0 --split_k_slices=1 --batch_count=1 --op_class=simt --accum=f32 --cta_m=128 --cta_n=256  \
                  --cta_k=8 --stages=4 --warps_m=2 --warps_n=4 --warps_k=1 --inst_m=1 --inst_n=1 --inst_k=1 --min_cc=50  \
                  --max_cc=1024

           Bytes: 50331648  bytes
           FLOPs: 17188257792  flops
           FLOPs/Byte: 341

         Runtime: 0.790764  ms
          Memory: 59.2781 GiB/s

            Math: 21736.3 GFLOP/s



=============================
  Problem ID: 1

        Provider: [1;37mCUTLASS[0m
   OperationKind: [1;37mgemm[0m
       Operation: cutlass_simt_sgemm_128x128_8x4_nt_align1

          Status: [1;37mSuccess[0m
    Verification: [1;37mON[0m
     Disposition: [1;32mPassed[0m

reference_device: Passed
          cuBLAS: Passed

       Arguments: --gemm_kind=universal --split_k_mode=serial --m=2048 --n=2048 --k=2048 --A=f32:column --B=f32:row --C=f32:column  \
                  --alpha=1 --beta=0 --split_k_slices=1 --batch_count=1 --op_class=simt --accum=f32 --cta_m=128 --cta_n=128  \
                  --cta_k=8 --stages=4 --warps_m=4 --warps_n=2 --warps_k=1 --inst_m=1 --inst_n=1 --inst_k=1 --min_cc=50  \
                  --max_cc=1024

           Bytes: 50331648  bytes
           FLOPs: 17188257792  flops
           FLOPs/Byte: 341

         Runtime: 0.91905  ms
          Memory: 51.0037 GiB/s

            Math: 18702.2 GFLOP/s



=============================
  Problem ID: 1

        Provider: [1;37mCUTLASS[0m
   OperationKind: [1;37mgemm[0m
       Operation: cutlass_simt_sgemm_128x64_8x5_nt_align1

          Status: [1;37mSuccess[0m
    Verification: [1;37mON[0m
     Disposition: [1;32mPassed[0m

reference_device: Passed
          cuBLAS: Passed

       Arguments: --gemm_kind=universal --split_k_mode=serial --m=2048 --n=2048 --k=2048 --A=f32:column --B=f32:row --C=f32:column  \
                  --alpha=1 --beta=0 --split_k_slices=1 --batch_count=1 --op_class=simt --accum=f32 --cta_m=128 --cta_n=64  \
                  --cta_k=8 --stages=5 --warps_m=2 --warps_n=2 --warps_k=1 --inst_m=1 --inst_n=1 --inst_k=1 --min_cc=50  \
                  --max_cc=1024

           Bytes: 50331648  bytes
           FLOPs: 17188257792  flops
           FLOPs/Byte: 341

         Runtime: 1.0397  ms
          Memory: 45.0852 GiB/s

            Math: 16532 GFLOP/s



=============================
  Problem ID: 1

        Provider: [1;37mCUTLASS[0m
   OperationKind: [1;37mgemm[0m
       Operation: cutlass_simt_sgemm_64x128_8x5_nt_align1

          Status: [1;37mSuccess[0m
    Verification: [1;37mON[0m
     Disposition: [1;32mPassed[0m

reference_device: Passed
          cuBLAS: Passed

       Arguments: --gemm_kind=universal --split_k_mode=serial --m=2048 --n=2048 --k=2048 --A=f32:column --B=f32:row --C=f32:column  \
                  --alpha=1 --beta=0 --split_k_slices=1 --batch_count=1 --op_class=simt --accum=f32 --cta_m=64 --cta_n=128  \
                  --cta_k=8 --stages=5 --warps_m=2 --warps_n=2 --warps_k=1 --inst_m=1 --inst_n=1 --inst_k=1 --min_cc=50  \
                  --max_cc=1024

           Bytes: 50331648  bytes
           FLOPs: 17188257792  flops
           FLOPs/Byte: 341

         Runtime: 0.93696  ms
          Memory: 50.0288 GiB/s

            Math: 18344.7 GFLOP/s



=============================
  Problem ID: 1

        Provider: [1;37mCUTLASS[0m
   OperationKind: [1;37mgemm[0m
       Operation: cutlass_simt_sgemm_64x64_8x5_nt_align1

          Status: [1;37mSuccess[0m
    Verification: [1;37mON[0m
     Disposition: [1;32mPassed[0m

reference_device: Passed
          cuBLAS: Passed

       Arguments: --gemm_kind=universal --split_k_mode=serial --m=2048 --n=2048 --k=2048 --A=f32:column --B=f32:row --C=f32:column  \
                  --alpha=1 --beta=0 --split_k_slices=1 --batch_count=1 --op_class=simt --accum=f32 --cta_m=64 --cta_n=64  \
                  --cta_k=8 --stages=5 --warps_m=2 --warps_n=1 --warps_k=1 --inst_m=1 --inst_n=1 --inst_k=1 --min_cc=50  \
                  --max_cc=1024

           Bytes: 50331648  bytes
           FLOPs: 17188257792  flops
           FLOPs/Byte: 341

         Runtime: 1.00637  ms
          Memory: 46.5784 GiB/s

            Math: 17079.5 GFLOP/s



=============================
  Problem ID: 1

        Provider: [1;37mCUTLASS[0m
   OperationKind: [1;37mgemm[0m
       Operation: cutlass_simt_sgemm_128x32_8x5_nt_align1

          Status: [1;37mSuccess[0m
    Verification: [1;37mON[0m
     Disposition: [1;32mPassed[0m

reference_device: Passed
          cuBLAS: Passed

       Arguments: --gemm_kind=universal --split_k_mode=serial --m=2048 --n=2048 --k=2048 --A=f32:column --B=f32:row --C=f32:column  \
                  --alpha=1 --beta=0 --split_k_slices=1 --batch_count=1 --op_class=simt --accum=f32 --cta_m=128 --cta_n=32  \
                  --cta_k=8 --stages=5 --warps_m=2 --warps_n=1 --warps_k=1 --inst_m=1 --inst_n=1 --inst_k=1 --min_cc=50  \
                  --max_cc=1024

           Bytes: 50331648  bytes
           FLOPs: 17188257792  flops
           FLOPs/Byte: 341

         Runtime: 1.18364  ms
          Memory: 39.6024 GiB/s

            Math: 14521.5 GFLOP/s



=============================
  Problem ID: 1

        Provider: [1;37mCUTLASS[0m
   OperationKind: [1;37mgemm[0m
       Operation: cutlass_simt_sgemm_32x128_8x5_nt_align1

          Status: [1;37mSuccess[0m
    Verification: [1;37mON[0m
     Disposition: [1;32mPassed[0m

reference_device: Passed
          cuBLAS: Passed

       Arguments: --gemm_kind=universal --split_k_mode=serial --m=2048 --n=2048 --k=2048 --A=f32:column --B=f32:row --C=f32:column  \
                  --alpha=1 --beta=0 --split_k_slices=1 --batch_count=1 --op_class=simt --accum=f32 --cta_m=32 --cta_n=128  \
                  --cta_k=8 --stages=5 --warps_m=1 --warps_n=2 --warps_k=1 --inst_m=1 --inst_n=1 --inst_k=1 --min_cc=50  \
                  --max_cc=1024

           Bytes: 50331648  bytes
           FLOPs: 17188257792  flops
           FLOPs/Byte: 341

         Runtime: 1.12482  ms
          Memory: 41.6732 GiB/s

            Math: 15280.9 GFLOP/s


=============================

CSV Results:

Problem,Provider,OperationKind,Operation,Disposition,Status,gemm_kind,split_k_mode,m,n,k,A,B,C,alpha,beta,split_k_slices,batch_count,op_class,accum,cta_m,cta_n,cta_k,stages,warps_m,warps_n,warps_k,inst_m,inst_n,inst_k,min_cc,max_cc,Bytes,Flops,Flops/Byte,Runtime,GB/s,GFLOPs
1,CUTLASS,gemm,cutlass_simt_sgemm_128x128_8x2_nt_align1,passed,success,universal,serial,2048,2048,2048,f32:column,f32:row,f32:column,1,0,1,1,simt,f32,128,128,8,2,4,2,1,1,1,1,50,1024,50331648,17188257792,341,0.891822,52.5609,19273.2
1,CUTLASS,gemm,cutlass_simt_sgemm_128x64_8x2_nt_align1,passed,success,universal,serial,2048,2048,2048,f32:column,f32:row,f32:column,1,0,1,1,simt,f32,128,64,8,2,2,2,1,1,1,1,50,1024,50331648,17188257792,341,0.972411,48.2049,17675.9
1,CUTLASS,gemm,cutlass_simt_sgemm_64x128_8x2_nt_align1,passed,success,universal,serial,2048,2048,2048,f32:column,f32:row,f32:column,1,0,1,1,simt,f32,64,128,8,2,2,2,1,1,1,1,50,1024,50331648,17188257792,341,0.96937,48.3562,17731.4
1,CUTLASS,gemm,cutlass_simt_sgemm_64x64_8x2_nt_align1,passed,success,universal,serial,2048,2048,2048,f32:column,f32:row,f32:column,1,0,1,1,simt,f32,64,64,8,2,2,1,1,1,1,1,50,1024,50331648,17188257792,341,1.02945,45.5341,16696.6
1,CUTLASS,gemm,cutlass_simt_sgemm_128x32_8x2_nt_align1,passed,success,universal,serial,2048,2048,2048,f32:column,f32:row,f32:column,1,0,1,1,simt,f32,128,32,8,2,2,1,1,1,1,1,50,1024,50331648,17188257792,341,1.09464,42.8225,15702.3
1,CUTLASS,gemm,cutlass_simt_sgemm_32x128_8x2_nt_align1,passed,success,universal,serial,2048,2048,2048,f32:column,f32:row,f32:column,1,0,1,1,simt,f32,32,128,8,2,1,2,1,1,1,1,50,1024,50331648,17188257792,341,1.15647,40.5327,14862.6
1,CUTLASS,gemm,cutlass_simt_sgemm_256x128_8x5_nt_align1,passed,success,universal,serial,2048,2048,2048,f32:column,f32:row,f32:column,1,0,1,1,simt,f32,256,128,8,5,4,2,1,1,1,1,50,1024,50331648,17188257792,341,0.783176,59.8525,21946.9
1,CUTLASS,gemm,cutlass_simt_sgemm_128x256_8x5_nt_align1,passed,success,universal,serial,2048,2048,2048,f32:column,f32:row,f32:column,1,0,1,1,simt,f32,128,256,8,5,2,4,1,1,1,1,50,1024,50331648,17188257792,341,0.794204,59.0213,21642.1
1,CUTLASS,gemm,cutlass_simt_sgemm_128x128_8x5_nt_align1,passed,success,universal,serial,2048,2048,2048,f32:column,f32:row,f32:column,1,0,1,1,simt,f32,128,128,8,5,4,2,1,1,1,1,50,1024,50331648,17188257792,341,0.917176,51.108,18740.4
1,CUTLASS,gemm,cutlass_simt_sgemm_256x128_8x4_nt_align1,passed,success,universal,serial,2048,2048,2048,f32:column,f32:row,f32:column,1,0,1,1,simt,f32,256,128,8,4,4,2,1,1,1,1,50,1024,50331648,17188257792,341,0.796211,58.8726,21587.6
1,CUTLASS,gemm,cutlass_simt_sgemm_128x256_8x4_nt_align1,passed,success,universal,serial,2048,2048,2048,f32:column,f32:row,f32:column,1,0,1,1,simt,f32,128,256,8,4,2,4,1,1,1,1,50,1024,50331648,17188257792,341,0.790764,59.2781,21736.3
1,CUTLASS,gemm,cutlass_simt_sgemm_128x128_8x4_nt_align1,passed,success,universal,serial,2048,2048,2048,f32:column,f32:row,f32:column,1,0,1,1,simt,f32,128,128,8,4,4,2,1,1,1,1,50,1024,50331648,17188257792,341,0.91905,51.0037,18702.2
1,CUTLASS,gemm,cutlass_simt_sgemm_128x64_8x5_nt_align1,passed,success,universal,serial,2048,2048,2048,f32:column,f32:row,f32:column,1,0,1,1,simt,f32,128,64,8,5,2,2,1,1,1,1,50,1024,50331648,17188257792,341,1.0397,45.0852,16532
1,CUTLASS,gemm,cutlass_simt_sgemm_64x128_8x5_nt_align1,passed,success,universal,serial,2048,2048,2048,f32:column,f32:row,f32:column,1,0,1,1,simt,f32,64,128,8,5,2,2,1,1,1,1,50,1024,50331648,17188257792,341,0.93696,50.0288,18344.7
1,CUTLASS,gemm,cutlass_simt_sgemm_64x64_8x5_nt_align1,passed,success,universal,serial,2048,2048,2048,f32:column,f32:row,f32:column,1,0,1,1,simt,f32,64,64,8,5,2,1,1,1,1,1,50,1024,50331648,17188257792,341,1.00637,46.5784,17079.5
1,CUTLASS,gemm,cutlass_simt_sgemm_128x32_8x5_nt_align1,passed,success,universal,serial,2048,2048,2048,f32:column,f32:row,f32:column,1,0,1,1,simt,f32,128,32,8,5,2,1,1,1,1,1,50,1024,50331648,17188257792,341,1.18364,39.6024,14521.5
1,CUTLASS,gemm,cutlass_simt_sgemm_32x128_8x5_nt_align1,passed,success,universal,serial,2048,2048,2048,f32:column,f32:row,f32:column,1,0,1,1,simt,f32,32,128,8,5,1,2,1,1,1,1,50,1024,50331648,17188257792,341,1.12482,41.6732,15280.9
