template-based/nt/cutlass_best_perf_cuda=11.7/M=1024_N=1024_K=1024/profiler_3.out



=============================
  Problem ID: 1

        Provider: [1;37mCUTLASS[0m
   OperationKind: [1;37mgemm[0m
       Operation: cutlass_simt_sgemm_128x128_8x2_nt_align1

          Status: [1;37mSuccess[0m
    Verification: [1;37mON[0m
     Disposition: [1;32mPassed[0m

reference_device: Passed
          cuBLAS: Passed

       Arguments: --gemm_kind=universal --split_k_mode=serial --m=1024 --n=1024 --k=1024 --A=f32:column --B=f32:row --C=f32:column  \
                  --alpha=1 --beta=0 --split_k_slices=1 --batch_count=1 --op_class=simt --accum=f32 --cta_m=128 --cta_n=128  \
                  --cta_k=8 --stages=2 --warps_m=4 --warps_n=2 --warps_k=1 --inst_m=1 --inst_n=1 --inst_k=1 --min_cc=50  \
                  --max_cc=1024

           Bytes: 12582912  bytes
           FLOPs: 2149580800  flops
           FLOPs/Byte: 170

         Runtime: 0.112445  ms
          Memory: 104.217 GiB/s

            Math: 19116.7 GFLOP/s



=============================
  Problem ID: 1

        Provider: [1;37mCUTLASS[0m
   OperationKind: [1;37mgemm[0m
       Operation: cutlass_simt_sgemm_128x64_8x2_nt_align1

          Status: [1;37mSuccess[0m
    Verification: [1;37mON[0m
     Disposition: [1;32mPassed[0m

reference_device: Passed
          cuBLAS: Passed

       Arguments: --gemm_kind=universal --split_k_mode=serial --m=1024 --n=1024 --k=1024 --A=f32:column --B=f32:row --C=f32:column  \
                  --alpha=1 --beta=0 --split_k_slices=1 --batch_count=1 --op_class=simt --accum=f32 --cta_m=128 --cta_n=64  \
                  --cta_k=8 --stages=2 --warps_m=2 --warps_n=2 --warps_k=1 --inst_m=1 --inst_n=1 --inst_k=1 --min_cc=50  \
                  --max_cc=1024

           Bytes: 12582912  bytes
           FLOPs: 2149580800  flops
           FLOPs/Byte: 170

         Runtime: 0.11948  ms
          Memory: 98.081 GiB/s

            Math: 17991.1 GFLOP/s



=============================
  Problem ID: 1

        Provider: [1;37mCUTLASS[0m
   OperationKind: [1;37mgemm[0m
       Operation: cutlass_simt_sgemm_64x128_8x2_nt_align1

          Status: [1;37mSuccess[0m
    Verification: [1;37mON[0m
     Disposition: [1;32mPassed[0m

reference_device: Passed
          cuBLAS: Passed

       Arguments: --gemm_kind=universal --split_k_mode=serial --m=1024 --n=1024 --k=1024 --A=f32:column --B=f32:row --C=f32:column  \
                  --alpha=1 --beta=0 --split_k_slices=1 --batch_count=1 --op_class=simt --accum=f32 --cta_m=64 --cta_n=128  \
                  --cta_k=8 --stages=2 --warps_m=2 --warps_n=2 --warps_k=1 --inst_m=1 --inst_n=1 --inst_k=1 --min_cc=50  \
                  --max_cc=1024

           Bytes: 12582912  bytes
           FLOPs: 2149580800  flops
           FLOPs/Byte: 170

         Runtime: 0.117494  ms
          Memory: 99.7393 GiB/s

            Math: 18295.3 GFLOP/s



=============================
  Problem ID: 1

        Provider: [1;37mCUTLASS[0m
   OperationKind: [1;37mgemm[0m
       Operation: cutlass_simt_sgemm_64x64_8x2_nt_align1

          Status: [1;37mSuccess[0m
    Verification: [1;37mON[0m
     Disposition: [1;32mPassed[0m

reference_device: Passed
          cuBLAS: Passed

       Arguments: --gemm_kind=universal --split_k_mode=serial --m=1024 --n=1024 --k=1024 --A=f32:column --B=f32:row --C=f32:column  \
                  --alpha=1 --beta=0 --split_k_slices=1 --batch_count=1 --op_class=simt --accum=f32 --cta_m=64 --cta_n=64  \
                  --cta_k=8 --stages=2 --warps_m=2 --warps_n=1 --warps_k=1 --inst_m=1 --inst_n=1 --inst_k=1 --min_cc=50  \
                  --max_cc=1024

           Bytes: 12582912  bytes
           FLOPs: 2149580800  flops
           FLOPs/Byte: 170

         Runtime: 0.118927  ms
          Memory: 98.537 GiB/s

            Math: 18074.7 GFLOP/s



=============================
  Problem ID: 1

        Provider: [1;37mCUTLASS[0m
   OperationKind: [1;37mgemm[0m
       Operation: cutlass_simt_sgemm_128x32_8x2_nt_align1

          Status: [1;37mSuccess[0m
    Verification: [1;37mON[0m
     Disposition: [1;32mPassed[0m

reference_device: Passed
          cuBLAS: Passed

       Arguments: --gemm_kind=universal --split_k_mode=serial --m=1024 --n=1024 --k=1024 --A=f32:column --B=f32:row --C=f32:column  \
                  --alpha=1 --beta=0 --split_k_slices=1 --batch_count=1 --op_class=simt --accum=f32 --cta_m=128 --cta_n=32  \
                  --cta_k=8 --stages=2 --warps_m=2 --warps_n=1 --warps_k=1 --inst_m=1 --inst_n=1 --inst_k=1 --min_cc=50  \
                  --max_cc=1024

           Bytes: 12582912  bytes
           FLOPs: 2149580800  flops
           FLOPs/Byte: 170

         Runtime: 0.134994  ms
          Memory: 86.8095 GiB/s

            Math: 15923.5 GFLOP/s



=============================
  Problem ID: 1

        Provider: [1;37mCUTLASS[0m
   OperationKind: [1;37mgemm[0m
       Operation: cutlass_simt_sgemm_32x128_8x2_nt_align1

          Status: [1;37mSuccess[0m
    Verification: [1;37mON[0m
     Disposition: [1;32mPassed[0m

reference_device: Passed
          cuBLAS: Passed

       Arguments: --gemm_kind=universal --split_k_mode=serial --m=1024 --n=1024 --k=1024 --A=f32:column --B=f32:row --C=f32:column  \
                  --alpha=1 --beta=0 --split_k_slices=1 --batch_count=1 --op_class=simt --accum=f32 --cta_m=32 --cta_n=128  \
                  --cta_k=8 --stages=2 --warps_m=1 --warps_n=2 --warps_k=1 --inst_m=1 --inst_n=1 --inst_k=1 --min_cc=50  \
                  --max_cc=1024

           Bytes: 12582912  bytes
           FLOPs: 2149580800  flops
           FLOPs/Byte: 170

         Runtime: 0.136448  ms
          Memory: 85.8844 GiB/s

            Math: 15753.8 GFLOP/s



=============================
  Problem ID: 1

        Provider: [1;37mCUTLASS[0m
   OperationKind: [1;37mgemm[0m
       Operation: cutlass_simt_sgemm_256x128_8x5_nt_align1

          Status: [1;37mSuccess[0m
    Verification: [1;37mON[0m
     Disposition: [1;32mPassed[0m

reference_device: Passed
          cuBLAS: Passed

       Arguments: --gemm_kind=universal --split_k_mode=serial --m=1024 --n=1024 --k=1024 --A=f32:column --B=f32:row --C=f32:column  \
                  --alpha=1 --beta=0 --split_k_slices=1 --batch_count=1 --op_class=simt --accum=f32 --cta_m=256 --cta_n=128  \
                  --cta_k=8 --stages=5 --warps_m=4 --warps_n=2 --warps_k=1 --inst_m=1 --inst_n=1 --inst_k=1 --min_cc=50  \
                  --max_cc=1024

           Bytes: 12582912  bytes
           FLOPs: 2149580800  flops
           FLOPs/Byte: 170

         Runtime: 0.191498  ms
          Memory: 61.1951 GiB/s

            Math: 11225.1 GFLOP/s



=============================
  Problem ID: 1

        Provider: [1;37mCUTLASS[0m
   OperationKind: [1;37mgemm[0m
       Operation: cutlass_simt_sgemm_128x256_8x5_nt_align1

          Status: [1;37mSuccess[0m
    Verification: [1;37mON[0m
     Disposition: [1;32mPassed[0m

reference_device: Passed
          cuBLAS: Passed

       Arguments: --gemm_kind=universal --split_k_mode=serial --m=1024 --n=1024 --k=1024 --A=f32:column --B=f32:row --C=f32:column  \
                  --alpha=1 --beta=0 --split_k_slices=1 --batch_count=1 --op_class=simt --accum=f32 --cta_m=128 --cta_n=256  \
                  --cta_k=8 --stages=5 --warps_m=2 --warps_n=4 --warps_k=1 --inst_m=1 --inst_n=1 --inst_k=1 --min_cc=50  \
                  --max_cc=1024

           Bytes: 12582912  bytes
           FLOPs: 2149580800  flops
           FLOPs/Byte: 170

         Runtime: 0.188088  ms
          Memory: 62.3045 GiB/s

            Math: 11428.6 GFLOP/s



=============================
  Problem ID: 1

        Provider: [1;37mCUTLASS[0m
   OperationKind: [1;37mgemm[0m
       Operation: cutlass_simt_sgemm_128x128_8x5_nt_align1

          Status: [1;37mSuccess[0m
    Verification: [1;37mON[0m
     Disposition: [1;32mPassed[0m

reference_device: Passed
          cuBLAS: Passed

       Arguments: --gemm_kind=universal --split_k_mode=serial --m=1024 --n=1024 --k=1024 --A=f32:column --B=f32:row --C=f32:column  \
                  --alpha=1 --beta=0 --split_k_slices=1 --batch_count=1 --op_class=simt --accum=f32 --cta_m=128 --cta_n=128  \
                  --cta_k=8 --stages=5 --warps_m=4 --warps_n=2 --warps_k=1 --inst_m=1 --inst_n=1 --inst_k=1 --min_cc=50  \
                  --max_cc=1024

           Bytes: 12582912  bytes
           FLOPs: 2149580800  flops
           FLOPs/Byte: 170

         Runtime: 0.109844  ms
          Memory: 106.685 GiB/s

            Math: 19569.3 GFLOP/s



=============================
  Problem ID: 1

        Provider: [1;37mCUTLASS[0m
   OperationKind: [1;37mgemm[0m
       Operation: cutlass_simt_sgemm_256x128_8x4_nt_align1

          Status: [1;37mSuccess[0m
    Verification: [1;37mON[0m
     Disposition: [1;32mPassed[0m

reference_device: Passed
          cuBLAS: Passed

       Arguments: --gemm_kind=universal --split_k_mode=serial --m=1024 --n=1024 --k=1024 --A=f32:column --B=f32:row --C=f32:column  \
                  --alpha=1 --beta=0 --split_k_slices=1 --batch_count=1 --op_class=simt --accum=f32 --cta_m=256 --cta_n=128  \
                  --cta_k=8 --stages=4 --warps_m=4 --warps_n=2 --warps_k=1 --inst_m=1 --inst_n=1 --inst_k=1 --min_cc=50  \
                  --max_cc=1024

           Bytes: 12582912  bytes
           FLOPs: 2149580800  flops
           FLOPs/Byte: 170

         Runtime: 0.191457  ms
          Memory: 61.2082 GiB/s

            Math: 11227.5 GFLOP/s



=============================
  Problem ID: 1

        Provider: [1;37mCUTLASS[0m
   OperationKind: [1;37mgemm[0m
       Operation: cutlass_simt_sgemm_128x256_8x4_nt_align1

          Status: [1;37mSuccess[0m
    Verification: [1;37mON[0m
     Disposition: [1;32mPassed[0m

reference_device: Passed
          cuBLAS: Passed

       Arguments: --gemm_kind=universal --split_k_mode=serial --m=1024 --n=1024 --k=1024 --A=f32:column --B=f32:row --C=f32:column  \
                  --alpha=1 --beta=0 --split_k_slices=1 --batch_count=1 --op_class=simt --accum=f32 --cta_m=128 --cta_n=256  \
                  --cta_k=8 --stages=4 --warps_m=2 --warps_n=4 --warps_k=1 --inst_m=1 --inst_n=1 --inst_k=1 --min_cc=50  \
                  --max_cc=1024

           Bytes: 12582912  bytes
           FLOPs: 2149580800  flops
           FLOPs/Byte: 170

         Runtime: 0.194028  ms
          Memory: 60.3974 GiB/s

            Math: 11078.7 GFLOP/s



=============================
  Problem ID: 1

        Provider: [1;37mCUTLASS[0m
   OperationKind: [1;37mgemm[0m
       Operation: cutlass_simt_sgemm_128x128_8x4_nt_align1

          Status: [1;37mSuccess[0m
    Verification: [1;37mON[0m
     Disposition: [1;32mPassed[0m

reference_device: Passed
          cuBLAS: Passed

       Arguments: --gemm_kind=universal --split_k_mode=serial --m=1024 --n=1024 --k=1024 --A=f32:column --B=f32:row --C=f32:column  \
                  --alpha=1 --beta=0 --split_k_slices=1 --batch_count=1 --op_class=simt --accum=f32 --cta_m=128 --cta_n=128  \
                  --cta_k=8 --stages=4 --warps_m=4 --warps_n=2 --warps_k=1 --inst_m=1 --inst_n=1 --inst_k=1 --min_cc=50  \
                  --max_cc=1024

           Bytes: 12582912  bytes
           FLOPs: 2149580800  flops
           FLOPs/Byte: 170

         Runtime: 0.109344  ms
          Memory: 107.173 GiB/s

            Math: 19658.9 GFLOP/s



=============================
  Problem ID: 1

        Provider: [1;37mCUTLASS[0m
   OperationKind: [1;37mgemm[0m
       Operation: cutlass_simt_sgemm_128x64_8x5_nt_align1

          Status: [1;37mSuccess[0m
    Verification: [1;37mON[0m
     Disposition: [1;32mPassed[0m

reference_device: Passed
          cuBLAS: Passed

       Arguments: --gemm_kind=universal --split_k_mode=serial --m=1024 --n=1024 --k=1024 --A=f32:column --B=f32:row --C=f32:column  \
                  --alpha=1 --beta=0 --split_k_slices=1 --batch_count=1 --op_class=simt --accum=f32 --cta_m=128 --cta_n=64  \
                  --cta_k=8 --stages=5 --warps_m=2 --warps_n=2 --warps_k=1 --inst_m=1 --inst_n=1 --inst_k=1 --min_cc=50  \
                  --max_cc=1024

           Bytes: 12582912  bytes
           FLOPs: 2149580800  flops
           FLOPs/Byte: 170

         Runtime: 0.121795  ms
          Memory: 96.2174 GiB/s

            Math: 17649.2 GFLOP/s



=============================
  Problem ID: 1

        Provider: [1;37mCUTLASS[0m
   OperationKind: [1;37mgemm[0m
       Operation: cutlass_simt_sgemm_64x128_8x5_nt_align1

          Status: [1;37mSuccess[0m
    Verification: [1;37mON[0m
     Disposition: [1;32mPassed[0m

reference_device: Passed
          cuBLAS: Passed

       Arguments: --gemm_kind=universal --split_k_mode=serial --m=1024 --n=1024 --k=1024 --A=f32:column --B=f32:row --C=f32:column  \
                  --alpha=1 --beta=0 --split_k_slices=1 --batch_count=1 --op_class=simt --accum=f32 --cta_m=64 --cta_n=128  \
                  --cta_k=8 --stages=5 --warps_m=2 --warps_n=2 --warps_k=1 --inst_m=1 --inst_n=1 --inst_k=1 --min_cc=50  \
                  --max_cc=1024

           Bytes: 12582912  bytes
           FLOPs: 2149580800  flops
           FLOPs/Byte: 170

         Runtime: 0.112886  ms
          Memory: 103.811 GiB/s

            Math: 19042.1 GFLOP/s



=============================
  Problem ID: 1

        Provider: [1;37mCUTLASS[0m
   OperationKind: [1;37mgemm[0m
       Operation: cutlass_simt_sgemm_64x64_8x5_nt_align1

          Status: [1;37mSuccess[0m
    Verification: [1;37mON[0m
     Disposition: [1;32mPassed[0m

reference_device: Passed
          cuBLAS: Passed

       Arguments: --gemm_kind=universal --split_k_mode=serial --m=1024 --n=1024 --k=1024 --A=f32:column --B=f32:row --C=f32:column  \
                  --alpha=1 --beta=0 --split_k_slices=1 --batch_count=1 --op_class=simt --accum=f32 --cta_m=64 --cta_n=64  \
                  --cta_k=8 --stages=5 --warps_m=2 --warps_n=1 --warps_k=1 --inst_m=1 --inst_n=1 --inst_k=1 --min_cc=50  \
                  --max_cc=1024

           Bytes: 12582912  bytes
           FLOPs: 2149580800  flops
           FLOPs/Byte: 170

         Runtime: 0.117545  ms
          Memory: 99.6959 GiB/s

            Math: 18287.3 GFLOP/s



=============================
  Problem ID: 1

        Provider: [1;37mCUTLASS[0m
   OperationKind: [1;37mgemm[0m
       Operation: cutlass_simt_sgemm_128x32_8x5_nt_align1

          Status: [1;37mSuccess[0m
    Verification: [1;37mON[0m
     Disposition: [1;32mPassed[0m

reference_device: Passed
          cuBLAS: Passed

       Arguments: --gemm_kind=universal --split_k_mode=serial --m=1024 --n=1024 --k=1024 --A=f32:column --B=f32:row --C=f32:column  \
                  --alpha=1 --beta=0 --split_k_slices=1 --batch_count=1 --op_class=simt --accum=f32 --cta_m=128 --cta_n=32  \
                  --cta_k=8 --stages=5 --warps_m=2 --warps_n=1 --warps_k=1 --inst_m=1 --inst_n=1 --inst_k=1 --min_cc=50  \
                  --max_cc=1024

           Bytes: 12582912  bytes
           FLOPs: 2149580800  flops
           FLOPs/Byte: 170

         Runtime: 0.139571  ms
          Memory: 83.9625 GiB/s

            Math: 15401.3 GFLOP/s



=============================
  Problem ID: 1

        Provider: [1;37mCUTLASS[0m
   OperationKind: [1;37mgemm[0m
       Operation: cutlass_simt_sgemm_32x128_8x5_nt_align1

          Status: [1;37mSuccess[0m
    Verification: [1;37mON[0m
     Disposition: [1;32mPassed[0m

reference_device: Passed
          cuBLAS: Passed

       Arguments: --gemm_kind=universal --split_k_mode=serial --m=1024 --n=1024 --k=1024 --A=f32:column --B=f32:row --C=f32:column  \
                  --alpha=1 --beta=0 --split_k_slices=1 --batch_count=1 --op_class=simt --accum=f32 --cta_m=32 --cta_n=128  \
                  --cta_k=8 --stages=5 --warps_m=1 --warps_n=2 --warps_k=1 --inst_m=1 --inst_n=1 --inst_k=1 --min_cc=50  \
                  --max_cc=1024

           Bytes: 12582912  bytes
           FLOPs: 2149580800  flops
           FLOPs/Byte: 170

         Runtime: 0.138957  ms
          Memory: 84.3338 GiB/s

            Math: 15469.4 GFLOP/s


=============================

CSV Results:

Problem,Provider,OperationKind,Operation,Disposition,Status,gemm_kind,split_k_mode,m,n,k,A,B,C,alpha,beta,split_k_slices,batch_count,op_class,accum,cta_m,cta_n,cta_k,stages,warps_m,warps_n,warps_k,inst_m,inst_n,inst_k,min_cc,max_cc,Bytes,Flops,Flops/Byte,Runtime,GB/s,GFLOPs
1,CUTLASS,gemm,cutlass_simt_sgemm_128x128_8x2_nt_align1,passed,success,universal,serial,1024,1024,1024,f32:column,f32:row,f32:column,1,0,1,1,simt,f32,128,128,8,2,4,2,1,1,1,1,50,1024,12582912,2149580800,170,0.112445,104.217,19116.7
1,CUTLASS,gemm,cutlass_simt_sgemm_128x64_8x2_nt_align1,passed,success,universal,serial,1024,1024,1024,f32:column,f32:row,f32:column,1,0,1,1,simt,f32,128,64,8,2,2,2,1,1,1,1,50,1024,12582912,2149580800,170,0.11948,98.081,17991.1
1,CUTLASS,gemm,cutlass_simt_sgemm_64x128_8x2_nt_align1,passed,success,universal,serial,1024,1024,1024,f32:column,f32:row,f32:column,1,0,1,1,simt,f32,64,128,8,2,2,2,1,1,1,1,50,1024,12582912,2149580800,170,0.117494,99.7393,18295.3
1,CUTLASS,gemm,cutlass_simt_sgemm_64x64_8x2_nt_align1,passed,success,universal,serial,1024,1024,1024,f32:column,f32:row,f32:column,1,0,1,1,simt,f32,64,64,8,2,2,1,1,1,1,1,50,1024,12582912,2149580800,170,0.118927,98.537,18074.7
1,CUTLASS,gemm,cutlass_simt_sgemm_128x32_8x2_nt_align1,passed,success,universal,serial,1024,1024,1024,f32:column,f32:row,f32:column,1,0,1,1,simt,f32,128,32,8,2,2,1,1,1,1,1,50,1024,12582912,2149580800,170,0.134994,86.8095,15923.5
1,CUTLASS,gemm,cutlass_simt_sgemm_32x128_8x2_nt_align1,passed,success,universal,serial,1024,1024,1024,f32:column,f32:row,f32:column,1,0,1,1,simt,f32,32,128,8,2,1,2,1,1,1,1,50,1024,12582912,2149580800,170,0.136448,85.8844,15753.8
1,CUTLASS,gemm,cutlass_simt_sgemm_256x128_8x5_nt_align1,passed,success,universal,serial,1024,1024,1024,f32:column,f32:row,f32:column,1,0,1,1,simt,f32,256,128,8,5,4,2,1,1,1,1,50,1024,12582912,2149580800,170,0.191498,61.1951,11225.1
1,CUTLASS,gemm,cutlass_simt_sgemm_128x256_8x5_nt_align1,passed,success,universal,serial,1024,1024,1024,f32:column,f32:row,f32:column,1,0,1,1,simt,f32,128,256,8,5,2,4,1,1,1,1,50,1024,12582912,2149580800,170,0.188088,62.3045,11428.6
1,CUTLASS,gemm,cutlass_simt_sgemm_128x128_8x5_nt_align1,passed,success,universal,serial,1024,1024,1024,f32:column,f32:row,f32:column,1,0,1,1,simt,f32,128,128,8,5,4,2,1,1,1,1,50,1024,12582912,2149580800,170,0.109844,106.685,19569.3
1,CUTLASS,gemm,cutlass_simt_sgemm_256x128_8x4_nt_align1,passed,success,universal,serial,1024,1024,1024,f32:column,f32:row,f32:column,1,0,1,1,simt,f32,256,128,8,4,4,2,1,1,1,1,50,1024,12582912,2149580800,170,0.191457,61.2082,11227.5
1,CUTLASS,gemm,cutlass_simt_sgemm_128x256_8x4_nt_align1,passed,success,universal,serial,1024,1024,1024,f32:column,f32:row,f32:column,1,0,1,1,simt,f32,128,256,8,4,2,4,1,1,1,1,50,1024,12582912,2149580800,170,0.194028,60.3974,11078.7
1,CUTLASS,gemm,cutlass_simt_sgemm_128x128_8x4_nt_align1,passed,success,universal,serial,1024,1024,1024,f32:column,f32:row,f32:column,1,0,1,1,simt,f32,128,128,8,4,4,2,1,1,1,1,50,1024,12582912,2149580800,170,0.109344,107.173,19658.9
1,CUTLASS,gemm,cutlass_simt_sgemm_128x64_8x5_nt_align1,passed,success,universal,serial,1024,1024,1024,f32:column,f32:row,f32:column,1,0,1,1,simt,f32,128,64,8,5,2,2,1,1,1,1,50,1024,12582912,2149580800,170,0.121795,96.2174,17649.2
1,CUTLASS,gemm,cutlass_simt_sgemm_64x128_8x5_nt_align1,passed,success,universal,serial,1024,1024,1024,f32:column,f32:row,f32:column,1,0,1,1,simt,f32,64,128,8,5,2,2,1,1,1,1,50,1024,12582912,2149580800,170,0.112886,103.811,19042.1
1,CUTLASS,gemm,cutlass_simt_sgemm_64x64_8x5_nt_align1,passed,success,universal,serial,1024,1024,1024,f32:column,f32:row,f32:column,1,0,1,1,simt,f32,64,64,8,5,2,1,1,1,1,1,50,1024,12582912,2149580800,170,0.117545,99.6959,18287.3
1,CUTLASS,gemm,cutlass_simt_sgemm_128x32_8x5_nt_align1,passed,success,universal,serial,1024,1024,1024,f32:column,f32:row,f32:column,1,0,1,1,simt,f32,128,32,8,5,2,1,1,1,1,1,50,1024,12582912,2149580800,170,0.139571,83.9625,15401.3
1,CUTLASS,gemm,cutlass_simt_sgemm_32x128_8x5_nt_align1,passed,success,universal,serial,1024,1024,1024,f32:column,f32:row,f32:column,1,0,1,1,simt,f32,32,128,8,5,1,2,1,1,1,1,50,1024,12582912,2149580800,170,0.138957,84.3338,15469.4
