template-based/nt/cutlass_best_perf_cuda=11.7/M=3072_N=3072_K=3072/profiler_3.out



=============================
  Problem ID: 1

        Provider: [1;37mCUTLASS[0m
   OperationKind: [1;37mgemm[0m
       Operation: cutlass_simt_sgemm_128x128_8x2_nt_align1

          Status: [1;37mSuccess[0m
    Verification: [1;37mON[0m
     Disposition: [1;32mPassed[0m

reference_device: Passed
          cuBLAS: Passed

       Arguments: --gemm_kind=universal --split_k_mode=serial --m=3072 --n=3072 --k=3072 --A=f32:column --B=f32:row --C=f32:column  \
                  --alpha=1 --beta=0 --split_k_slices=1 --batch_count=1 --op_class=simt --accum=f32 --cta_m=128 --cta_n=128  \
                  --cta_k=8 --stages=2 --warps_m=4 --warps_n=2 --warps_k=1 --inst_m=1 --inst_n=1 --inst_k=1 --min_cc=50  \
                  --max_cc=1024

           Bytes: 113246208  bytes
           FLOPs: 58000932864  flops
           FLOPs/Byte: 512

         Runtime: 3.3298  ms
          Memory: 31.6742 GiB/s

            Math: 17418.7 GFLOP/s



=============================
  Problem ID: 1

        Provider: [1;37mCUTLASS[0m
   OperationKind: [1;37mgemm[0m
       Operation: cutlass_simt_sgemm_128x64_8x2_nt_align1

          Status: [1;37mSuccess[0m
    Verification: [1;37mON[0m
     Disposition: [1;32mPassed[0m

reference_device: Passed
          cuBLAS: Passed

       Arguments: --gemm_kind=universal --split_k_mode=serial --m=3072 --n=3072 --k=3072 --A=f32:column --B=f32:row --C=f32:column  \
                  --alpha=1 --beta=0 --split_k_slices=1 --batch_count=1 --op_class=simt --accum=f32 --cta_m=128 --cta_n=64  \
                  --cta_k=8 --stages=2 --warps_m=2 --warps_n=2 --warps_k=1 --inst_m=1 --inst_n=1 --inst_k=1 --min_cc=50  \
                  --max_cc=1024

           Bytes: 113246208  bytes
           FLOPs: 58000932864  flops
           FLOPs/Byte: 512

         Runtime: 5.9722  ms
          Memory: 17.6599 GiB/s

            Math: 9711.81 GFLOP/s



=============================
  Problem ID: 1

        Provider: [1;37mCUTLASS[0m
   OperationKind: [1;37mgemm[0m
       Operation: cutlass_simt_sgemm_64x128_8x2_nt_align1

          Status: [1;37mSuccess[0m
    Verification: [1;37mON[0m
     Disposition: [1;32mPassed[0m

reference_device: Passed
          cuBLAS: Passed

       Arguments: --gemm_kind=universal --split_k_mode=serial --m=3072 --n=3072 --k=3072 --A=f32:column --B=f32:row --C=f32:column  \
                  --alpha=1 --beta=0 --split_k_slices=1 --batch_count=1 --op_class=simt --accum=f32 --cta_m=64 --cta_n=128  \
                  --cta_k=8 --stages=2 --warps_m=2 --warps_n=2 --warps_k=1 --inst_m=1 --inst_n=1 --inst_k=1 --min_cc=50  \
                  --max_cc=1024

           Bytes: 113246208  bytes
           FLOPs: 58000932864  flops
           FLOPs/Byte: 512

         Runtime: 4.7983  ms
          Memory: 21.9804 GiB/s

            Math: 12087.8 GFLOP/s



=============================
  Problem ID: 1

        Provider: [1;37mCUTLASS[0m
   OperationKind: [1;37mgemm[0m
       Operation: cutlass_simt_sgemm_64x64_8x2_nt_align1

          Status: [1;37mSuccess[0m
    Verification: [1;37mON[0m
     Disposition: [1;32mPassed[0m

reference_device: Passed
          cuBLAS: Passed

       Arguments: --gemm_kind=universal --split_k_mode=serial --m=3072 --n=3072 --k=3072 --A=f32:column --B=f32:row --C=f32:column  \
                  --alpha=1 --beta=0 --split_k_slices=1 --batch_count=1 --op_class=simt --accum=f32 --cta_m=64 --cta_n=64  \
                  --cta_k=8 --stages=2 --warps_m=2 --warps_n=1 --warps_k=1 --inst_m=1 --inst_n=1 --inst_k=1 --min_cc=50  \
                  --max_cc=1024

           Bytes: 113246208  bytes
           FLOPs: 58000932864  flops
           FLOPs/Byte: 512

         Runtime: 3.38941  ms
          Memory: 31.1171 GiB/s

            Math: 17112.4 GFLOP/s



=============================
  Problem ID: 1

        Provider: [1;37mCUTLASS[0m
   OperationKind: [1;37mgemm[0m
       Operation: cutlass_simt_sgemm_128x32_8x2_nt_align1

          Status: [1;37mSuccess[0m
    Verification: [1;37mON[0m
     Disposition: [1;32mPassed[0m

reference_device: Passed
          cuBLAS: Passed

       Arguments: --gemm_kind=universal --split_k_mode=serial --m=3072 --n=3072 --k=3072 --A=f32:column --B=f32:row --C=f32:column  \
                  --alpha=1 --beta=0 --split_k_slices=1 --batch_count=1 --op_class=simt --accum=f32 --cta_m=128 --cta_n=32  \
                  --cta_k=8 --stages=2 --warps_m=2 --warps_n=1 --warps_k=1 --inst_m=1 --inst_n=1 --inst_k=1 --min_cc=50  \
                  --max_cc=1024

           Bytes: 113246208  bytes
           FLOPs: 58000932864  flops
           FLOPs/Byte: 512

         Runtime: 3.66229  ms
          Memory: 28.7985 GiB/s

            Math: 15837.3 GFLOP/s



=============================
  Problem ID: 1

        Provider: [1;37mCUTLASS[0m
   OperationKind: [1;37mgemm[0m
       Operation: cutlass_simt_sgemm_32x128_8x2_nt_align1

          Status: [1;37mSuccess[0m
    Verification: [1;37mON[0m
     Disposition: [1;32mPassed[0m

reference_device: Passed
          cuBLAS: Passed

       Arguments: --gemm_kind=universal --split_k_mode=serial --m=3072 --n=3072 --k=3072 --A=f32:column --B=f32:row --C=f32:column  \
                  --alpha=1 --beta=0 --split_k_slices=1 --batch_count=1 --op_class=simt --accum=f32 --cta_m=32 --cta_n=128  \
                  --cta_k=8 --stages=2 --warps_m=1 --warps_n=2 --warps_k=1 --inst_m=1 --inst_n=1 --inst_k=1 --min_cc=50  \
                  --max_cc=1024

           Bytes: 113246208  bytes
           FLOPs: 58000932864  flops
           FLOPs/Byte: 512

         Runtime: 4.59849  ms
          Memory: 22.9355 GiB/s

            Math: 12613 GFLOP/s



=============================
  Problem ID: 1

        Provider: [1;37mCUTLASS[0m
   OperationKind: [1;37mgemm[0m
       Operation: cutlass_simt_sgemm_256x128_8x5_nt_align1

          Status: [1;37mSuccess[0m
    Verification: [1;37mON[0m
     Disposition: [1;32mPassed[0m

reference_device: Passed
          cuBLAS: Passed

       Arguments: --gemm_kind=universal --split_k_mode=serial --m=3072 --n=3072 --k=3072 --A=f32:column --B=f32:row --C=f32:column  \
                  --alpha=1 --beta=0 --split_k_slices=1 --batch_count=1 --op_class=simt --accum=f32 --cta_m=256 --cta_n=128  \
                  --cta_k=8 --stages=5 --warps_m=4 --warps_n=2 --warps_k=1 --inst_m=1 --inst_n=1 --inst_k=1 --min_cc=50  \
                  --max_cc=1024

           Bytes: 113246208  bytes
           FLOPs: 58000932864  flops
           FLOPs/Byte: 512

         Runtime: 2.9095  ms
          Memory: 36.2498 GiB/s

            Math: 19935 GFLOP/s



=============================
  Problem ID: 1

        Provider: [1;37mCUTLASS[0m
   OperationKind: [1;37mgemm[0m
       Operation: cutlass_simt_sgemm_128x256_8x5_nt_align1

          Status: [1;37mSuccess[0m
    Verification: [1;37mON[0m
     Disposition: [1;32mPassed[0m

reference_device: Passed
          cuBLAS: Passed

       Arguments: --gemm_kind=universal --split_k_mode=serial --m=3072 --n=3072 --k=3072 --A=f32:column --B=f32:row --C=f32:column  \
                  --alpha=1 --beta=0 --split_k_slices=1 --batch_count=1 --op_class=simt --accum=f32 --cta_m=128 --cta_n=256  \
                  --cta_k=8 --stages=5 --warps_m=2 --warps_n=4 --warps_k=1 --inst_m=1 --inst_n=1 --inst_k=1 --min_cc=50  \
                  --max_cc=1024

           Bytes: 113246208  bytes
           FLOPs: 58000932864  flops
           FLOPs/Byte: 512

         Runtime: 2.86261  ms
          Memory: 36.8435 GiB/s

            Math: 20261.5 GFLOP/s



=============================
  Problem ID: 1

        Provider: [1;37mCUTLASS[0m
   OperationKind: [1;37mgemm[0m
       Operation: cutlass_simt_sgemm_128x128_8x5_nt_align1

          Status: [1;37mSuccess[0m
    Verification: [1;37mON[0m
     Disposition: [1;32mPassed[0m

reference_device: Passed
          cuBLAS: Passed

       Arguments: --gemm_kind=universal --split_k_mode=serial --m=3072 --n=3072 --k=3072 --A=f32:column --B=f32:row --C=f32:column  \
                  --alpha=1 --beta=0 --split_k_slices=1 --batch_count=1 --op_class=simt --accum=f32 --cta_m=128 --cta_n=128  \
                  --cta_k=8 --stages=5 --warps_m=4 --warps_n=2 --warps_k=1 --inst_m=1 --inst_n=1 --inst_k=1 --min_cc=50  \
                  --max_cc=1024

           Bytes: 113246208  bytes
           FLOPs: 58000932864  flops
           FLOPs/Byte: 512

         Runtime: 3.13226  ms
          Memory: 33.6717 GiB/s

            Math: 18517.3 GFLOP/s



=============================
  Problem ID: 1

        Provider: [1;37mCUTLASS[0m
   OperationKind: [1;37mgemm[0m
       Operation: cutlass_simt_sgemm_256x128_8x4_nt_align1

          Status: [1;37mSuccess[0m
    Verification: [1;37mON[0m
     Disposition: [1;32mPassed[0m

reference_device: Passed
          cuBLAS: Passed

       Arguments: --gemm_kind=universal --split_k_mode=serial --m=3072 --n=3072 --k=3072 --A=f32:column --B=f32:row --C=f32:column  \
                  --alpha=1 --beta=0 --split_k_slices=1 --batch_count=1 --op_class=simt --accum=f32 --cta_m=256 --cta_n=128  \
                  --cta_k=8 --stages=4 --warps_m=4 --warps_n=2 --warps_k=1 --inst_m=1 --inst_n=1 --inst_k=1 --min_cc=50  \
                  --max_cc=1024

           Bytes: 113246208  bytes
           FLOPs: 58000932864  flops
           FLOPs/Byte: 512

         Runtime: 2.90595  ms
          Memory: 36.2941 GiB/s

            Math: 19959.4 GFLOP/s



=============================
  Problem ID: 1

        Provider: [1;37mCUTLASS[0m
   OperationKind: [1;37mgemm[0m
       Operation: cutlass_simt_sgemm_128x256_8x4_nt_align1

          Status: [1;37mSuccess[0m
    Verification: [1;37mON[0m
     Disposition: [1;32mPassed[0m

reference_device: Passed
          cuBLAS: Passed

       Arguments: --gemm_kind=universal --split_k_mode=serial --m=3072 --n=3072 --k=3072 --A=f32:column --B=f32:row --C=f32:column  \
                  --alpha=1 --beta=0 --split_k_slices=1 --batch_count=1 --op_class=simt --accum=f32 --cta_m=128 --cta_n=256  \
                  --cta_k=8 --stages=4 --warps_m=2 --warps_n=4 --warps_k=1 --inst_m=1 --inst_n=1 --inst_k=1 --min_cc=50  \
                  --max_cc=1024

           Bytes: 113246208  bytes
           FLOPs: 58000932864  flops
           FLOPs/Byte: 512

         Runtime: 2.93906  ms
          Memory: 35.8851 GiB/s

            Math: 19734.5 GFLOP/s



=============================
  Problem ID: 1

        Provider: [1;37mCUTLASS[0m
   OperationKind: [1;37mgemm[0m
       Operation: cutlass_simt_sgemm_128x128_8x4_nt_align1

          Status: [1;37mSuccess[0m
    Verification: [1;37mON[0m
     Disposition: [1;32mPassed[0m

reference_device: Passed
          cuBLAS: Passed

       Arguments: --gemm_kind=universal --split_k_mode=serial --m=3072 --n=3072 --k=3072 --A=f32:column --B=f32:row --C=f32:column  \
                  --alpha=1 --beta=0 --split_k_slices=1 --batch_count=1 --op_class=simt --accum=f32 --cta_m=128 --cta_n=128  \
                  --cta_k=8 --stages=4 --warps_m=4 --warps_n=2 --warps_k=1 --inst_m=1 --inst_n=1 --inst_k=1 --min_cc=50  \
                  --max_cc=1024

           Bytes: 113246208  bytes
           FLOPs: 58000932864  flops
           FLOPs/Byte: 512

         Runtime: 3.11744  ms
          Memory: 33.8318 GiB/s

            Math: 18605.3 GFLOP/s



=============================
  Problem ID: 1

        Provider: [1;37mCUTLASS[0m
   OperationKind: [1;37mgemm[0m
       Operation: cutlass_simt_sgemm_128x64_8x5_nt_align1

          Status: [1;37mSuccess[0m
    Verification: [1;37mON[0m
     Disposition: [1;32mPassed[0m

reference_device: Passed
          cuBLAS: Passed

       Arguments: --gemm_kind=universal --split_k_mode=serial --m=3072 --n=3072 --k=3072 --A=f32:column --B=f32:row --C=f32:column  \
                  --alpha=1 --beta=0 --split_k_slices=1 --batch_count=1 --op_class=simt --accum=f32 --cta_m=128 --cta_n=64  \
                  --cta_k=8 --stages=5 --warps_m=2 --warps_n=2 --warps_k=1 --inst_m=1 --inst_n=1 --inst_k=1 --min_cc=50  \
                  --max_cc=1024

           Bytes: 113246208  bytes
           FLOPs: 58000932864  flops
           FLOPs/Byte: 512

         Runtime: 3.45903  ms
          Memory: 30.4908 GiB/s

            Math: 16768 GFLOP/s



=============================
  Problem ID: 1

        Provider: [1;37mCUTLASS[0m
   OperationKind: [1;37mgemm[0m
       Operation: cutlass_simt_sgemm_64x128_8x5_nt_align1

          Status: [1;37mSuccess[0m
    Verification: [1;37mON[0m
     Disposition: [1;32mPassed[0m

reference_device: Passed
          cuBLAS: Passed

       Arguments: --gemm_kind=universal --split_k_mode=serial --m=3072 --n=3072 --k=3072 --A=f32:column --B=f32:row --C=f32:column  \
                  --alpha=1 --beta=0 --split_k_slices=1 --batch_count=1 --op_class=simt --accum=f32 --cta_m=64 --cta_n=128  \
                  --cta_k=8 --stages=5 --warps_m=2 --warps_n=2 --warps_k=1 --inst_m=1 --inst_n=1 --inst_k=1 --min_cc=50  \
                  --max_cc=1024

           Bytes: 113246208  bytes
           FLOPs: 58000932864  flops
           FLOPs/Byte: 512

         Runtime: 3.13935  ms
          Memory: 33.5957 GiB/s

            Math: 18475.5 GFLOP/s



=============================
  Problem ID: 1

        Provider: [1;37mCUTLASS[0m
   OperationKind: [1;37mgemm[0m
       Operation: cutlass_simt_sgemm_64x64_8x5_nt_align1

          Status: [1;37mSuccess[0m
    Verification: [1;37mON[0m
     Disposition: [1;32mPassed[0m

reference_device: Passed
          cuBLAS: Passed

       Arguments: --gemm_kind=universal --split_k_mode=serial --m=3072 --n=3072 --k=3072 --A=f32:column --B=f32:row --C=f32:column  \
                  --alpha=1 --beta=0 --split_k_slices=1 --batch_count=1 --op_class=simt --accum=f32 --cta_m=64 --cta_n=64  \
                  --cta_k=8 --stages=5 --warps_m=2 --warps_n=1 --warps_k=1 --inst_m=1 --inst_n=1 --inst_k=1 --min_cc=50  \
                  --max_cc=1024

           Bytes: 113246208  bytes
           FLOPs: 58000932864  flops
           FLOPs/Byte: 512

         Runtime: 3.37459  ms
          Memory: 31.2538 GiB/s

            Math: 17187.5 GFLOP/s



=============================
  Problem ID: 1

        Provider: [1;37mCUTLASS[0m
   OperationKind: [1;37mgemm[0m
       Operation: cutlass_simt_sgemm_128x32_8x5_nt_align1

          Status: [1;37mSuccess[0m
    Verification: [1;37mON[0m
     Disposition: [1;32mPassed[0m

reference_device: Passed
          cuBLAS: Passed

       Arguments: --gemm_kind=universal --split_k_mode=serial --m=3072 --n=3072 --k=3072 --A=f32:column --B=f32:row --C=f32:column  \
                  --alpha=1 --beta=0 --split_k_slices=1 --batch_count=1 --op_class=simt --accum=f32 --cta_m=128 --cta_n=32  \
                  --cta_k=8 --stages=5 --warps_m=2 --warps_n=1 --warps_k=1 --inst_m=1 --inst_n=1 --inst_k=1 --min_cc=50  \
                  --max_cc=1024

           Bytes: 113246208  bytes
           FLOPs: 58000932864  flops
           FLOPs/Byte: 512

         Runtime: 3.83402  ms
          Memory: 27.5087 GiB/s

            Math: 15128 GFLOP/s



=============================
  Problem ID: 1

        Provider: [1;37mCUTLASS[0m
   OperationKind: [1;37mgemm[0m
       Operation: cutlass_simt_sgemm_32x128_8x5_nt_align1

          Status: [1;37mSuccess[0m
    Verification: [1;37mON[0m
     Disposition: [1;32mPassed[0m

reference_device: Passed
          cuBLAS: Passed

       Arguments: --gemm_kind=universal --split_k_mode=serial --m=3072 --n=3072 --k=3072 --A=f32:column --B=f32:row --C=f32:column  \
                  --alpha=1 --beta=0 --split_k_slices=1 --batch_count=1 --op_class=simt --accum=f32 --cta_m=32 --cta_n=128  \
                  --cta_k=8 --stages=5 --warps_m=1 --warps_n=2 --warps_k=1 --inst_m=1 --inst_n=1 --inst_k=1 --min_cc=50  \
                  --max_cc=1024

           Bytes: 113246208  bytes
           FLOPs: 58000932864  flops
           FLOPs/Byte: 512

         Runtime: 3.70217  ms
          Memory: 28.4884 GiB/s

            Math: 15666.7 GFLOP/s


=============================

CSV Results:

Problem,Provider,OperationKind,Operation,Disposition,Status,gemm_kind,split_k_mode,m,n,k,A,B,C,alpha,beta,split_k_slices,batch_count,op_class,accum,cta_m,cta_n,cta_k,stages,warps_m,warps_n,warps_k,inst_m,inst_n,inst_k,min_cc,max_cc,Bytes,Flops,Flops/Byte,Runtime,GB/s,GFLOPs
1,CUTLASS,gemm,cutlass_simt_sgemm_128x128_8x2_nt_align1,passed,success,universal,serial,3072,3072,3072,f32:column,f32:row,f32:column,1,0,1,1,simt,f32,128,128,8,2,4,2,1,1,1,1,50,1024,113246208,58000932864,512,3.3298,31.6742,17418.7
1,CUTLASS,gemm,cutlass_simt_sgemm_128x64_8x2_nt_align1,passed,success,universal,serial,3072,3072,3072,f32:column,f32:row,f32:column,1,0,1,1,simt,f32,128,64,8,2,2,2,1,1,1,1,50,1024,113246208,58000932864,512,5.9722,17.6599,9711.81
1,CUTLASS,gemm,cutlass_simt_sgemm_64x128_8x2_nt_align1,passed,success,universal,serial,3072,3072,3072,f32:column,f32:row,f32:column,1,0,1,1,simt,f32,64,128,8,2,2,2,1,1,1,1,50,1024,113246208,58000932864,512,4.7983,21.9804,12087.8
1,CUTLASS,gemm,cutlass_simt_sgemm_64x64_8x2_nt_align1,passed,success,universal,serial,3072,3072,3072,f32:column,f32:row,f32:column,1,0,1,1,simt,f32,64,64,8,2,2,1,1,1,1,1,50,1024,113246208,58000932864,512,3.38941,31.1171,17112.4
1,CUTLASS,gemm,cutlass_simt_sgemm_128x32_8x2_nt_align1,passed,success,universal,serial,3072,3072,3072,f32:column,f32:row,f32:column,1,0,1,1,simt,f32,128,32,8,2,2,1,1,1,1,1,50,1024,113246208,58000932864,512,3.66229,28.7985,15837.3
1,CUTLASS,gemm,cutlass_simt_sgemm_32x128_8x2_nt_align1,passed,success,universal,serial,3072,3072,3072,f32:column,f32:row,f32:column,1,0,1,1,simt,f32,32,128,8,2,1,2,1,1,1,1,50,1024,113246208,58000932864,512,4.59849,22.9355,12613
1,CUTLASS,gemm,cutlass_simt_sgemm_256x128_8x5_nt_align1,passed,success,universal,serial,3072,3072,3072,f32:column,f32:row,f32:column,1,0,1,1,simt,f32,256,128,8,5,4,2,1,1,1,1,50,1024,113246208,58000932864,512,2.9095,36.2498,19935
1,CUTLASS,gemm,cutlass_simt_sgemm_128x256_8x5_nt_align1,passed,success,universal,serial,3072,3072,3072,f32:column,f32:row,f32:column,1,0,1,1,simt,f32,128,256,8,5,2,4,1,1,1,1,50,1024,113246208,58000932864,512,2.86261,36.8435,20261.5
1,CUTLASS,gemm,cutlass_simt_sgemm_128x128_8x5_nt_align1,passed,success,universal,serial,3072,3072,3072,f32:column,f32:row,f32:column,1,0,1,1,simt,f32,128,128,8,5,4,2,1,1,1,1,50,1024,113246208,58000932864,512,3.13226,33.6717,18517.3
1,CUTLASS,gemm,cutlass_simt_sgemm_256x128_8x4_nt_align1,passed,success,universal,serial,3072,3072,3072,f32:column,f32:row,f32:column,1,0,1,1,simt,f32,256,128,8,4,4,2,1,1,1,1,50,1024,113246208,58000932864,512,2.90595,36.2941,19959.4
1,CUTLASS,gemm,cutlass_simt_sgemm_128x256_8x4_nt_align1,passed,success,universal,serial,3072,3072,3072,f32:column,f32:row,f32:column,1,0,1,1,simt,f32,128,256,8,4,2,4,1,1,1,1,50,1024,113246208,58000932864,512,2.93906,35.8851,19734.5
1,CUTLASS,gemm,cutlass_simt_sgemm_128x128_8x4_nt_align1,passed,success,universal,serial,3072,3072,3072,f32:column,f32:row,f32:column,1,0,1,1,simt,f32,128,128,8,4,4,2,1,1,1,1,50,1024,113246208,58000932864,512,3.11744,33.8318,18605.3
1,CUTLASS,gemm,cutlass_simt_sgemm_128x64_8x5_nt_align1,passed,success,universal,serial,3072,3072,3072,f32:column,f32:row,f32:column,1,0,1,1,simt,f32,128,64,8,5,2,2,1,1,1,1,50,1024,113246208,58000932864,512,3.45903,30.4908,16768
1,CUTLASS,gemm,cutlass_simt_sgemm_64x128_8x5_nt_align1,passed,success,universal,serial,3072,3072,3072,f32:column,f32:row,f32:column,1,0,1,1,simt,f32,64,128,8,5,2,2,1,1,1,1,50,1024,113246208,58000932864,512,3.13935,33.5957,18475.5
1,CUTLASS,gemm,cutlass_simt_sgemm_64x64_8x5_nt_align1,passed,success,universal,serial,3072,3072,3072,f32:column,f32:row,f32:column,1,0,1,1,simt,f32,64,64,8,5,2,1,1,1,1,1,50,1024,113246208,58000932864,512,3.37459,31.2538,17187.5
1,CUTLASS,gemm,cutlass_simt_sgemm_128x32_8x5_nt_align1,passed,success,universal,serial,3072,3072,3072,f32:column,f32:row,f32:column,1,0,1,1,simt,f32,128,32,8,5,2,1,1,1,1,1,50,1024,113246208,58000932864,512,3.83402,27.5087,15128
1,CUTLASS,gemm,cutlass_simt_sgemm_32x128_8x5_nt_align1,passed,success,universal,serial,3072,3072,3072,f32:column,f32:row,f32:column,1,0,1,1,simt,f32,32,128,8,5,1,2,1,1,1,1,50,1024,113246208,58000932864,512,3.70217,28.4884,15666.7
