nn/cutlass_best_perf/M=4096_N=4096_K=4096/profiler_1.out



=============================
  Problem ID: 1

        Provider: [1;37mCUTLASS[0m
   OperationKind: [1;37mgemm[0m
       Operation: cutlass_simt_sgemm_128x128_8x2_nn_align1

          Status: [1;37mSuccess[0m
    Verification: [1;37mON[0m
     Disposition: [1;32mPassed[0m

reference_device: Passed
          cuBLAS: Passed

       Arguments: --gemm_kind=universal --split_k_mode=serial --m=4096 --n=4096 --k=4096 --A=f32:column --B=f32:column  \
                  --C=f32:column --alpha=1 --beta=0 --split_k_slices=1 --batch_count=1 --op_class=simt --accum=f32 --cta_m=128  \
                  --cta_n=128 --cta_k=8 --stages=2 --warps_m=4 --warps_n=2 --warps_k=1 --inst_m=1 --inst_n=1 --inst_k=1  \
                  --min_cc=50 --max_cc=1024

           Bytes: 201326592  bytes
           FLOPs: 137472507904  flops
           FLOPs/Byte: 682

         Runtime: 7.56471  ms
          Memory: 24.7862 GiB/s

            Math: 18172.9 GFLOP/s



=============================
  Problem ID: 1

        Provider: [1;37mCUTLASS[0m
   OperationKind: [1;37mgemm[0m
       Operation: cutlass_simt_sgemm_128x64_8x2_nn_align1

          Status: [1;37mSuccess[0m
    Verification: [1;37mON[0m
     Disposition: [1;32mPassed[0m

reference_device: Passed
          cuBLAS: Passed

       Arguments: --gemm_kind=universal --split_k_mode=serial --m=4096 --n=4096 --k=4096 --A=f32:column --B=f32:column  \
                  --C=f32:column --alpha=1 --beta=0 --split_k_slices=1 --batch_count=1 --op_class=simt --accum=f32 --cta_m=128  \
                  --cta_n=64 --cta_k=8 --stages=2 --warps_m=2 --warps_n=2 --warps_k=1 --inst_m=1 --inst_n=1 --inst_k=1  \
                  --min_cc=50 --max_cc=1024

           Bytes: 201326592  bytes
           FLOPs: 137472507904  flops
           FLOPs/Byte: 682

         Runtime: 7.9684  ms
          Memory: 23.5304 GiB/s

            Math: 17252.2 GFLOP/s



=============================
  Problem ID: 1

        Provider: [1;37mCUTLASS[0m
   OperationKind: [1;37mgemm[0m
       Operation: cutlass_simt_sgemm_64x128_8x2_nn_align1

          Status: [1;37mSuccess[0m
    Verification: [1;37mON[0m
     Disposition: [1;32mPassed[0m

reference_device: Passed
          cuBLAS: Passed

       Arguments: --gemm_kind=universal --split_k_mode=serial --m=4096 --n=4096 --k=4096 --A=f32:column --B=f32:column  \
                  --C=f32:column --alpha=1 --beta=0 --split_k_slices=1 --batch_count=1 --op_class=simt --accum=f32 --cta_m=64  \
                  --cta_n=128 --cta_k=8 --stages=2 --warps_m=2 --warps_n=2 --warps_k=1 --inst_m=1 --inst_n=1 --inst_k=1  \
                  --min_cc=50 --max_cc=1024

           Bytes: 201326592  bytes
           FLOPs: 137472507904  flops
           FLOPs/Byte: 682

         Runtime: 7.89405  ms
          Memory: 23.7521 GiB/s

            Math: 17414.7 GFLOP/s



=============================
  Problem ID: 1

        Provider: [1;37mCUTLASS[0m
   OperationKind: [1;37mgemm[0m
       Operation: cutlass_simt_sgemm_64x64_8x2_nn_align1

          Status: [1;37mSuccess[0m
    Verification: [1;37mON[0m
     Disposition: [1;32mPassed[0m

reference_device: Passed
          cuBLAS: Passed

       Arguments: --gemm_kind=universal --split_k_mode=serial --m=4096 --n=4096 --k=4096 --A=f32:column --B=f32:column  \
                  --C=f32:column --alpha=1 --beta=0 --split_k_slices=1 --batch_count=1 --op_class=simt --accum=f32 --cta_m=64  \
                  --cta_n=64 --cta_k=8 --stages=2 --warps_m=2 --warps_n=1 --warps_k=1 --inst_m=1 --inst_n=1 --inst_k=1  \
                  --min_cc=50 --max_cc=1024

           Bytes: 201326592  bytes
           FLOPs: 137472507904  flops
           FLOPs/Byte: 682

         Runtime: 8.35079  ms
          Memory: 22.453 GiB/s

            Math: 16462.2 GFLOP/s



=============================
  Problem ID: 1

        Provider: [1;37mCUTLASS[0m
   OperationKind: [1;37mgemm[0m
       Operation: cutlass_simt_sgemm_128x32_8x2_nn_align1

          Status: [1;37mSuccess[0m
    Verification: [1;37mON[0m
     Disposition: [1;32mPassed[0m

reference_device: Passed
          cuBLAS: Passed

       Arguments: --gemm_kind=universal --split_k_mode=serial --m=4096 --n=4096 --k=4096 --A=f32:column --B=f32:column  \
                  --C=f32:column --alpha=1 --beta=0 --split_k_slices=1 --batch_count=1 --op_class=simt --accum=f32 --cta_m=128  \
                  --cta_n=32 --cta_k=8 --stages=2 --warps_m=2 --warps_n=1 --warps_k=1 --inst_m=1 --inst_n=1 --inst_k=1  \
                  --min_cc=50 --max_cc=1024

           Bytes: 201326592  bytes
           FLOPs: 137472507904  flops
           FLOPs/Byte: 682

         Runtime: 9.39686  ms
          Memory: 19.9535 GiB/s

            Math: 14629.6 GFLOP/s



=============================
  Problem ID: 1

        Provider: [1;37mCUTLASS[0m
   OperationKind: [1;37mgemm[0m
       Operation: cutlass_simt_sgemm_32x128_8x2_nn_align1

          Status: [1;37mSuccess[0m
    Verification: [1;37mON[0m
     Disposition: [1;32mPassed[0m

reference_device: Passed
          cuBLAS: Passed

       Arguments: --gemm_kind=universal --split_k_mode=serial --m=4096 --n=4096 --k=4096 --A=f32:column --B=f32:column  \
                  --C=f32:column --alpha=1 --beta=0 --split_k_slices=1 --batch_count=1 --op_class=simt --accum=f32 --cta_m=32  \
                  --cta_n=128 --cta_k=8 --stages=2 --warps_m=1 --warps_n=2 --warps_k=1 --inst_m=1 --inst_n=1 --inst_k=1  \
                  --min_cc=50 --max_cc=1024

           Bytes: 201326592  bytes
           FLOPs: 137472507904  flops
           FLOPs/Byte: 682

         Runtime: 8.84452  ms
          Memory: 21.1996 GiB/s

            Math: 15543.2 GFLOP/s



=============================
  Problem ID: 1

        Provider: [1;37mCUTLASS[0m
   OperationKind: [1;37mgemm[0m
       Operation: cutlass_simt_sgemm_256x128_8x5_nn_align1

          Status: [1;37mSuccess[0m
    Verification: [1;37mON[0m
     Disposition: [1;32mPassed[0m

reference_device: Passed
          cuBLAS: Passed

       Arguments: --gemm_kind=universal --split_k_mode=serial --m=4096 --n=4096 --k=4096 --A=f32:column --B=f32:column  \
                  --C=f32:column --alpha=1 --beta=0 --split_k_slices=1 --batch_count=1 --op_class=simt --accum=f32 --cta_m=256  \
                  --cta_n=128 --cta_k=8 --stages=5 --warps_m=4 --warps_n=2 --warps_k=1 --inst_m=1 --inst_n=1 --inst_k=1  \
                  --min_cc=50 --max_cc=1024

           Bytes: 201326592  bytes
           FLOPs: 137472507904  flops
           FLOPs/Byte: 682

         Runtime: 6.77363  ms
          Memory: 27.6809 GiB/s

            Math: 20295.3 GFLOP/s



=============================
  Problem ID: 1

        Provider: [1;37mCUTLASS[0m
   OperationKind: [1;37mgemm[0m
       Operation: cutlass_simt_sgemm_128x256_8x5_nn_align1

          Status: [1;37mSuccess[0m
    Verification: [1;37mON[0m
     Disposition: [1;32mPassed[0m

reference_device: Passed
          cuBLAS: Passed

       Arguments: --gemm_kind=universal --split_k_mode=serial --m=4096 --n=4096 --k=4096 --A=f32:column --B=f32:column  \
                  --C=f32:column --alpha=1 --beta=0 --split_k_slices=1 --batch_count=1 --op_class=simt --accum=f32 --cta_m=128  \
                  --cta_n=256 --cta_k=8 --stages=5 --warps_m=2 --warps_n=4 --warps_k=1 --inst_m=1 --inst_n=1 --inst_k=1  \
                  --min_cc=50 --max_cc=1024

           Bytes: 201326592  bytes
           FLOPs: 137472507904  flops
           FLOPs/Byte: 682

         Runtime: 6.59983  ms
          Memory: 28.4098 GiB/s

            Math: 20829.7 GFLOP/s



=============================
  Problem ID: 1

        Provider: [1;37mCUTLASS[0m
   OperationKind: [1;37mgemm[0m
       Operation: cutlass_simt_sgemm_128x128_8x5_nn_align1

          Status: [1;37mSuccess[0m
    Verification: [1;37mON[0m
     Disposition: [1;32mPassed[0m

reference_device: Passed
          cuBLAS: Passed

       Arguments: --gemm_kind=universal --split_k_mode=serial --m=4096 --n=4096 --k=4096 --A=f32:column --B=f32:column  \
                  --C=f32:column --alpha=1 --beta=0 --split_k_slices=1 --batch_count=1 --op_class=simt --accum=f32 --cta_m=128  \
                  --cta_n=128 --cta_k=8 --stages=5 --warps_m=4 --warps_n=2 --warps_k=1 --inst_m=1 --inst_n=1 --inst_k=1  \
                  --min_cc=50 --max_cc=1024

           Bytes: 201326592  bytes
           FLOPs: 137472507904  flops
           FLOPs/Byte: 682

         Runtime: 7.82629  ms
          Memory: 23.9577 GiB/s

            Math: 17565.5 GFLOP/s



=============================
  Problem ID: 1

        Provider: [1;37mCUTLASS[0m
   OperationKind: [1;37mgemm[0m
       Operation: cutlass_simt_sgemm_256x128_8x4_nn_align1

          Status: [1;37mSuccess[0m
    Verification: [1;37mON[0m
     Disposition: [1;32mPassed[0m

reference_device: Passed
          cuBLAS: Passed

       Arguments: --gemm_kind=universal --split_k_mode=serial --m=4096 --n=4096 --k=4096 --A=f32:column --B=f32:column  \
                  --C=f32:column --alpha=1 --beta=0 --split_k_slices=1 --batch_count=1 --op_class=simt --accum=f32 --cta_m=256  \
                  --cta_n=128 --cta_k=8 --stages=4 --warps_m=4 --warps_n=2 --warps_k=1 --inst_m=1 --inst_n=1 --inst_k=1  \
                  --min_cc=50 --max_cc=1024

           Bytes: 201326592  bytes
           FLOPs: 137472507904  flops
           FLOPs/Byte: 682

         Runtime: 6.76544  ms
          Memory: 27.7144 GiB/s

            Math: 20319.8 GFLOP/s



=============================
  Problem ID: 1

        Provider: [1;37mCUTLASS[0m
   OperationKind: [1;37mgemm[0m
       Operation: cutlass_simt_sgemm_128x256_8x4_nn_align1

          Status: [1;37mSuccess[0m
    Verification: [1;37mON[0m
     Disposition: [1;32mPassed[0m

reference_device: Passed
          cuBLAS: Passed

       Arguments: --gemm_kind=universal --split_k_mode=serial --m=4096 --n=4096 --k=4096 --A=f32:column --B=f32:column  \
                  --C=f32:column --alpha=1 --beta=0 --split_k_slices=1 --batch_count=1 --op_class=simt --accum=f32 --cta_m=128  \
                  --cta_n=256 --cta_k=8 --stages=4 --warps_m=2 --warps_n=4 --warps_k=1 --inst_m=1 --inst_n=1 --inst_k=1  \
                  --min_cc=50 --max_cc=1024

           Bytes: 201326592  bytes
           FLOPs: 137472507904  flops
           FLOPs/Byte: 682

         Runtime: 6.65047  ms
          Memory: 28.1935 GiB/s

            Math: 20671.1 GFLOP/s



=============================
  Problem ID: 1

        Provider: [1;37mCUTLASS[0m
   OperationKind: [1;37mgemm[0m
       Operation: cutlass_simt_sgemm_128x128_8x4_nn_align1

          Status: [1;37mSuccess[0m
    Verification: [1;37mON[0m
     Disposition: [1;32mPassed[0m

reference_device: Passed
          cuBLAS: Passed

       Arguments: --gemm_kind=universal --split_k_mode=serial --m=4096 --n=4096 --k=4096 --A=f32:column --B=f32:column  \
                  --C=f32:column --alpha=1 --beta=0 --split_k_slices=1 --batch_count=1 --op_class=simt --accum=f32 --cta_m=128  \
                  --cta_n=128 --cta_k=8 --stages=4 --warps_m=4 --warps_n=2 --warps_k=1 --inst_m=1 --inst_n=1 --inst_k=1  \
                  --min_cc=50 --max_cc=1024

           Bytes: 201326592  bytes
           FLOPs: 137472507904  flops
           FLOPs/Byte: 682

         Runtime: 7.85213  ms
          Memory: 23.8789 GiB/s

            Math: 17507.7 GFLOP/s



=============================
  Problem ID: 1

        Provider: [1;37mCUTLASS[0m
   OperationKind: [1;37mgemm[0m
       Operation: cutlass_simt_sgemm_128x64_8x5_nn_align1

          Status: [1;37mSuccess[0m
    Verification: [1;37mON[0m
     Disposition: [1;32mPassed[0m

reference_device: Passed
          cuBLAS: Passed

       Arguments: --gemm_kind=universal --split_k_mode=serial --m=4096 --n=4096 --k=4096 --A=f32:column --B=f32:column  \
                  --C=f32:column --alpha=1 --beta=0 --split_k_slices=1 --batch_count=1 --op_class=simt --accum=f32 --cta_m=128  \
                  --cta_n=64 --cta_k=8 --stages=5 --warps_m=2 --warps_n=2 --warps_k=1 --inst_m=1 --inst_n=1 --inst_k=1  \
                  --min_cc=50 --max_cc=1024

           Bytes: 201326592  bytes
           FLOPs: 137472507904  flops
           FLOPs/Byte: 682

         Runtime: 9.65341  ms
          Memory: 19.4232 GiB/s

            Math: 14240.8 GFLOP/s



=============================
  Problem ID: 1

        Provider: [1;37mCUTLASS[0m
   OperationKind: [1;37mgemm[0m
       Operation: cutlass_simt_sgemm_64x128_8x5_nn_align1

          Status: [1;37mSuccess[0m
    Verification: [1;37mON[0m
     Disposition: [1;32mPassed[0m

reference_device: Passed
          cuBLAS: Passed

       Arguments: --gemm_kind=universal --split_k_mode=serial --m=4096 --n=4096 --k=4096 --A=f32:column --B=f32:column  \
                  --C=f32:column --alpha=1 --beta=0 --split_k_slices=1 --batch_count=1 --op_class=simt --accum=f32 --cta_m=64  \
                  --cta_n=128 --cta_k=8 --stages=5 --warps_m=2 --warps_n=2 --warps_k=1 --inst_m=1 --inst_n=1 --inst_k=1  \
                  --min_cc=50 --max_cc=1024

           Bytes: 201326592  bytes
           FLOPs: 137472507904  flops
           FLOPs/Byte: 682

         Runtime: 7.80863  ms
          Memory: 24.0119 GiB/s

            Math: 17605.2 GFLOP/s



=============================
  Problem ID: 1

        Provider: [1;37mCUTLASS[0m
   OperationKind: [1;37mgemm[0m
       Operation: cutlass_simt_sgemm_64x64_8x5_nn_align1

          Status: [1;37mSuccess[0m
    Verification: [1;37mON[0m
     Disposition: [1;32mPassed[0m

reference_device: Passed
          cuBLAS: Passed

       Arguments: --gemm_kind=universal --split_k_mode=serial --m=4096 --n=4096 --k=4096 --A=f32:column --B=f32:column  \
                  --C=f32:column --alpha=1 --beta=0 --split_k_slices=1 --batch_count=1 --op_class=simt --accum=f32 --cta_m=64  \
                  --cta_n=64 --cta_k=8 --stages=5 --warps_m=2 --warps_n=1 --warps_k=1 --inst_m=1 --inst_n=1 --inst_k=1  \
                  --min_cc=50 --max_cc=1024

           Bytes: 201326592  bytes
           FLOPs: 137472507904  flops
           FLOPs/Byte: 682

         Runtime: 8.95559  ms
          Memory: 20.9367 GiB/s

            Math: 15350.5 GFLOP/s



=============================
  Problem ID: 1

        Provider: [1;37mCUTLASS[0m
   OperationKind: [1;37mgemm[0m
       Operation: cutlass_simt_sgemm_128x32_8x5_nn_align1

          Status: [1;37mSuccess[0m
    Verification: [1;37mON[0m
     Disposition: [1;32mPassed[0m

reference_device: Passed
          cuBLAS: Passed

       Arguments: --gemm_kind=universal --split_k_mode=serial --m=4096 --n=4096 --k=4096 --A=f32:column --B=f32:column  \
                  --C=f32:column --alpha=1 --beta=0 --split_k_slices=1 --batch_count=1 --op_class=simt --accum=f32 --cta_m=128  \
                  --cta_n=32 --cta_k=8 --stages=5 --warps_m=2 --warps_n=1 --warps_k=1 --inst_m=1 --inst_n=1 --inst_k=1  \
                  --min_cc=50 --max_cc=1024

           Bytes: 201326592  bytes
           FLOPs: 137472507904  flops
           FLOPs/Byte: 682

         Runtime: 12.4827  ms
          Memory: 15.0208 GiB/s

            Math: 11013.1 GFLOP/s



=============================
  Problem ID: 1

        Provider: [1;37mCUTLASS[0m
   OperationKind: [1;37mgemm[0m
       Operation: cutlass_simt_sgemm_32x128_8x5_nn_align1

          Status: [1;37mSuccess[0m
    Verification: [1;37mON[0m
     Disposition: [1;32mPassed[0m

reference_device: Passed
          cuBLAS: Passed

       Arguments: --gemm_kind=universal --split_k_mode=serial --m=4096 --n=4096 --k=4096 --A=f32:column --B=f32:column  \
                  --C=f32:column --alpha=1 --beta=0 --split_k_slices=1 --batch_count=1 --op_class=simt --accum=f32 --cta_m=32  \
                  --cta_n=128 --cta_k=8 --stages=5 --warps_m=1 --warps_n=2 --warps_k=1 --inst_m=1 --inst_n=1 --inst_k=1  \
                  --min_cc=50 --max_cc=1024

           Bytes: 201326592  bytes
           FLOPs: 137472507904  flops
           FLOPs/Byte: 682

         Runtime: 9.13554  ms
          Memory: 20.5242 GiB/s

            Math: 15048.1 GFLOP/s


=============================

CSV Results:

Problem,Provider,OperationKind,Operation,Disposition,Status,gemm_kind,split_k_mode,m,n,k,A,B,C,alpha,beta,split_k_slices,batch_count,op_class,accum,cta_m,cta_n,cta_k,stages,warps_m,warps_n,warps_k,inst_m,inst_n,inst_k,min_cc,max_cc,Bytes,Flops,Flops/Byte,Runtime,GB/s,GFLOPs
1,CUTLASS,gemm,cutlass_simt_sgemm_128x128_8x2_nn_align1,passed,success,universal,serial,4096,4096,4096,f32:column,f32:column,f32:column,1,0,1,1,simt,f32,128,128,8,2,4,2,1,1,1,1,50,1024,201326592,137472507904,682,7.56471,24.7862,18172.9
1,CUTLASS,gemm,cutlass_simt_sgemm_128x64_8x2_nn_align1,passed,success,universal,serial,4096,4096,4096,f32:column,f32:column,f32:column,1,0,1,1,simt,f32,128,64,8,2,2,2,1,1,1,1,50,1024,201326592,137472507904,682,7.9684,23.5304,17252.2
1,CUTLASS,gemm,cutlass_simt_sgemm_64x128_8x2_nn_align1,passed,success,universal,serial,4096,4096,4096,f32:column,f32:column,f32:column,1,0,1,1,simt,f32,64,128,8,2,2,2,1,1,1,1,50,1024,201326592,137472507904,682,7.89405,23.7521,17414.7
1,CUTLASS,gemm,cutlass_simt_sgemm_64x64_8x2_nn_align1,passed,success,universal,serial,4096,4096,4096,f32:column,f32:column,f32:column,1,0,1,1,simt,f32,64,64,8,2,2,1,1,1,1,1,50,1024,201326592,137472507904,682,8.35079,22.453,16462.2
1,CUTLASS,gemm,cutlass_simt_sgemm_128x32_8x2_nn_align1,passed,success,universal,serial,4096,4096,4096,f32:column,f32:column,f32:column,1,0,1,1,simt,f32,128,32,8,2,2,1,1,1,1,1,50,1024,201326592,137472507904,682,9.39686,19.9535,14629.6
1,CUTLASS,gemm,cutlass_simt_sgemm_32x128_8x2_nn_align1,passed,success,universal,serial,4096,4096,4096,f32:column,f32:column,f32:column,1,0,1,1,simt,f32,32,128,8,2,1,2,1,1,1,1,50,1024,201326592,137472507904,682,8.84452,21.1996,15543.2
1,CUTLASS,gemm,cutlass_simt_sgemm_256x128_8x5_nn_align1,passed,success,universal,serial,4096,4096,4096,f32:column,f32:column,f32:column,1,0,1,1,simt,f32,256,128,8,5,4,2,1,1,1,1,50,1024,201326592,137472507904,682,6.77363,27.6809,20295.3
1,CUTLASS,gemm,cutlass_simt_sgemm_128x256_8x5_nn_align1,passed,success,universal,serial,4096,4096,4096,f32:column,f32:column,f32:column,1,0,1,1,simt,f32,128,256,8,5,2,4,1,1,1,1,50,1024,201326592,137472507904,682,6.59983,28.4098,20829.7
1,CUTLASS,gemm,cutlass_simt_sgemm_128x128_8x5_nn_align1,passed,success,universal,serial,4096,4096,4096,f32:column,f32:column,f32:column,1,0,1,1,simt,f32,128,128,8,5,4,2,1,1,1,1,50,1024,201326592,137472507904,682,7.82629,23.9577,17565.5
1,CUTLASS,gemm,cutlass_simt_sgemm_256x128_8x4_nn_align1,passed,success,universal,serial,4096,4096,4096,f32:column,f32:column,f32:column,1,0,1,1,simt,f32,256,128,8,4,4,2,1,1,1,1,50,1024,201326592,137472507904,682,6.76544,27.7144,20319.8
1,CUTLASS,gemm,cutlass_simt_sgemm_128x256_8x4_nn_align1,passed,success,universal,serial,4096,4096,4096,f32:column,f32:column,f32:column,1,0,1,1,simt,f32,128,256,8,4,2,4,1,1,1,1,50,1024,201326592,137472507904,682,6.65047,28.1935,20671.1
1,CUTLASS,gemm,cutlass_simt_sgemm_128x128_8x4_nn_align1,passed,success,universal,serial,4096,4096,4096,f32:column,f32:column,f32:column,1,0,1,1,simt,f32,128,128,8,4,4,2,1,1,1,1,50,1024,201326592,137472507904,682,7.85213,23.8789,17507.7
1,CUTLASS,gemm,cutlass_simt_sgemm_128x64_8x5_nn_align1,passed,success,universal,serial,4096,4096,4096,f32:column,f32:column,f32:column,1,0,1,1,simt,f32,128,64,8,5,2,2,1,1,1,1,50,1024,201326592,137472507904,682,9.65341,19.4232,14240.8
1,CUTLASS,gemm,cutlass_simt_sgemm_64x128_8x5_nn_align1,passed,success,universal,serial,4096,4096,4096,f32:column,f32:column,f32:column,1,0,1,1,simt,f32,64,128,8,5,2,2,1,1,1,1,50,1024,201326592,137472507904,682,7.80863,24.0119,17605.2
1,CUTLASS,gemm,cutlass_simt_sgemm_64x64_8x5_nn_align1,passed,success,universal,serial,4096,4096,4096,f32:column,f32:column,f32:column,1,0,1,1,simt,f32,64,64,8,5,2,1,1,1,1,1,50,1024,201326592,137472507904,682,8.95559,20.9367,15350.5
1,CUTLASS,gemm,cutlass_simt_sgemm_128x32_8x5_nn_align1,passed,success,universal,serial,4096,4096,4096,f32:column,f32:column,f32:column,1,0,1,1,simt,f32,128,32,8,5,2,1,1,1,1,1,50,1024,201326592,137472507904,682,12.4827,15.0208,11013.1
1,CUTLASS,gemm,cutlass_simt_sgemm_32x128_8x5_nn_align1,passed,success,universal,serial,4096,4096,4096,f32:column,f32:column,f32:column,1,0,1,1,simt,f32,32,128,8,5,1,2,1,1,1,1,50,1024,201326592,137472507904,682,9.13554,20.5242,15048.1
