nt/cutlass_best_perf_cuda=11.7/M=1792_N=1792_K=1792/profiler_2.out



=============================
  Problem ID: 1

        Provider: [1;37mCUTLASS[0m
   OperationKind: [1;37mgemm[0m
       Operation: cutlass_simt_sgemm_128x128_8x2_nt_align1

          Status: [1;37mSuccess[0m
    Verification: [1;37mON[0m
     Disposition: [1;32mPassed[0m

reference_device: Passed
          cuBLAS: Passed

       Arguments: --gemm_kind=universal --split_k_mode=serial --m=1792 --n=1792 --k=1792 --A=f32:column --B=f32:row --C=f32:column  \
                  --alpha=1 --beta=0 --split_k_slices=1 --batch_count=1 --op_class=simt --accum=f32 --cta_m=128 --cta_n=128  \
                  --cta_k=8 --stages=2 --warps_m=4 --warps_n=2 --warps_k=1 --inst_m=1 --inst_n=1 --inst_k=1 --min_cc=50  \
                  --max_cc=1024

           Bytes: 38535168  bytes
           FLOPs: 11515592704  flops
           FLOPs/Byte: 298

         Runtime: 0.57086  ms
          Memory: 62.8678 GiB/s

            Math: 20172.4 GFLOP/s



=============================
  Problem ID: 1

        Provider: [1;37mCUTLASS[0m
   OperationKind: [1;37mgemm[0m
       Operation: cutlass_simt_sgemm_128x64_8x2_nt_align1

          Status: [1;37mSuccess[0m
    Verification: [1;37mON[0m
     Disposition: [1;32mPassed[0m

reference_device: Passed
          cuBLAS: Passed

       Arguments: --gemm_kind=universal --split_k_mode=serial --m=1792 --n=1792 --k=1792 --A=f32:column --B=f32:row --C=f32:column  \
                  --alpha=1 --beta=0 --split_k_slices=1 --batch_count=1 --op_class=simt --accum=f32 --cta_m=128 --cta_n=64  \
                  --cta_k=8 --stages=2 --warps_m=2 --warps_n=2 --warps_k=1 --inst_m=1 --inst_n=1 --inst_k=1 --min_cc=50  \
                  --max_cc=1024

           Bytes: 38535168  bytes
           FLOPs: 11515592704  flops
           FLOPs/Byte: 298

         Runtime: 0.633805  ms
          Memory: 56.6242 GiB/s

            Math: 18169 GFLOP/s



=============================
  Problem ID: 1

        Provider: [1;37mCUTLASS[0m
   OperationKind: [1;37mgemm[0m
       Operation: cutlass_simt_sgemm_64x128_8x2_nt_align1

          Status: [1;37mSuccess[0m
    Verification: [1;37mON[0m
     Disposition: [1;32mPassed[0m

reference_device: Passed
          cuBLAS: Passed

       Arguments: --gemm_kind=universal --split_k_mode=serial --m=1792 --n=1792 --k=1792 --A=f32:column --B=f32:row --C=f32:column  \
                  --alpha=1 --beta=0 --split_k_slices=1 --batch_count=1 --op_class=simt --accum=f32 --cta_m=64 --cta_n=128  \
                  --cta_k=8 --stages=2 --warps_m=2 --warps_n=2 --warps_k=1 --inst_m=1 --inst_n=1 --inst_k=1 --min_cc=50  \
                  --max_cc=1024

           Bytes: 38535168  bytes
           FLOPs: 11515592704  flops
           FLOPs/Byte: 298

         Runtime: 0.613888  ms
          Memory: 58.4613 GiB/s

            Math: 18758.5 GFLOP/s



=============================
  Problem ID: 1

        Provider: [1;37mCUTLASS[0m
   OperationKind: [1;37mgemm[0m
       Operation: cutlass_simt_sgemm_64x64_8x2_nt_align1

          Status: [1;37mSuccess[0m
    Verification: [1;37mON[0m
     Disposition: [1;32mPassed[0m

reference_device: Passed
          cuBLAS: Passed

       Arguments: --gemm_kind=universal --split_k_mode=serial --m=1792 --n=1792 --k=1792 --A=f32:column --B=f32:row --C=f32:column  \
                  --alpha=1 --beta=0 --split_k_slices=1 --batch_count=1 --op_class=simt --accum=f32 --cta_m=64 --cta_n=64  \
                  --cta_k=8 --stages=2 --warps_m=2 --warps_n=1 --warps_k=1 --inst_m=1 --inst_n=1 --inst_k=1 --min_cc=50  \
                  --max_cc=1024

           Bytes: 38535168  bytes
           FLOPs: 11515592704  flops
           FLOPs/Byte: 298

         Runtime: 0.657275  ms
          Memory: 54.6022 GiB/s

            Math: 17520.2 GFLOP/s



=============================
  Problem ID: 1

        Provider: [1;37mCUTLASS[0m
   OperationKind: [1;37mgemm[0m
       Operation: cutlass_simt_sgemm_128x32_8x2_nt_align1

          Status: [1;37mSuccess[0m
    Verification: [1;37mON[0m
     Disposition: [1;32mPassed[0m

reference_device: Passed
          cuBLAS: Passed

       Arguments: --gemm_kind=universal --split_k_mode=serial --m=1792 --n=1792 --k=1792 --A=f32:column --B=f32:row --C=f32:column  \
                  --alpha=1 --beta=0 --split_k_slices=1 --batch_count=1 --op_class=simt --accum=f32 --cta_m=128 --cta_n=32  \
                  --cta_k=8 --stages=2 --warps_m=2 --warps_n=1 --warps_k=1 --inst_m=1 --inst_n=1 --inst_k=1 --min_cc=50  \
                  --max_cc=1024

           Bytes: 38535168  bytes
           FLOPs: 11515592704  flops
           FLOPs/Byte: 298

         Runtime: 0.733594  ms
          Memory: 48.9217 GiB/s

            Math: 15697.5 GFLOP/s



=============================
  Problem ID: 1

        Provider: [1;37mCUTLASS[0m
   OperationKind: [1;37mgemm[0m
       Operation: cutlass_simt_sgemm_32x128_8x2_nt_align1

          Status: [1;37mSuccess[0m
    Verification: [1;37mON[0m
     Disposition: [1;32mPassed[0m

reference_device: Passed
          cuBLAS: Passed

       Arguments: --gemm_kind=universal --split_k_mode=serial --m=1792 --n=1792 --k=1792 --A=f32:column --B=f32:row --C=f32:column  \
                  --alpha=1 --beta=0 --split_k_slices=1 --batch_count=1 --op_class=simt --accum=f32 --cta_m=32 --cta_n=128  \
                  --cta_k=8 --stages=2 --warps_m=1 --warps_n=2 --warps_k=1 --inst_m=1 --inst_n=1 --inst_k=1 --min_cc=50  \
                  --max_cc=1024

           Bytes: 38535168  bytes
           FLOPs: 11515592704  flops
           FLOPs/Byte: 298

         Runtime: 0.808141  ms
          Memory: 44.4089 GiB/s

            Math: 14249.5 GFLOP/s



=============================
  Problem ID: 1

        Provider: [1;37mCUTLASS[0m
   OperationKind: [1;37mgemm[0m
       Operation: cutlass_simt_sgemm_256x128_8x5_nt_align1

          Status: [1;37mSuccess[0m
    Verification: [1;37mON[0m
     Disposition: [1;32mPassed[0m

reference_device: Passed
          cuBLAS: Passed

       Arguments: --gemm_kind=universal --split_k_mode=serial --m=1792 --n=1792 --k=1792 --A=f32:column --B=f32:row --C=f32:column  \
                  --alpha=1 --beta=0 --split_k_slices=1 --batch_count=1 --op_class=simt --accum=f32 --cta_m=256 --cta_n=128  \
                  --cta_k=8 --stages=5 --warps_m=4 --warps_n=2 --warps_k=1 --inst_m=1 --inst_n=1 --inst_k=1 --min_cc=50  \
                  --max_cc=1024

           Bytes: 38535168  bytes
           FLOPs: 11515592704  flops
           FLOPs/Byte: 298

         Runtime: 0.657377  ms
          Memory: 54.5937 GiB/s

            Math: 17517.5 GFLOP/s



=============================
  Problem ID: 1

        Provider: [1;37mCUTLASS[0m
   OperationKind: [1;37mgemm[0m
       Operation: cutlass_simt_sgemm_128x256_8x5_nt_align1

          Status: [1;37mSuccess[0m
    Verification: [1;37mON[0m
     Disposition: [1;32mPassed[0m

reference_device: Passed
          cuBLAS: Passed

       Arguments: --gemm_kind=universal --split_k_mode=serial --m=1792 --n=1792 --k=1792 --A=f32:column --B=f32:row --C=f32:column  \
                  --alpha=1 --beta=0 --split_k_slices=1 --batch_count=1 --op_class=simt --accum=f32 --cta_m=128 --cta_n=256  \
                  --cta_k=8 --stages=5 --warps_m=2 --warps_n=4 --warps_k=1 --inst_m=1 --inst_n=1 --inst_k=1 --min_cc=50  \
                  --max_cc=1024

           Bytes: 38535168  bytes
           FLOPs: 11515592704  flops
           FLOPs/Byte: 298

         Runtime: 0.644946  ms
          Memory: 55.646 GiB/s

            Math: 17855.1 GFLOP/s



=============================
  Problem ID: 1

        Provider: [1;37mCUTLASS[0m
   OperationKind: [1;37mgemm[0m
       Operation: cutlass_simt_sgemm_128x128_8x5_nt_align1

          Status: [1;37mSuccess[0m
    Verification: [1;37mON[0m
     Disposition: [1;32mPassed[0m

reference_device: Passed
          cuBLAS: Passed

       Arguments: --gemm_kind=universal --split_k_mode=serial --m=1792 --n=1792 --k=1792 --A=f32:column --B=f32:row --C=f32:column  \
                  --alpha=1 --beta=0 --split_k_slices=1 --batch_count=1 --op_class=simt --accum=f32 --cta_m=128 --cta_n=128  \
                  --cta_k=8 --stages=5 --warps_m=4 --warps_n=2 --warps_k=1 --inst_m=1 --inst_n=1 --inst_k=1 --min_cc=50  \
                  --max_cc=1024

           Bytes: 38535168  bytes
           FLOPs: 11515592704  flops
           FLOPs/Byte: 298

         Runtime: 0.580516  ms
          Memory: 61.822 GiB/s

            Math: 19836.8 GFLOP/s



=============================
  Problem ID: 1

        Provider: [1;37mCUTLASS[0m
   OperationKind: [1;37mgemm[0m
       Operation: cutlass_simt_sgemm_256x128_8x4_nt_align1

          Status: [1;37mSuccess[0m
    Verification: [1;37mON[0m
     Disposition: [1;32mPassed[0m

reference_device: Passed
          cuBLAS: Passed

       Arguments: --gemm_kind=universal --split_k_mode=serial --m=1792 --n=1792 --k=1792 --A=f32:column --B=f32:row --C=f32:column  \
                  --alpha=1 --beta=0 --split_k_slices=1 --batch_count=1 --op_class=simt --accum=f32 --cta_m=256 --cta_n=128  \
                  --cta_k=8 --stages=4 --warps_m=4 --warps_n=2 --warps_k=1 --inst_m=1 --inst_n=1 --inst_k=1 --min_cc=50  \
                  --max_cc=1024

           Bytes: 38535168  bytes
           FLOPs: 11515592704  flops
           FLOPs/Byte: 298

         Runtime: 0.656148  ms
          Memory: 54.696 GiB/s

            Math: 17550.3 GFLOP/s



=============================
  Problem ID: 1

        Provider: [1;37mCUTLASS[0m
   OperationKind: [1;37mgemm[0m
       Operation: cutlass_simt_sgemm_128x256_8x4_nt_align1

          Status: [1;37mSuccess[0m
    Verification: [1;37mON[0m
     Disposition: [1;32mPassed[0m

reference_device: Passed
          cuBLAS: Passed

       Arguments: --gemm_kind=universal --split_k_mode=serial --m=1792 --n=1792 --k=1792 --A=f32:column --B=f32:row --C=f32:column  \
                  --alpha=1 --beta=0 --split_k_slices=1 --batch_count=1 --op_class=simt --accum=f32 --cta_m=128 --cta_n=256  \
                  --cta_k=8 --stages=4 --warps_m=2 --warps_n=4 --warps_k=1 --inst_m=1 --inst_n=1 --inst_k=1 --min_cc=50  \
                  --max_cc=1024

           Bytes: 38535168  bytes
           FLOPs: 11515592704  flops
           FLOPs/Byte: 298

         Runtime: 0.664617  ms
          Memory: 53.999 GiB/s

            Math: 17326.7 GFLOP/s



=============================
  Problem ID: 1

        Provider: [1;37mCUTLASS[0m
   OperationKind: [1;37mgemm[0m
       Operation: cutlass_simt_sgemm_128x128_8x4_nt_align1

          Status: [1;37mSuccess[0m
    Verification: [1;37mON[0m
     Disposition: [1;32mPassed[0m

reference_device: Passed
          cuBLAS: Passed

       Arguments: --gemm_kind=universal --split_k_mode=serial --m=1792 --n=1792 --k=1792 --A=f32:column --B=f32:row --C=f32:column  \
                  --alpha=1 --beta=0 --split_k_slices=1 --batch_count=1 --op_class=simt --accum=f32 --cta_m=128 --cta_n=128  \
                  --cta_k=8 --stages=4 --warps_m=4 --warps_n=2 --warps_k=1 --inst_m=1 --inst_n=1 --inst_k=1 --min_cc=50  \
                  --max_cc=1024

           Bytes: 38535168  bytes
           FLOPs: 11515592704  flops
           FLOPs/Byte: 298

         Runtime: 0.583772  ms
          Memory: 61.4772 GiB/s

            Math: 19726.2 GFLOP/s



=============================
  Problem ID: 1

        Provider: [1;37mCUTLASS[0m
   OperationKind: [1;37mgemm[0m
       Operation: cutlass_simt_sgemm_128x64_8x5_nt_align1

          Status: [1;37mSuccess[0m
    Verification: [1;37mON[0m
     Disposition: [1;32mPassed[0m

reference_device: Passed
          cuBLAS: Passed

       Arguments: --gemm_kind=universal --split_k_mode=serial --m=1792 --n=1792 --k=1792 --A=f32:column --B=f32:row --C=f32:column  \
                  --alpha=1 --beta=0 --split_k_slices=1 --batch_count=1 --op_class=simt --accum=f32 --cta_m=128 --cta_n=64  \
                  --cta_k=8 --stages=5 --warps_m=2 --warps_n=2 --warps_k=1 --inst_m=1 --inst_n=1 --inst_k=1 --min_cc=50  \
                  --max_cc=1024

           Bytes: 38535168  bytes
           FLOPs: 11515592704  flops
           FLOPs/Byte: 298

         Runtime: 0.669563  ms
          Memory: 53.6001 GiB/s

            Math: 17198.7 GFLOP/s



=============================
  Problem ID: 1

        Provider: [1;37mCUTLASS[0m
   OperationKind: [1;37mgemm[0m
       Operation: cutlass_simt_sgemm_64x128_8x5_nt_align1

          Status: [1;37mSuccess[0m
    Verification: [1;37mON[0m
     Disposition: [1;32mPassed[0m

reference_device: Passed
          cuBLAS: Passed

       Arguments: --gemm_kind=universal --split_k_mode=serial --m=1792 --n=1792 --k=1792 --A=f32:column --B=f32:row --C=f32:column  \
                  --alpha=1 --beta=0 --split_k_slices=1 --batch_count=1 --op_class=simt --accum=f32 --cta_m=64 --cta_n=128  \
                  --cta_k=8 --stages=5 --warps_m=2 --warps_n=2 --warps_k=1 --inst_m=1 --inst_n=1 --inst_k=1 --min_cc=50  \
                  --max_cc=1024

           Bytes: 38535168  bytes
           FLOPs: 11515592704  flops
           FLOPs/Byte: 298

         Runtime: 0.607683  ms
          Memory: 59.0583 GiB/s

            Math: 18950 GFLOP/s



=============================
  Problem ID: 1

        Provider: [1;37mCUTLASS[0m
   OperationKind: [1;37mgemm[0m
       Operation: cutlass_simt_sgemm_64x64_8x5_nt_align1

          Status: [1;37mSuccess[0m
    Verification: [1;37mON[0m
     Disposition: [1;32mPassed[0m

reference_device: Passed
          cuBLAS: Passed

       Arguments: --gemm_kind=universal --split_k_mode=serial --m=1792 --n=1792 --k=1792 --A=f32:column --B=f32:row --C=f32:column  \
                  --alpha=1 --beta=0 --split_k_slices=1 --batch_count=1 --op_class=simt --accum=f32 --cta_m=64 --cta_n=64  \
                  --cta_k=8 --stages=5 --warps_m=2 --warps_n=1 --warps_k=1 --inst_m=1 --inst_n=1 --inst_k=1 --min_cc=50  \
                  --max_cc=1024

           Bytes: 38535168  bytes
           FLOPs: 11515592704  flops
           FLOPs/Byte: 298

         Runtime: 0.713564  ms
          Memory: 50.2949 GiB/s

            Math: 16138.1 GFLOP/s



=============================
  Problem ID: 1

        Provider: [1;37mCUTLASS[0m
   OperationKind: [1;37mgemm[0m
       Operation: cutlass_simt_sgemm_128x32_8x5_nt_align1

          Status: [1;37mSuccess[0m
    Verification: [1;37mON[0m
     Disposition: [1;32mPassed[0m

reference_device: Passed
          cuBLAS: Passed

       Arguments: --gemm_kind=universal --split_k_mode=serial --m=1792 --n=1792 --k=1792 --A=f32:column --B=f32:row --C=f32:column  \
                  --alpha=1 --beta=0 --split_k_slices=1 --batch_count=1 --op_class=simt --accum=f32 --cta_m=128 --cta_n=32  \
                  --cta_k=8 --stages=5 --warps_m=2 --warps_n=1 --warps_k=1 --inst_m=1 --inst_n=1 --inst_k=1 --min_cc=50  \
                  --max_cc=1024

           Bytes: 38535168  bytes
           FLOPs: 11515592704  flops
           FLOPs/Byte: 298

         Runtime: 0.754012  ms
          Memory: 47.5969 GiB/s

            Math: 15272.4 GFLOP/s



=============================
  Problem ID: 1

        Provider: [1;37mCUTLASS[0m
   OperationKind: [1;37mgemm[0m
       Operation: cutlass_simt_sgemm_32x128_8x5_nt_align1

          Status: [1;37mSuccess[0m
    Verification: [1;37mON[0m
     Disposition: [1;32mPassed[0m

reference_device: Passed
          cuBLAS: Passed

       Arguments: --gemm_kind=universal --split_k_mode=serial --m=1792 --n=1792 --k=1792 --A=f32:column --B=f32:row --C=f32:column  \
                  --alpha=1 --beta=0 --split_k_slices=1 --batch_count=1 --op_class=simt --accum=f32 --cta_m=32 --cta_n=128  \
                  --cta_k=8 --stages=5 --warps_m=1 --warps_n=2 --warps_k=1 --inst_m=1 --inst_n=1 --inst_k=1 --min_cc=50  \
                  --max_cc=1024

           Bytes: 38535168  bytes
           FLOPs: 11515592704  flops
           FLOPs/Byte: 298

         Runtime: 0.799652  ms
          Memory: 44.8804 GiB/s

            Math: 14400.8 GFLOP/s


=============================

CSV Results:

Problem,Provider,OperationKind,Operation,Disposition,Status,gemm_kind,split_k_mode,m,n,k,A,B,C,alpha,beta,split_k_slices,batch_count,op_class,accum,cta_m,cta_n,cta_k,stages,warps_m,warps_n,warps_k,inst_m,inst_n,inst_k,min_cc,max_cc,Bytes,Flops,Flops/Byte,Runtime,GB/s,GFLOPs
1,CUTLASS,gemm,cutlass_simt_sgemm_128x128_8x2_nt_align1,passed,success,universal,serial,1792,1792,1792,f32:column,f32:row,f32:column,1,0,1,1,simt,f32,128,128,8,2,4,2,1,1,1,1,50,1024,38535168,11515592704,298,0.57086,62.8678,20172.4
1,CUTLASS,gemm,cutlass_simt_sgemm_128x64_8x2_nt_align1,passed,success,universal,serial,1792,1792,1792,f32:column,f32:row,f32:column,1,0,1,1,simt,f32,128,64,8,2,2,2,1,1,1,1,50,1024,38535168,11515592704,298,0.633805,56.6242,18169
1,CUTLASS,gemm,cutlass_simt_sgemm_64x128_8x2_nt_align1,passed,success,universal,serial,1792,1792,1792,f32:column,f32:row,f32:column,1,0,1,1,simt,f32,64,128,8,2,2,2,1,1,1,1,50,1024,38535168,11515592704,298,0.613888,58.4613,18758.5
1,CUTLASS,gemm,cutlass_simt_sgemm_64x64_8x2_nt_align1,passed,success,universal,serial,1792,1792,1792,f32:column,f32:row,f32:column,1,0,1,1,simt,f32,64,64,8,2,2,1,1,1,1,1,50,1024,38535168,11515592704,298,0.657275,54.6022,17520.2
1,CUTLASS,gemm,cutlass_simt_sgemm_128x32_8x2_nt_align1,passed,success,universal,serial,1792,1792,1792,f32:column,f32:row,f32:column,1,0,1,1,simt,f32,128,32,8,2,2,1,1,1,1,1,50,1024,38535168,11515592704,298,0.733594,48.9217,15697.5
1,CUTLASS,gemm,cutlass_simt_sgemm_32x128_8x2_nt_align1,passed,success,universal,serial,1792,1792,1792,f32:column,f32:row,f32:column,1,0,1,1,simt,f32,32,128,8,2,1,2,1,1,1,1,50,1024,38535168,11515592704,298,0.808141,44.4089,14249.5
1,CUTLASS,gemm,cutlass_simt_sgemm_256x128_8x5_nt_align1,passed,success,universal,serial,1792,1792,1792,f32:column,f32:row,f32:column,1,0,1,1,simt,f32,256,128,8,5,4,2,1,1,1,1,50,1024,38535168,11515592704,298,0.657377,54.5937,17517.5
1,CUTLASS,gemm,cutlass_simt_sgemm_128x256_8x5_nt_align1,passed,success,universal,serial,1792,1792,1792,f32:column,f32:row,f32:column,1,0,1,1,simt,f32,128,256,8,5,2,4,1,1,1,1,50,1024,38535168,11515592704,298,0.644946,55.646,17855.1
1,CUTLASS,gemm,cutlass_simt_sgemm_128x128_8x5_nt_align1,passed,success,universal,serial,1792,1792,1792,f32:column,f32:row,f32:column,1,0,1,1,simt,f32,128,128,8,5,4,2,1,1,1,1,50,1024,38535168,11515592704,298,0.580516,61.822,19836.8
1,CUTLASS,gemm,cutlass_simt_sgemm_256x128_8x4_nt_align1,passed,success,universal,serial,1792,1792,1792,f32:column,f32:row,f32:column,1,0,1,1,simt,f32,256,128,8,4,4,2,1,1,1,1,50,1024,38535168,11515592704,298,0.656148,54.696,17550.3
1,CUTLASS,gemm,cutlass_simt_sgemm_128x256_8x4_nt_align1,passed,success,universal,serial,1792,1792,1792,f32:column,f32:row,f32:column,1,0,1,1,simt,f32,128,256,8,4,2,4,1,1,1,1,50,1024,38535168,11515592704,298,0.664617,53.999,17326.7
1,CUTLASS,gemm,cutlass_simt_sgemm_128x128_8x4_nt_align1,passed,success,universal,serial,1792,1792,1792,f32:column,f32:row,f32:column,1,0,1,1,simt,f32,128,128,8,4,4,2,1,1,1,1,50,1024,38535168,11515592704,298,0.583772,61.4772,19726.2
1,CUTLASS,gemm,cutlass_simt_sgemm_128x64_8x5_nt_align1,passed,success,universal,serial,1792,1792,1792,f32:column,f32:row,f32:column,1,0,1,1,simt,f32,128,64,8,5,2,2,1,1,1,1,50,1024,38535168,11515592704,298,0.669563,53.6001,17198.7
1,CUTLASS,gemm,cutlass_simt_sgemm_64x128_8x5_nt_align1,passed,success,universal,serial,1792,1792,1792,f32:column,f32:row,f32:column,1,0,1,1,simt,f32,64,128,8,5,2,2,1,1,1,1,50,1024,38535168,11515592704,298,0.607683,59.0583,18950
1,CUTLASS,gemm,cutlass_simt_sgemm_64x64_8x5_nt_align1,passed,success,universal,serial,1792,1792,1792,f32:column,f32:row,f32:column,1,0,1,1,simt,f32,64,64,8,5,2,1,1,1,1,1,50,1024,38535168,11515592704,298,0.713564,50.2949,16138.1
1,CUTLASS,gemm,cutlass_simt_sgemm_128x32_8x5_nt_align1,passed,success,universal,serial,1792,1792,1792,f32:column,f32:row,f32:column,1,0,1,1,simt,f32,128,32,8,5,2,1,1,1,1,1,50,1024,38535168,11515592704,298,0.754012,47.5969,15272.4
1,CUTLASS,gemm,cutlass_simt_sgemm_32x128_8x5_nt_align1,passed,success,universal,serial,1792,1792,1792,f32:column,f32:row,f32:column,1,0,1,1,simt,f32,32,128,8,5,1,2,1,1,1,1,50,1024,38535168,11515592704,298,0.799652,44.8804,14400.8
