template-based/nt/cutlass_best_perf_cuda=11.7/M=968_N=1376_K=2616/profiler_3.out



=============================
  Problem ID: 1

        Provider: [1;37mCUTLASS[0m
   OperationKind: [1;37mgemm[0m
       Operation: cutlass_simt_sgemm_128x128_8x2_nt_align1

          Status: [1;37mSuccess[0m
    Verification: [1;37mON[0m
     Disposition: [1;32mPassed[0m

reference_device: Passed
          cuBLAS: Passed

       Arguments: --gemm_kind=universal --split_k_mode=serial --m=968 --n=1376 --k=2616 --A=f32:column --B=f32:row --C=f32:column  \
                  --alpha=1 --beta=0 --split_k_slices=1 --batch_count=1 --op_class=simt --accum=f32 --cta_m=128 --cta_n=128  \
                  --cta_k=8 --stages=2 --warps_m=4 --warps_n=2 --warps_k=1 --inst_m=1 --inst_n=1 --inst_k=1 --min_cc=50  \
                  --max_cc=1024

           Bytes: 29855488  bytes
           FLOPs: 6971520512  flops
           FLOPs/Byte: 233

         Runtime: 0.601866  ms
          Memory: 46.1981 GiB/s

            Math: 11583.2 GFLOP/s



=============================
  Problem ID: 1

        Provider: [1;37mCUTLASS[0m
   OperationKind: [1;37mgemm[0m
       Operation: cutlass_simt_sgemm_128x64_8x2_nt_align1

          Status: [1;37mSuccess[0m
    Verification: [1;37mON[0m
     Disposition: [1;32mPassed[0m

reference_device: Passed
          cuBLAS: Passed

       Arguments: --gemm_kind=universal --split_k_mode=serial --m=968 --n=1376 --k=2616 --A=f32:column --B=f32:row --C=f32:column  \
                  --alpha=1 --beta=0 --split_k_slices=1 --batch_count=1 --op_class=simt --accum=f32 --cta_m=128 --cta_n=64  \
                  --cta_k=8 --stages=2 --warps_m=2 --warps_n=2 --warps_k=1 --inst_m=1 --inst_n=1 --inst_k=1 --min_cc=50  \
                  --max_cc=1024

           Bytes: 29855488  bytes
           FLOPs: 6971520512  flops
           FLOPs/Byte: 233

         Runtime: 0.827054  ms
          Memory: 33.6194 GiB/s

            Math: 8429.34 GFLOP/s



=============================
  Problem ID: 1

        Provider: [1;37mCUTLASS[0m
   OperationKind: [1;37mgemm[0m
       Operation: cutlass_simt_sgemm_64x128_8x2_nt_align1

          Status: [1;37mSuccess[0m
    Verification: [1;37mON[0m
     Disposition: [1;32mPassed[0m

reference_device: Passed
          cuBLAS: Passed

       Arguments: --gemm_kind=universal --split_k_mode=serial --m=968 --n=1376 --k=2616 --A=f32:column --B=f32:row --C=f32:column  \
                  --alpha=1 --beta=0 --split_k_slices=1 --batch_count=1 --op_class=simt --accum=f32 --cta_m=64 --cta_n=128  \
                  --cta_k=8 --stages=2 --warps_m=2 --warps_n=2 --warps_k=1 --inst_m=1 --inst_n=1 --inst_k=1 --min_cc=50  \
                  --max_cc=1024

           Bytes: 29855488  bytes
           FLOPs: 6971520512  flops
           FLOPs/Byte: 233

         Runtime: 0.440218  ms
          Memory: 63.1622 GiB/s

            Math: 15836.5 GFLOP/s



=============================
  Problem ID: 1

        Provider: [1;37mCUTLASS[0m
   OperationKind: [1;37mgemm[0m
       Operation: cutlass_simt_sgemm_64x64_8x2_nt_align1

          Status: [1;37mSuccess[0m
    Verification: [1;37mON[0m
     Disposition: [1;32mPassed[0m

reference_device: Passed
          cuBLAS: Passed

       Arguments: --gemm_kind=universal --split_k_mode=serial --m=968 --n=1376 --k=2616 --A=f32:column --B=f32:row --C=f32:column  \
                  --alpha=1 --beta=0 --split_k_slices=1 --batch_count=1 --op_class=simt --accum=f32 --cta_m=64 --cta_n=64  \
                  --cta_k=8 --stages=2 --warps_m=2 --warps_n=1 --warps_k=1 --inst_m=1 --inst_n=1 --inst_k=1 --min_cc=50  \
                  --max_cc=1024

           Bytes: 29855488  bytes
           FLOPs: 6971520512  flops
           FLOPs/Byte: 233

         Runtime: 0.442808  ms
          Memory: 62.7926 GiB/s

            Math: 15743.9 GFLOP/s



=============================
  Problem ID: 1

        Provider: [1;37mCUTLASS[0m
   OperationKind: [1;37mgemm[0m
       Operation: cutlass_simt_sgemm_128x32_8x2_nt_align1

          Status: [1;37mSuccess[0m
    Verification: [1;37mON[0m
     Disposition: [1;32mPassed[0m

reference_device: Passed
          cuBLAS: Passed

       Arguments: --gemm_kind=universal --split_k_mode=serial --m=968 --n=1376 --k=2616 --A=f32:column --B=f32:row --C=f32:column  \
                  --alpha=1 --beta=0 --split_k_slices=1 --batch_count=1 --op_class=simt --accum=f32 --cta_m=128 --cta_n=32  \
                  --cta_k=8 --stages=2 --warps_m=2 --warps_n=1 --warps_k=1 --inst_m=1 --inst_n=1 --inst_k=1 --min_cc=50  \
                  --max_cc=1024

           Bytes: 29855488  bytes
           FLOPs: 6971520512  flops
           FLOPs/Byte: 233

         Runtime: 1.13682  ms
          Memory: 24.4586 GiB/s

            Math: 6132.45 GFLOP/s



=============================
  Problem ID: 1

        Provider: [1;37mCUTLASS[0m
   OperationKind: [1;37mgemm[0m
       Operation: cutlass_simt_sgemm_32x128_8x2_nt_align1

          Status: [1;37mSuccess[0m
    Verification: [1;37mON[0m
     Disposition: [1;32mPassed[0m

reference_device: Passed
          cuBLAS: Passed

       Arguments: --gemm_kind=universal --split_k_mode=serial --m=968 --n=1376 --k=2616 --A=f32:column --B=f32:row --C=f32:column  \
                  --alpha=1 --beta=0 --split_k_slices=1 --batch_count=1 --op_class=simt --accum=f32 --cta_m=32 --cta_n=128  \
                  --cta_k=8 --stages=2 --warps_m=1 --warps_n=2 --warps_k=1 --inst_m=1 --inst_n=1 --inst_k=1 --min_cc=50  \
                  --max_cc=1024

           Bytes: 29855488  bytes
           FLOPs: 6971520512  flops
           FLOPs/Byte: 233

         Runtime: 0.554476  ms
          Memory: 50.1467 GiB/s

            Math: 12573.2 GFLOP/s



=============================
  Problem ID: 1

        Provider: [1;37mCUTLASS[0m
   OperationKind: [1;37mgemm[0m
       Operation: cutlass_simt_sgemm_256x128_8x5_nt_align1

          Status: [1;37mSuccess[0m
    Verification: [1;37mON[0m
     Disposition: [1;32mPassed[0m

reference_device: Passed
          cuBLAS: Passed

       Arguments: --gemm_kind=universal --split_k_mode=serial --m=968 --n=1376 --k=2616 --A=f32:column --B=f32:row --C=f32:column  \
                  --alpha=1 --beta=0 --split_k_slices=1 --batch_count=1 --op_class=simt --accum=f32 --cta_m=256 --cta_n=128  \
                  --cta_k=8 --stages=5 --warps_m=4 --warps_n=2 --warps_k=1 --inst_m=1 --inst_n=1 --inst_k=1 --min_cc=50  \
                  --max_cc=1024

           Bytes: 29855488  bytes
           FLOPs: 6971520512  flops
           FLOPs/Byte: 233

         Runtime: 0.473393  ms
          Memory: 58.7357 GiB/s

            Math: 14726.7 GFLOP/s



=============================
  Problem ID: 1

        Provider: [1;37mCUTLASS[0m
   OperationKind: [1;37mgemm[0m
       Operation: cutlass_simt_sgemm_128x256_8x5_nt_align1

          Status: [1;37mSuccess[0m
    Verification: [1;37mON[0m
     Disposition: [1;32mPassed[0m

reference_device: Passed
          cuBLAS: Passed

       Arguments: --gemm_kind=universal --split_k_mode=serial --m=968 --n=1376 --k=2616 --A=f32:column --B=f32:row --C=f32:column  \
                  --alpha=1 --beta=0 --split_k_slices=1 --batch_count=1 --op_class=simt --accum=f32 --cta_m=128 --cta_n=256  \
                  --cta_k=8 --stages=5 --warps_m=2 --warps_n=4 --warps_k=1 --inst_m=1 --inst_n=1 --inst_k=1 --min_cc=50  \
                  --max_cc=1024

           Bytes: 29855488  bytes
           FLOPs: 6971520512  flops
           FLOPs/Byte: 233

         Runtime: 1.0128  ms
          Memory: 27.4537 GiB/s

            Math: 6883.42 GFLOP/s



=============================
  Problem ID: 1

        Provider: [1;37mCUTLASS[0m
   OperationKind: [1;37mgemm[0m
       Operation: cutlass_simt_sgemm_128x128_8x5_nt_align1

          Status: [1;37mSuccess[0m
    Verification: [1;37mON[0m
     Disposition: [1;32mPassed[0m

reference_device: Passed
          cuBLAS: Passed

       Arguments: --gemm_kind=universal --split_k_mode=serial --m=968 --n=1376 --k=2616 --A=f32:column --B=f32:row --C=f32:column  \
                  --alpha=1 --beta=0 --split_k_slices=1 --batch_count=1 --op_class=simt --accum=f32 --cta_m=128 --cta_n=128  \
                  --cta_k=8 --stages=5 --warps_m=4 --warps_n=2 --warps_k=1 --inst_m=1 --inst_n=1 --inst_k=1 --min_cc=50  \
                  --max_cc=1024

           Bytes: 29855488  bytes
           FLOPs: 6971520512  flops
           FLOPs/Byte: 233

         Runtime: 0.576727  ms
          Memory: 48.2119 GiB/s

            Math: 12088.1 GFLOP/s



=============================
  Problem ID: 1

        Provider: [1;37mCUTLASS[0m
   OperationKind: [1;37mgemm[0m
       Operation: cutlass_simt_sgemm_256x128_8x4_nt_align1

          Status: [1;37mSuccess[0m
    Verification: [1;37mON[0m
     Disposition: [1;32mPassed[0m

reference_device: Passed
          cuBLAS: Passed

       Arguments: --gemm_kind=universal --split_k_mode=serial --m=968 --n=1376 --k=2616 --A=f32:column --B=f32:row --C=f32:column  \
                  --alpha=1 --beta=0 --split_k_slices=1 --batch_count=1 --op_class=simt --accum=f32 --cta_m=256 --cta_n=128  \
                  --cta_k=8 --stages=4 --warps_m=4 --warps_n=2 --warps_k=1 --inst_m=1 --inst_n=1 --inst_k=1 --min_cc=50  \
                  --max_cc=1024

           Bytes: 29855488  bytes
           FLOPs: 6971520512  flops
           FLOPs/Byte: 233

         Runtime: 0.474266  ms
          Memory: 58.6277 GiB/s

            Math: 14699.6 GFLOP/s



=============================
  Problem ID: 1

        Provider: [1;37mCUTLASS[0m
   OperationKind: [1;37mgemm[0m
       Operation: cutlass_simt_sgemm_128x256_8x4_nt_align1

          Status: [1;37mSuccess[0m
    Verification: [1;37mON[0m
     Disposition: [1;32mPassed[0m

reference_device: Passed
          cuBLAS: Passed

       Arguments: --gemm_kind=universal --split_k_mode=serial --m=968 --n=1376 --k=2616 --A=f32:column --B=f32:row --C=f32:column  \
                  --alpha=1 --beta=0 --split_k_slices=1 --batch_count=1 --op_class=simt --accum=f32 --cta_m=128 --cta_n=256  \
                  --cta_k=8 --stages=4 --warps_m=2 --warps_n=4 --warps_k=1 --inst_m=1 --inst_n=1 --inst_k=1 --min_cc=50  \
                  --max_cc=1024

           Bytes: 29855488  bytes
           FLOPs: 6971520512  flops
           FLOPs/Byte: 233

         Runtime: 1.00583  ms
          Memory: 27.6438 GiB/s

            Math: 6931.08 GFLOP/s



=============================
  Problem ID: 1

        Provider: [1;37mCUTLASS[0m
   OperationKind: [1;37mgemm[0m
       Operation: cutlass_simt_sgemm_128x128_8x4_nt_align1

          Status: [1;37mSuccess[0m
    Verification: [1;37mON[0m
     Disposition: [1;32mPassed[0m

reference_device: Passed
          cuBLAS: Passed

       Arguments: --gemm_kind=universal --split_k_mode=serial --m=968 --n=1376 --k=2616 --A=f32:column --B=f32:row --C=f32:column  \
                  --alpha=1 --beta=0 --split_k_slices=1 --batch_count=1 --op_class=simt --accum=f32 --cta_m=128 --cta_n=128  \
                  --cta_k=8 --stages=4 --warps_m=4 --warps_n=2 --warps_k=1 --inst_m=1 --inst_n=1 --inst_k=1 --min_cc=50  \
                  --max_cc=1024

           Bytes: 29855488  bytes
           FLOPs: 6971520512  flops
           FLOPs/Byte: 233

         Runtime: 0.551014  ms
          Memory: 50.4616 GiB/s

            Math: 12652.2 GFLOP/s



=============================
  Problem ID: 1

        Provider: [1;37mCUTLASS[0m
   OperationKind: [1;37mgemm[0m
       Operation: cutlass_simt_sgemm_128x64_8x5_nt_align1

          Status: [1;37mSuccess[0m
    Verification: [1;37mON[0m
     Disposition: [1;32mPassed[0m

reference_device: Passed
          cuBLAS: Passed

       Arguments: --gemm_kind=universal --split_k_mode=serial --m=968 --n=1376 --k=2616 --A=f32:column --B=f32:row --C=f32:column  \
                  --alpha=1 --beta=0 --split_k_slices=1 --batch_count=1 --op_class=simt --accum=f32 --cta_m=128 --cta_n=64  \
                  --cta_k=8 --stages=5 --warps_m=2 --warps_n=2 --warps_k=1 --inst_m=1 --inst_n=1 --inst_k=1 --min_cc=50  \
                  --max_cc=1024

           Bytes: 29855488  bytes
           FLOPs: 6971520512  flops
           FLOPs/Byte: 233

         Runtime: 0.472801  ms
          Memory: 58.8093 GiB/s

            Math: 14745.1 GFLOP/s



=============================
  Problem ID: 1

        Provider: [1;37mCUTLASS[0m
   OperationKind: [1;37mgemm[0m
       Operation: cutlass_simt_sgemm_64x128_8x5_nt_align1

          Status: [1;37mSuccess[0m
    Verification: [1;37mON[0m
     Disposition: [1;32mPassed[0m

reference_device: Passed
          cuBLAS: Passed

       Arguments: --gemm_kind=universal --split_k_mode=serial --m=968 --n=1376 --k=2616 --A=f32:column --B=f32:row --C=f32:column  \
                  --alpha=1 --beta=0 --split_k_slices=1 --batch_count=1 --op_class=simt --accum=f32 --cta_m=64 --cta_n=128  \
                  --cta_k=8 --stages=5 --warps_m=2 --warps_n=2 --warps_k=1 --inst_m=1 --inst_n=1 --inst_k=1 --min_cc=50  \
                  --max_cc=1024

           Bytes: 29855488  bytes
           FLOPs: 6971520512  flops
           FLOPs/Byte: 233

         Runtime: 0.894963  ms
          Memory: 31.0684 GiB/s

            Math: 7789.73 GFLOP/s



=============================
  Problem ID: 1

        Provider: [1;37mCUTLASS[0m
   OperationKind: [1;37mgemm[0m
       Operation: cutlass_simt_sgemm_64x64_8x5_nt_align1

          Status: [1;37mSuccess[0m
    Verification: [1;37mON[0m
     Disposition: [1;32mPassed[0m

reference_device: Passed
          cuBLAS: Passed

       Arguments: --gemm_kind=universal --split_k_mode=serial --m=968 --n=1376 --k=2616 --A=f32:column --B=f32:row --C=f32:column  \
                  --alpha=1 --beta=0 --split_k_slices=1 --batch_count=1 --op_class=simt --accum=f32 --cta_m=64 --cta_n=64  \
                  --cta_k=8 --stages=5 --warps_m=2 --warps_n=1 --warps_k=1 --inst_m=1 --inst_n=1 --inst_k=1 --min_cc=50  \
                  --max_cc=1024

           Bytes: 29855488  bytes
           FLOPs: 6971520512  flops
           FLOPs/Byte: 233

         Runtime: 0.482714  ms
          Memory: 57.6016 GiB/s

            Math: 14442.4 GFLOP/s



=============================
  Problem ID: 1

        Provider: [1;37mCUTLASS[0m
   OperationKind: [1;37mgemm[0m
       Operation: cutlass_simt_sgemm_128x32_8x5_nt_align1

          Status: [1;37mSuccess[0m
    Verification: [1;37mON[0m
     Disposition: [1;32mPassed[0m

reference_device: Passed
          cuBLAS: Passed

       Arguments: --gemm_kind=universal --split_k_mode=serial --m=968 --n=1376 --k=2616 --A=f32:column --B=f32:row --C=f32:column  \
                  --alpha=1 --beta=0 --split_k_slices=1 --batch_count=1 --op_class=simt --accum=f32 --cta_m=128 --cta_n=32  \
                  --cta_k=8 --stages=5 --warps_m=2 --warps_n=1 --warps_k=1 --inst_m=1 --inst_n=1 --inst_k=1 --min_cc=50  \
                  --max_cc=1024

           Bytes: 29855488  bytes
           FLOPs: 6971520512  flops
           FLOPs/Byte: 233

         Runtime: 0.511713  ms
          Memory: 54.3372 GiB/s

            Math: 13623.9 GFLOP/s



=============================
  Problem ID: 1

        Provider: [1;37mCUTLASS[0m
   OperationKind: [1;37mgemm[0m
       Operation: cutlass_simt_sgemm_32x128_8x5_nt_align1

          Status: [1;37mSuccess[0m
    Verification: [1;37mON[0m
     Disposition: [1;32mPassed[0m

reference_device: Passed
          cuBLAS: Passed

       Arguments: --gemm_kind=universal --split_k_mode=serial --m=968 --n=1376 --k=2616 --A=f32:column --B=f32:row --C=f32:column  \
                  --alpha=1 --beta=0 --split_k_slices=1 --batch_count=1 --op_class=simt --accum=f32 --cta_m=32 --cta_n=128  \
                  --cta_k=8 --stages=5 --warps_m=1 --warps_n=2 --warps_k=1 --inst_m=1 --inst_n=1 --inst_k=1 --min_cc=50  \
                  --max_cc=1024

           Bytes: 29855488  bytes
           FLOPs: 6971520512  flops
           FLOPs/Byte: 233

         Runtime: 1.06658  ms
          Memory: 26.0694 GiB/s

            Math: 6536.34 GFLOP/s


=============================

CSV Results:

Problem,Provider,OperationKind,Operation,Disposition,Status,gemm_kind,split_k_mode,m,n,k,A,B,C,alpha,beta,split_k_slices,batch_count,op_class,accum,cta_m,cta_n,cta_k,stages,warps_m,warps_n,warps_k,inst_m,inst_n,inst_k,min_cc,max_cc,Bytes,Flops,Flops/Byte,Runtime,GB/s,GFLOPs
1,CUTLASS,gemm,cutlass_simt_sgemm_128x128_8x2_nt_align1,passed,success,universal,serial,968,1376,2616,f32:column,f32:row,f32:column,1,0,1,1,simt,f32,128,128,8,2,4,2,1,1,1,1,50,1024,29855488,6971520512,233,0.601866,46.1981,11583.2
1,CUTLASS,gemm,cutlass_simt_sgemm_128x64_8x2_nt_align1,passed,success,universal,serial,968,1376,2616,f32:column,f32:row,f32:column,1,0,1,1,simt,f32,128,64,8,2,2,2,1,1,1,1,50,1024,29855488,6971520512,233,0.827054,33.6194,8429.34
1,CUTLASS,gemm,cutlass_simt_sgemm_64x128_8x2_nt_align1,passed,success,universal,serial,968,1376,2616,f32:column,f32:row,f32:column,1,0,1,1,simt,f32,64,128,8,2,2,2,1,1,1,1,50,1024,29855488,6971520512,233,0.440218,63.1622,15836.5
1,CUTLASS,gemm,cutlass_simt_sgemm_64x64_8x2_nt_align1,passed,success,universal,serial,968,1376,2616,f32:column,f32:row,f32:column,1,0,1,1,simt,f32,64,64,8,2,2,1,1,1,1,1,50,1024,29855488,6971520512,233,0.442808,62.7926,15743.9
1,CUTLASS,gemm,cutlass_simt_sgemm_128x32_8x2_nt_align1,passed,success,universal,serial,968,1376,2616,f32:column,f32:row,f32:column,1,0,1,1,simt,f32,128,32,8,2,2,1,1,1,1,1,50,1024,29855488,6971520512,233,1.13682,24.4586,6132.45
1,CUTLASS,gemm,cutlass_simt_sgemm_32x128_8x2_nt_align1,passed,success,universal,serial,968,1376,2616,f32:column,f32:row,f32:column,1,0,1,1,simt,f32,32,128,8,2,1,2,1,1,1,1,50,1024,29855488,6971520512,233,0.554476,50.1467,12573.2
1,CUTLASS,gemm,cutlass_simt_sgemm_256x128_8x5_nt_align1,passed,success,universal,serial,968,1376,2616,f32:column,f32:row,f32:column,1,0,1,1,simt,f32,256,128,8,5,4,2,1,1,1,1,50,1024,29855488,6971520512,233,0.473393,58.7357,14726.7
1,CUTLASS,gemm,cutlass_simt_sgemm_128x256_8x5_nt_align1,passed,success,universal,serial,968,1376,2616,f32:column,f32:row,f32:column,1,0,1,1,simt,f32,128,256,8,5,2,4,1,1,1,1,50,1024,29855488,6971520512,233,1.0128,27.4537,6883.42
1,CUTLASS,gemm,cutlass_simt_sgemm_128x128_8x5_nt_align1,passed,success,universal,serial,968,1376,2616,f32:column,f32:row,f32:column,1,0,1,1,simt,f32,128,128,8,5,4,2,1,1,1,1,50,1024,29855488,6971520512,233,0.576727,48.2119,12088.1
1,CUTLASS,gemm,cutlass_simt_sgemm_256x128_8x4_nt_align1,passed,success,universal,serial,968,1376,2616,f32:column,f32:row,f32:column,1,0,1,1,simt,f32,256,128,8,4,4,2,1,1,1,1,50,1024,29855488,6971520512,233,0.474266,58.6277,14699.6
1,CUTLASS,gemm,cutlass_simt_sgemm_128x256_8x4_nt_align1,passed,success,universal,serial,968,1376,2616,f32:column,f32:row,f32:column,1,0,1,1,simt,f32,128,256,8,4,2,4,1,1,1,1,50,1024,29855488,6971520512,233,1.00583,27.6438,6931.08
1,CUTLASS,gemm,cutlass_simt_sgemm_128x128_8x4_nt_align1,passed,success,universal,serial,968,1376,2616,f32:column,f32:row,f32:column,1,0,1,1,simt,f32,128,128,8,4,4,2,1,1,1,1,50,1024,29855488,6971520512,233,0.551014,50.4616,12652.2
1,CUTLASS,gemm,cutlass_simt_sgemm_128x64_8x5_nt_align1,passed,success,universal,serial,968,1376,2616,f32:column,f32:row,f32:column,1,0,1,1,simt,f32,128,64,8,5,2,2,1,1,1,1,50,1024,29855488,6971520512,233,0.472801,58.8093,14745.1
1,CUTLASS,gemm,cutlass_simt_sgemm_64x128_8x5_nt_align1,passed,success,universal,serial,968,1376,2616,f32:column,f32:row,f32:column,1,0,1,1,simt,f32,64,128,8,5,2,2,1,1,1,1,50,1024,29855488,6971520512,233,0.894963,31.0684,7789.73
1,CUTLASS,gemm,cutlass_simt_sgemm_64x64_8x5_nt_align1,passed,success,universal,serial,968,1376,2616,f32:column,f32:row,f32:column,1,0,1,1,simt,f32,64,64,8,5,2,1,1,1,1,1,50,1024,29855488,6971520512,233,0.482714,57.6016,14442.4
1,CUTLASS,gemm,cutlass_simt_sgemm_128x32_8x5_nt_align1,passed,success,universal,serial,968,1376,2616,f32:column,f32:row,f32:column,1,0,1,1,simt,f32,128,32,8,5,2,1,1,1,1,1,50,1024,29855488,6971520512,233,0.511713,54.3372,13623.9
1,CUTLASS,gemm,cutlass_simt_sgemm_32x128_8x5_nt_align1,passed,success,universal,serial,968,1376,2616,f32:column,f32:row,f32:column,1,0,1,1,simt,f32,32,128,8,5,1,2,1,1,1,1,50,1024,29855488,6971520512,233,1.06658,26.0694,6536.34
