template-based/nn/cutlass_best_perf/M=512_N=384_K=256/profiler_3.out



=============================
  Problem ID: 1

        Provider: [1;37mCUTLASS[0m
   OperationKind: [1;37mgemm[0m
       Operation: cutlass_simt_sgemm_128x128_8x2_nn_align1

          Status: [1;37mSuccess[0m
    Verification: [1;37mON[0m
     Disposition: [1;32mPassed[0m

reference_device: Passed
          cuBLAS: Passed

       Arguments: --gemm_kind=universal --split_k_mode=serial --m=512 --n=384 --k=256 --A=f32:column --B=f32:column --C=f32:column  \
                  --alpha=1 --beta=0 --split_k_slices=1 --batch_count=1 --op_class=simt --accum=f32 --cta_m=128 --cta_n=128  \
                  --cta_k=8 --stages=2 --warps_m=4 --warps_n=2 --warps_k=1 --inst_m=1 --inst_n=1 --inst_k=1 --min_cc=50  \
                  --max_cc=1024

           Bytes: 1703936  bytes
           FLOPs: 101056512  flops
           FLOPs/Byte: 59

         Runtime: 0.0331571  ms
          Memory: 47.8604 GiB/s

            Math: 3047.81 GFLOP/s



=============================
  Problem ID: 1

        Provider: [1;37mCUTLASS[0m
   OperationKind: [1;37mgemm[0m
       Operation: cutlass_simt_sgemm_128x64_8x2_nn_align1

          Status: [1;37mSuccess[0m
    Verification: [1;37mON[0m
     Disposition: [1;32mPassed[0m

reference_device: Passed
          cuBLAS: Passed

       Arguments: --gemm_kind=universal --split_k_mode=serial --m=512 --n=384 --k=256 --A=f32:column --B=f32:column --C=f32:column  \
                  --alpha=1 --beta=0 --split_k_slices=1 --batch_count=1 --op_class=simt --accum=f32 --cta_m=128 --cta_n=64  \
                  --cta_k=8 --stages=2 --warps_m=2 --warps_n=2 --warps_k=1 --inst_m=1 --inst_n=1 --inst_k=1 --min_cc=50  \
                  --max_cc=1024

           Bytes: 1703936  bytes
           FLOPs: 101056512  flops
           FLOPs/Byte: 59

         Runtime: 0.0227021  ms
          Memory: 69.9017 GiB/s

            Math: 4451.42 GFLOP/s



=============================
  Problem ID: 1

        Provider: [1;37mCUTLASS[0m
   OperationKind: [1;37mgemm[0m
       Operation: cutlass_simt_sgemm_64x128_8x2_nn_align1

          Status: [1;37mSuccess[0m
    Verification: [1;37mON[0m
     Disposition: [1;32mPassed[0m

reference_device: Passed
          cuBLAS: Passed

       Arguments: --gemm_kind=universal --split_k_mode=serial --m=512 --n=384 --k=256 --A=f32:column --B=f32:column --C=f32:column  \
                  --alpha=1 --beta=0 --split_k_slices=1 --batch_count=1 --op_class=simt --accum=f32 --cta_m=64 --cta_n=128  \
                  --cta_k=8 --stages=2 --warps_m=2 --warps_n=2 --warps_k=1 --inst_m=1 --inst_n=1 --inst_k=1 --min_cc=50  \
                  --max_cc=1024

           Bytes: 1703936  bytes
           FLOPs: 101056512  flops
           FLOPs/Byte: 59

         Runtime: 0.0239309  ms
          Memory: 66.3124 GiB/s

            Math: 4222.85 GFLOP/s



=============================
  Problem ID: 1

        Provider: [1;37mCUTLASS[0m
   OperationKind: [1;37mgemm[0m
       Operation: cutlass_simt_sgemm_64x64_8x2_nn_align1

          Status: [1;37mSuccess[0m
    Verification: [1;37mON[0m
     Disposition: [1;32mPassed[0m

reference_device: Passed
          cuBLAS: Passed

       Arguments: --gemm_kind=universal --split_k_mode=serial --m=512 --n=384 --k=256 --A=f32:column --B=f32:column --C=f32:column  \
                  --alpha=1 --beta=0 --split_k_slices=1 --batch_count=1 --op_class=simt --accum=f32 --cta_m=64 --cta_n=64  \
                  --cta_k=8 --stages=2 --warps_m=2 --warps_n=1 --warps_k=1 --inst_m=1 --inst_n=1 --inst_k=1 --min_cc=50  \
                  --max_cc=1024

           Bytes: 1703936  bytes
           FLOPs: 101056512  flops
           FLOPs/Byte: 59

         Runtime: 0.0236339  ms
          Memory: 67.1456 GiB/s

            Math: 4275.91 GFLOP/s



=============================
  Problem ID: 1

        Provider: [1;37mCUTLASS[0m
   OperationKind: [1;37mgemm[0m
       Operation: cutlass_simt_sgemm_128x32_8x2_nn_align1

          Status: [1;37mSuccess[0m
    Verification: [1;37mON[0m
     Disposition: [1;32mPassed[0m

reference_device: Passed
          cuBLAS: Passed

       Arguments: --gemm_kind=universal --split_k_mode=serial --m=512 --n=384 --k=256 --A=f32:column --B=f32:column --C=f32:column  \
                  --alpha=1 --beta=0 --split_k_slices=1 --batch_count=1 --op_class=simt --accum=f32 --cta_m=128 --cta_n=32  \
                  --cta_k=8 --stages=2 --warps_m=2 --warps_n=1 --warps_k=1 --inst_m=1 --inst_n=1 --inst_k=1 --min_cc=50  \
                  --max_cc=1024

           Bytes: 1703936  bytes
           FLOPs: 101056512  flops
           FLOPs/Byte: 59

         Runtime: 0.0266752  ms
          Memory: 59.4902 GiB/s

            Math: 3788.41 GFLOP/s



=============================
  Problem ID: 1

        Provider: [1;37mCUTLASS[0m
   OperationKind: [1;37mgemm[0m
       Operation: cutlass_simt_sgemm_32x128_8x2_nn_align1

          Status: [1;37mSuccess[0m
    Verification: [1;37mON[0m
     Disposition: [1;32mPassed[0m

reference_device: Passed
          cuBLAS: Passed

       Arguments: --gemm_kind=universal --split_k_mode=serial --m=512 --n=384 --k=256 --A=f32:column --B=f32:column --C=f32:column  \
                  --alpha=1 --beta=0 --split_k_slices=1 --batch_count=1 --op_class=simt --accum=f32 --cta_m=32 --cta_n=128  \
                  --cta_k=8 --stages=2 --warps_m=1 --warps_n=2 --warps_k=1 --inst_m=1 --inst_n=1 --inst_k=1 --min_cc=50  \
                  --max_cc=1024

           Bytes: 1703936  bytes
           FLOPs: 101056512  flops
           FLOPs/Byte: 59

         Runtime: 0.0241869  ms
          Memory: 65.6105 GiB/s

            Math: 4178.15 GFLOP/s



=============================
  Problem ID: 1

        Provider: [1;37mCUTLASS[0m
   OperationKind: [1;37mgemm[0m
       Operation: cutlass_simt_sgemm_256x128_8x5_nn_align1

          Status: [1;37mSuccess[0m
    Verification: [1;37mON[0m
     Disposition: [1;32mPassed[0m

reference_device: Passed
          cuBLAS: Passed

       Arguments: --gemm_kind=universal --split_k_mode=serial --m=512 --n=384 --k=256 --A=f32:column --B=f32:column --C=f32:column  \
                  --alpha=1 --beta=0 --split_k_slices=1 --batch_count=1 --op_class=simt --accum=f32 --cta_m=256 --cta_n=128  \
                  --cta_k=8 --stages=5 --warps_m=4 --warps_n=2 --warps_k=1 --inst_m=1 --inst_n=1 --inst_k=1 --min_cc=50  \
                  --max_cc=1024

           Bytes: 1703936  bytes
           FLOPs: 101056512  flops
           FLOPs/Byte: 59

         Runtime: 0.056576  ms
          Memory: 28.0492 GiB/s

            Math: 1786.21 GFLOP/s



=============================
  Problem ID: 1

        Provider: [1;37mCUTLASS[0m
   OperationKind: [1;37mgemm[0m
       Operation: cutlass_simt_sgemm_128x256_8x5_nn_align1

          Status: [1;37mSuccess[0m
    Verification: [1;37mON[0m
     Disposition: [1;32mPassed[0m

reference_device: Passed
          cuBLAS: Passed

       Arguments: --gemm_kind=universal --split_k_mode=serial --m=512 --n=384 --k=256 --A=f32:column --B=f32:column --C=f32:column  \
                  --alpha=1 --beta=0 --split_k_slices=1 --batch_count=1 --op_class=simt --accum=f32 --cta_m=128 --cta_n=256  \
                  --cta_k=8 --stages=5 --warps_m=2 --warps_n=4 --warps_k=1 --inst_m=1 --inst_n=1 --inst_k=1 --min_cc=50  \
                  --max_cc=1024

           Bytes: 1703936  bytes
           FLOPs: 101056512  flops
           FLOPs/Byte: 59

         Runtime: 0.0544973  ms
          Memory: 29.1191 GiB/s

            Math: 1854.34 GFLOP/s



=============================
  Problem ID: 1

        Provider: [1;37mCUTLASS[0m
   OperationKind: [1;37mgemm[0m
       Operation: cutlass_simt_sgemm_128x128_8x5_nn_align1

          Status: [1;37mSuccess[0m
    Verification: [1;37mON[0m
     Disposition: [1;32mPassed[0m

reference_device: Passed
          cuBLAS: Passed

       Arguments: --gemm_kind=universal --split_k_mode=serial --m=512 --n=384 --k=256 --A=f32:column --B=f32:column --C=f32:column  \
                  --alpha=1 --beta=0 --split_k_slices=1 --batch_count=1 --op_class=simt --accum=f32 --cta_m=128 --cta_n=128  \
                  --cta_k=8 --stages=5 --warps_m=4 --warps_n=2 --warps_k=1 --inst_m=1 --inst_n=1 --inst_k=1 --min_cc=50  \
                  --max_cc=1024

           Bytes: 1703936  bytes
           FLOPs: 101056512  flops
           FLOPs/Byte: 59

         Runtime: 0.0336691  ms
          Memory: 47.1326 GiB/s

            Math: 3001.46 GFLOP/s



=============================
  Problem ID: 1

        Provider: [1;37mCUTLASS[0m
   OperationKind: [1;37mgemm[0m
       Operation: cutlass_simt_sgemm_256x128_8x4_nn_align1

          Status: [1;37mSuccess[0m
    Verification: [1;37mON[0m
     Disposition: [1;32mPassed[0m

reference_device: Passed
          cuBLAS: Passed

       Arguments: --gemm_kind=universal --split_k_mode=serial --m=512 --n=384 --k=256 --A=f32:column --B=f32:column --C=f32:column  \
                  --alpha=1 --beta=0 --split_k_slices=1 --batch_count=1 --op_class=simt --accum=f32 --cta_m=256 --cta_n=128  \
                  --cta_k=8 --stages=4 --warps_m=4 --warps_n=2 --warps_k=1 --inst_m=1 --inst_n=1 --inst_k=1 --min_cc=50  \
                  --max_cc=1024

           Bytes: 1703936  bytes
           FLOPs: 101056512  flops
           FLOPs/Byte: 59

         Runtime: 0.0562483  ms
          Memory: 28.2126 GiB/s

            Math: 1796.61 GFLOP/s



=============================
  Problem ID: 1

        Provider: [1;37mCUTLASS[0m
   OperationKind: [1;37mgemm[0m
       Operation: cutlass_simt_sgemm_128x256_8x4_nn_align1

          Status: [1;37mSuccess[0m
    Verification: [1;37mON[0m
     Disposition: [1;32mPassed[0m

reference_device: Passed
          cuBLAS: Passed

       Arguments: --gemm_kind=universal --split_k_mode=serial --m=512 --n=384 --k=256 --A=f32:column --B=f32:column --C=f32:column  \
                  --alpha=1 --beta=0 --split_k_slices=1 --batch_count=1 --op_class=simt --accum=f32 --cta_m=128 --cta_n=256  \
                  --cta_k=8 --stages=4 --warps_m=2 --warps_n=4 --warps_k=1 --inst_m=1 --inst_n=1 --inst_k=1 --min_cc=50  \
                  --max_cc=1024

           Bytes: 1703936  bytes
           FLOPs: 101056512  flops
           FLOPs/Byte: 59

         Runtime: 0.0545075  ms
          Memory: 29.1137 GiB/s

            Math: 1853.99 GFLOP/s



=============================
  Problem ID: 1

        Provider: [1;37mCUTLASS[0m
   OperationKind: [1;37mgemm[0m
       Operation: cutlass_simt_sgemm_128x128_8x4_nn_align1

          Status: [1;37mSuccess[0m
    Verification: [1;37mON[0m
     Disposition: [1;32mPassed[0m

reference_device: Passed
          cuBLAS: Passed

       Arguments: --gemm_kind=universal --split_k_mode=serial --m=512 --n=384 --k=256 --A=f32:column --B=f32:column --C=f32:column  \
                  --alpha=1 --beta=0 --split_k_slices=1 --batch_count=1 --op_class=simt --accum=f32 --cta_m=128 --cta_n=128  \
                  --cta_k=8 --stages=4 --warps_m=4 --warps_n=2 --warps_k=1 --inst_m=1 --inst_n=1 --inst_k=1 --min_cc=50  \
                  --max_cc=1024

           Bytes: 1703936  bytes
           FLOPs: 101056512  flops
           FLOPs/Byte: 59

         Runtime: 0.0334029  ms
          Memory: 47.5083 GiB/s

            Math: 3025.38 GFLOP/s



=============================
  Problem ID: 1

        Provider: [1;37mCUTLASS[0m
   OperationKind: [1;37mgemm[0m
       Operation: cutlass_simt_sgemm_128x64_8x5_nn_align1

          Status: [1;37mSuccess[0m
    Verification: [1;37mON[0m
     Disposition: [1;32mPassed[0m

reference_device: Passed
          cuBLAS: Passed

       Arguments: --gemm_kind=universal --split_k_mode=serial --m=512 --n=384 --k=256 --A=f32:column --B=f32:column --C=f32:column  \
                  --alpha=1 --beta=0 --split_k_slices=1 --batch_count=1 --op_class=simt --accum=f32 --cta_m=128 --cta_n=64  \
                  --cta_k=8 --stages=5 --warps_m=2 --warps_n=2 --warps_k=1 --inst_m=1 --inst_n=1 --inst_k=1 --min_cc=50  \
                  --max_cc=1024

           Bytes: 1703936  bytes
           FLOPs: 101056512  flops
           FLOPs/Byte: 59

         Runtime: 0.022784  ms
          Memory: 69.6504 GiB/s

            Math: 4435.42 GFLOP/s



=============================
  Problem ID: 1

        Provider: [1;37mCUTLASS[0m
   OperationKind: [1;37mgemm[0m
       Operation: cutlass_simt_sgemm_64x128_8x5_nn_align1

          Status: [1;37mSuccess[0m
    Verification: [1;37mON[0m
     Disposition: [1;32mPassed[0m

reference_device: Passed
          cuBLAS: Passed

       Arguments: --gemm_kind=universal --split_k_mode=serial --m=512 --n=384 --k=256 --A=f32:column --B=f32:column --C=f32:column  \
                  --alpha=1 --beta=0 --split_k_slices=1 --batch_count=1 --op_class=simt --accum=f32 --cta_m=64 --cta_n=128  \
                  --cta_k=8 --stages=5 --warps_m=2 --warps_n=2 --warps_k=1 --inst_m=1 --inst_n=1 --inst_k=1 --min_cc=50  \
                  --max_cc=1024

           Bytes: 1703936  bytes
           FLOPs: 101056512  flops
           FLOPs/Byte: 59

         Runtime: 0.0201626  ms
          Memory: 78.706 GiB/s

            Math: 5012.09 GFLOP/s



=============================
  Problem ID: 1

        Provider: [1;37mCUTLASS[0m
   OperationKind: [1;37mgemm[0m
       Operation: cutlass_simt_sgemm_64x64_8x5_nn_align1

          Status: [1;37mSuccess[0m
    Verification: [1;37mON[0m
     Disposition: [1;32mPassed[0m

reference_device: Passed
          cuBLAS: Passed

       Arguments: --gemm_kind=universal --split_k_mode=serial --m=512 --n=384 --k=256 --A=f32:column --B=f32:column --C=f32:column  \
                  --alpha=1 --beta=0 --split_k_slices=1 --batch_count=1 --op_class=simt --accum=f32 --cta_m=64 --cta_n=64  \
                  --cta_k=8 --stages=5 --warps_m=2 --warps_n=1 --warps_k=1 --inst_m=1 --inst_n=1 --inst_k=1 --min_cc=50  \
                  --max_cc=1024

           Bytes: 1703936  bytes
           FLOPs: 101056512  flops
           FLOPs/Byte: 59

         Runtime: 0.0185446  ms
          Memory: 85.5727 GiB/s

            Math: 5449.36 GFLOP/s



=============================
  Problem ID: 1

        Provider: [1;37mCUTLASS[0m
   OperationKind: [1;37mgemm[0m
       Operation: cutlass_simt_sgemm_128x32_8x5_nn_align1

          Status: [1;37mSuccess[0m
    Verification: [1;37mON[0m
     Disposition: [1;32mPassed[0m

reference_device: Passed
          cuBLAS: Passed

       Arguments: --gemm_kind=universal --split_k_mode=serial --m=512 --n=384 --k=256 --A=f32:column --B=f32:column --C=f32:column  \
                  --alpha=1 --beta=0 --split_k_slices=1 --batch_count=1 --op_class=simt --accum=f32 --cta_m=128 --cta_n=32  \
                  --cta_k=8 --stages=5 --warps_m=2 --warps_n=1 --warps_k=1 --inst_m=1 --inst_n=1 --inst_k=1 --min_cc=50  \
                  --max_cc=1024

           Bytes: 1703936  bytes
           FLOPs: 101056512  flops
           FLOPs/Byte: 59

         Runtime: 0.0197222  ms
          Memory: 80.4632 GiB/s

            Math: 5123.99 GFLOP/s



=============================
  Problem ID: 1

        Provider: [1;37mCUTLASS[0m
   OperationKind: [1;37mgemm[0m
       Operation: cutlass_simt_sgemm_32x128_8x5_nn_align1

          Status: [1;37mSuccess[0m
    Verification: [1;37mON[0m
     Disposition: [1;32mPassed[0m

reference_device: Passed
          cuBLAS: Passed

       Arguments: --gemm_kind=universal --split_k_mode=serial --m=512 --n=384 --k=256 --A=f32:column --B=f32:column --C=f32:column  \
                  --alpha=1 --beta=0 --split_k_slices=1 --batch_count=1 --op_class=simt --accum=f32 --cta_m=32 --cta_n=128  \
                  --cta_k=8 --stages=5 --warps_m=1 --warps_n=2 --warps_k=1 --inst_m=1 --inst_n=1 --inst_k=1 --min_cc=50  \
                  --max_cc=1024

           Bytes: 1703936  bytes
           FLOPs: 101056512  flops
           FLOPs/Byte: 59

         Runtime: 0.0198349  ms
          Memory: 80.0062 GiB/s

            Math: 5094.89 GFLOP/s


=============================

CSV Results:

Problem,Provider,OperationKind,Operation,Disposition,Status,gemm_kind,split_k_mode,m,n,k,A,B,C,alpha,beta,split_k_slices,batch_count,op_class,accum,cta_m,cta_n,cta_k,stages,warps_m,warps_n,warps_k,inst_m,inst_n,inst_k,min_cc,max_cc,Bytes,Flops,Flops/Byte,Runtime,GB/s,GFLOPs
1,CUTLASS,gemm,cutlass_simt_sgemm_128x128_8x2_nn_align1,passed,success,universal,serial,512,384,256,f32:column,f32:column,f32:column,1,0,1,1,simt,f32,128,128,8,2,4,2,1,1,1,1,50,1024,1703936,101056512,59,0.0331571,47.8604,3047.81
1,CUTLASS,gemm,cutlass_simt_sgemm_128x64_8x2_nn_align1,passed,success,universal,serial,512,384,256,f32:column,f32:column,f32:column,1,0,1,1,simt,f32,128,64,8,2,2,2,1,1,1,1,50,1024,1703936,101056512,59,0.0227021,69.9017,4451.42
1,CUTLASS,gemm,cutlass_simt_sgemm_64x128_8x2_nn_align1,passed,success,universal,serial,512,384,256,f32:column,f32:column,f32:column,1,0,1,1,simt,f32,64,128,8,2,2,2,1,1,1,1,50,1024,1703936,101056512,59,0.0239309,66.3124,4222.85
1,CUTLASS,gemm,cutlass_simt_sgemm_64x64_8x2_nn_align1,passed,success,universal,serial,512,384,256,f32:column,f32:column,f32:column,1,0,1,1,simt,f32,64,64,8,2,2,1,1,1,1,1,50,1024,1703936,101056512,59,0.0236339,67.1456,4275.91
1,CUTLASS,gemm,cutlass_simt_sgemm_128x32_8x2_nn_align1,passed,success,universal,serial,512,384,256,f32:column,f32:column,f32:column,1,0,1,1,simt,f32,128,32,8,2,2,1,1,1,1,1,50,1024,1703936,101056512,59,0.0266752,59.4902,3788.41
1,CUTLASS,gemm,cutlass_simt_sgemm_32x128_8x2_nn_align1,passed,success,universal,serial,512,384,256,f32:column,f32:column,f32:column,1,0,1,1,simt,f32,32,128,8,2,1,2,1,1,1,1,50,1024,1703936,101056512,59,0.0241869,65.6105,4178.15
1,CUTLASS,gemm,cutlass_simt_sgemm_256x128_8x5_nn_align1,passed,success,universal,serial,512,384,256,f32:column,f32:column,f32:column,1,0,1,1,simt,f32,256,128,8,5,4,2,1,1,1,1,50,1024,1703936,101056512,59,0.056576,28.0492,1786.21
1,CUTLASS,gemm,cutlass_simt_sgemm_128x256_8x5_nn_align1,passed,success,universal,serial,512,384,256,f32:column,f32:column,f32:column,1,0,1,1,simt,f32,128,256,8,5,2,4,1,1,1,1,50,1024,1703936,101056512,59,0.0544973,29.1191,1854.34
1,CUTLASS,gemm,cutlass_simt_sgemm_128x128_8x5_nn_align1,passed,success,universal,serial,512,384,256,f32:column,f32:column,f32:column,1,0,1,1,simt,f32,128,128,8,5,4,2,1,1,1,1,50,1024,1703936,101056512,59,0.0336691,47.1326,3001.46
1,CUTLASS,gemm,cutlass_simt_sgemm_256x128_8x4_nn_align1,passed,success,universal,serial,512,384,256,f32:column,f32:column,f32:column,1,0,1,1,simt,f32,256,128,8,4,4,2,1,1,1,1,50,1024,1703936,101056512,59,0.0562483,28.2126,1796.61
1,CUTLASS,gemm,cutlass_simt_sgemm_128x256_8x4_nn_align1,passed,success,universal,serial,512,384,256,f32:column,f32:column,f32:column,1,0,1,1,simt,f32,128,256,8,4,2,4,1,1,1,1,50,1024,1703936,101056512,59,0.0545075,29.1137,1853.99
1,CUTLASS,gemm,cutlass_simt_sgemm_128x128_8x4_nn_align1,passed,success,universal,serial,512,384,256,f32:column,f32:column,f32:column,1,0,1,1,simt,f32,128,128,8,4,4,2,1,1,1,1,50,1024,1703936,101056512,59,0.0334029,47.5083,3025.38
1,CUTLASS,gemm,cutlass_simt_sgemm_128x64_8x5_nn_align1,passed,success,universal,serial,512,384,256,f32:column,f32:column,f32:column,1,0,1,1,simt,f32,128,64,8,5,2,2,1,1,1,1,50,1024,1703936,101056512,59,0.022784,69.6504,4435.42
1,CUTLASS,gemm,cutlass_simt_sgemm_64x128_8x5_nn_align1,passed,success,universal,serial,512,384,256,f32:column,f32:column,f32:column,1,0,1,1,simt,f32,64,128,8,5,2,2,1,1,1,1,50,1024,1703936,101056512,59,0.0201626,78.706,5012.09
1,CUTLASS,gemm,cutlass_simt_sgemm_64x64_8x5_nn_align1,passed,success,universal,serial,512,384,256,f32:column,f32:column,f32:column,1,0,1,1,simt,f32,64,64,8,5,2,1,1,1,1,1,50,1024,1703936,101056512,59,0.0185446,85.5727,5449.36
1,CUTLASS,gemm,cutlass_simt_sgemm_128x32_8x5_nn_align1,passed,success,universal,serial,512,384,256,f32:column,f32:column,f32:column,1,0,1,1,simt,f32,128,32,8,5,2,1,1,1,1,1,50,1024,1703936,101056512,59,0.0197222,80.4632,5123.99
1,CUTLASS,gemm,cutlass_simt_sgemm_32x128_8x5_nn_align1,passed,success,universal,serial,512,384,256,f32:column,f32:column,f32:column,1,0,1,1,simt,f32,32,128,8,5,1,2,1,1,1,1,50,1024,1703936,101056512,59,0.0198349,80.0062,5094.89
