template-based/nn/cutlass_best_perf_async_only/M=4096_N=4096_K=4096/profiler_1.out



=============================
  Problem ID: 1

        Provider: [1;37mCUTLASS[0m
   OperationKind: [1;37mgemm[0m
       Operation: cutlass_simt_sgemm_128x128_8x2_nn_align1

          Status: [1;37mSuccess[0m
    Verification: [1;37mON[0m
     Disposition: [1;32mPassed[0m

reference_device: Passed
          cuBLAS: Passed

       Arguments: --gemm_kind=universal --split_k_mode=serial --m=4096 --n=4096 --k=4096 --A=f32:column --B=f32:column  \
                  --C=f32:column --alpha=1 --beta=0 --split_k_slices=1 --batch_count=1 --op_class=simt --accum=f32 --cta_m=128  \
                  --cta_n=128 --cta_k=8 --stages=2 --warps_m=4 --warps_n=2 --warps_k=1 --inst_m=1 --inst_n=1 --inst_k=1  \
                  --min_cc=50 --max_cc=1024

           Bytes: 201326592  bytes
           FLOPs: 137472507904  flops
           FLOPs/Byte: 682

         Runtime: 7.55414  ms
          Memory: 24.8208 GiB/s

            Math: 18198.3 GFLOP/s



=============================
  Problem ID: 1

        Provider: [1;37mCUTLASS[0m
   OperationKind: [1;37mgemm[0m
       Operation: cutlass_simt_sgemm_128x64_8x2_nn_align1

          Status: [1;37mSuccess[0m
    Verification: [1;37mON[0m
     Disposition: [1;32mPassed[0m

reference_device: Passed
          cuBLAS: Passed

       Arguments: --gemm_kind=universal --split_k_mode=serial --m=4096 --n=4096 --k=4096 --A=f32:column --B=f32:column  \
                  --C=f32:column --alpha=1 --beta=0 --split_k_slices=1 --batch_count=1 --op_class=simt --accum=f32 --cta_m=128  \
                  --cta_n=64 --cta_k=8 --stages=2 --warps_m=2 --warps_n=2 --warps_k=1 --inst_m=1 --inst_n=1 --inst_k=1  \
                  --min_cc=50 --max_cc=1024

           Bytes: 201326592  bytes
           FLOPs: 137472507904  flops
           FLOPs/Byte: 682

         Runtime: 8.00519  ms
          Memory: 23.4223 GiB/s

            Math: 17172.9 GFLOP/s



=============================
  Problem ID: 1

        Provider: [1;37mCUTLASS[0m
   OperationKind: [1;37mgemm[0m
       Operation: cutlass_simt_sgemm_64x128_8x2_nn_align1

          Status: [1;37mSuccess[0m
    Verification: [1;37mON[0m
     Disposition: [1;32mPassed[0m

reference_device: Passed
          cuBLAS: Passed

       Arguments: --gemm_kind=universal --split_k_mode=serial --m=4096 --n=4096 --k=4096 --A=f32:column --B=f32:column  \
                  --C=f32:column --alpha=1 --beta=0 --split_k_slices=1 --batch_count=1 --op_class=simt --accum=f32 --cta_m=64  \
                  --cta_n=128 --cta_k=8 --stages=2 --warps_m=2 --warps_n=2 --warps_k=1 --inst_m=1 --inst_n=1 --inst_k=1  \
                  --min_cc=50 --max_cc=1024

           Bytes: 201326592  bytes
           FLOPs: 137472507904  flops
           FLOPs/Byte: 682

         Runtime: 7.94911  ms
          Memory: 23.5876 GiB/s

            Math: 17294.1 GFLOP/s



=============================
  Problem ID: 1

        Provider: [1;37mCUTLASS[0m
   OperationKind: [1;37mgemm[0m
       Operation: cutlass_simt_sgemm_64x64_8x2_nn_align1

          Status: [1;37mSuccess[0m
    Verification: [1;37mON[0m
     Disposition: [1;32mPassed[0m

reference_device: Passed
          cuBLAS: Passed

       Arguments: --gemm_kind=universal --split_k_mode=serial --m=4096 --n=4096 --k=4096 --A=f32:column --B=f32:column  \
                  --C=f32:column --alpha=1 --beta=0 --split_k_slices=1 --batch_count=1 --op_class=simt --accum=f32 --cta_m=64  \
                  --cta_n=64 --cta_k=8 --stages=2 --warps_m=2 --warps_n=1 --warps_k=1 --inst_m=1 --inst_n=1 --inst_k=1  \
                  --min_cc=50 --max_cc=1024

           Bytes: 201326592  bytes
           FLOPs: 137472507904  flops
           FLOPs/Byte: 682

         Runtime: 8.41807  ms
          Memory: 22.2735 GiB/s

            Math: 16330.6 GFLOP/s



=============================
  Problem ID: 1

        Provider: [1;37mCUTLASS[0m
   OperationKind: [1;37mgemm[0m
       Operation: cutlass_simt_sgemm_128x32_8x2_nn_align1

          Status: [1;37mSuccess[0m
    Verification: [1;37mON[0m
     Disposition: [1;32mPassed[0m

reference_device: Passed
          cuBLAS: Passed

       Arguments: --gemm_kind=universal --split_k_mode=serial --m=4096 --n=4096 --k=4096 --A=f32:column --B=f32:column  \
                  --C=f32:column --alpha=1 --beta=0 --split_k_slices=1 --batch_count=1 --op_class=simt --accum=f32 --cta_m=128  \
                  --cta_n=32 --cta_k=8 --stages=2 --warps_m=2 --warps_n=1 --warps_k=1 --inst_m=1 --inst_n=1 --inst_k=1  \
                  --min_cc=50 --max_cc=1024

           Bytes: 201326592  bytes
           FLOPs: 137472507904  flops
           FLOPs/Byte: 682

         Runtime: 9.41276  ms
          Memory: 19.9198 GiB/s

            Math: 14604.9 GFLOP/s



=============================
  Problem ID: 1

        Provider: [1;37mCUTLASS[0m
   OperationKind: [1;37mgemm[0m
       Operation: cutlass_simt_sgemm_32x128_8x2_nn_align1

          Status: [1;37mSuccess[0m
    Verification: [1;37mON[0m
     Disposition: [1;32mPassed[0m

reference_device: Passed
          cuBLAS: Passed

       Arguments: --gemm_kind=universal --split_k_mode=serial --m=4096 --n=4096 --k=4096 --A=f32:column --B=f32:column  \
                  --C=f32:column --alpha=1 --beta=0 --split_k_slices=1 --batch_count=1 --op_class=simt --accum=f32 --cta_m=32  \
                  --cta_n=128 --cta_k=8 --stages=2 --warps_m=1 --warps_n=2 --warps_k=1 --inst_m=1 --inst_n=1 --inst_k=1  \
                  --min_cc=50 --max_cc=1024

           Bytes: 201326592  bytes
           FLOPs: 137472507904  flops
           FLOPs/Byte: 682

         Runtime: 8.82993  ms
          Memory: 21.2346 GiB/s

            Math: 15568.9 GFLOP/s



=============================
  Problem ID: 1

        Provider: [1;37mCUTLASS[0m
   OperationKind: [1;37mgemm[0m
       Operation: cutlass_simt_sgemm_256x128_8x5_nn_align1

          Status: [1;37mSuccess[0m
    Verification: [1;37mON[0m
     Disposition: [1;32mPassed[0m

reference_device: Passed
          cuBLAS: Passed

       Arguments: --gemm_kind=universal --split_k_mode=serial --m=4096 --n=4096 --k=4096 --A=f32:column --B=f32:column  \
                  --C=f32:column --alpha=1 --beta=0 --split_k_slices=1 --batch_count=1 --op_class=simt --accum=f32 --cta_m=256  \
                  --cta_n=128 --cta_k=8 --stages=5 --warps_m=4 --warps_n=2 --warps_k=1 --inst_m=1 --inst_n=1 --inst_k=1  \
                  --min_cc=50 --max_cc=1024

           Bytes: 201326592  bytes
           FLOPs: 137472507904  flops
           FLOPs/Byte: 682

         Runtime: 6.76247  ms
          Memory: 27.7266 GiB/s

            Math: 20328.8 GFLOP/s



=============================
  Problem ID: 1

        Provider: [1;37mCUTLASS[0m
   OperationKind: [1;37mgemm[0m
       Operation: cutlass_simt_sgemm_128x256_8x5_nn_align1

          Status: [1;37mSuccess[0m
    Verification: [1;37mON[0m
     Disposition: [1;32mPassed[0m

reference_device: Passed
          cuBLAS: Passed

       Arguments: --gemm_kind=universal --split_k_mode=serial --m=4096 --n=4096 --k=4096 --A=f32:column --B=f32:column  \
                  --C=f32:column --alpha=1 --beta=0 --split_k_slices=1 --batch_count=1 --op_class=simt --accum=f32 --cta_m=128  \
                  --cta_n=256 --cta_k=8 --stages=5 --warps_m=2 --warps_n=4 --warps_k=1 --inst_m=1 --inst_n=1 --inst_k=1  \
                  --min_cc=50 --max_cc=1024

           Bytes: 201326592  bytes
           FLOPs: 137472507904  flops
           FLOPs/Byte: 682

         Runtime: 6.54773  ms
          Memory: 28.6359 GiB/s

            Math: 20995.4 GFLOP/s



=============================
  Problem ID: 1

        Provider: [1;37mCUTLASS[0m
   OperationKind: [1;37mgemm[0m
       Operation: cutlass_simt_sgemm_128x128_8x5_nn_align1

          Status: [1;37mSuccess[0m
    Verification: [1;37mON[0m
     Disposition: [1;32mPassed[0m

reference_device: Passed
          cuBLAS: Passed

       Arguments: --gemm_kind=universal --split_k_mode=serial --m=4096 --n=4096 --k=4096 --A=f32:column --B=f32:column  \
                  --C=f32:column --alpha=1 --beta=0 --split_k_slices=1 --batch_count=1 --op_class=simt --accum=f32 --cta_m=128  \
                  --cta_n=128 --cta_k=8 --stages=5 --warps_m=4 --warps_n=2 --warps_k=1 --inst_m=1 --inst_n=1 --inst_k=1  \
                  --min_cc=50 --max_cc=1024

           Bytes: 201326592  bytes
           FLOPs: 137472507904  flops
           FLOPs/Byte: 682

         Runtime: 7.81315  ms
          Memory: 23.998 GiB/s

            Math: 17595 GFLOP/s



=============================
  Problem ID: 1

        Provider: [1;37mCUTLASS[0m
   OperationKind: [1;37mgemm[0m
       Operation: cutlass_simt_sgemm_256x128_8x4_nn_align1

          Status: [1;37mSuccess[0m
    Verification: [1;37mON[0m
     Disposition: [1;32mPassed[0m

reference_device: Passed
          cuBLAS: Passed

       Arguments: --gemm_kind=universal --split_k_mode=serial --m=4096 --n=4096 --k=4096 --A=f32:column --B=f32:column  \
                  --C=f32:column --alpha=1 --beta=0 --split_k_slices=1 --batch_count=1 --op_class=simt --accum=f32 --cta_m=256  \
                  --cta_n=128 --cta_k=8 --stages=4 --warps_m=4 --warps_n=2 --warps_k=1 --inst_m=1 --inst_n=1 --inst_k=1  \
                  --min_cc=50 --max_cc=1024

           Bytes: 201326592  bytes
           FLOPs: 137472507904  flops
           FLOPs/Byte: 682

         Runtime: 6.75114  ms
          Memory: 27.7731 GiB/s

            Math: 20362.9 GFLOP/s



=============================
  Problem ID: 1

        Provider: [1;37mCUTLASS[0m
   OperationKind: [1;37mgemm[0m
       Operation: cutlass_simt_sgemm_128x256_8x4_nn_align1

          Status: [1;37mSuccess[0m
    Verification: [1;37mON[0m
     Disposition: [1;32mPassed[0m

reference_device: Passed
          cuBLAS: Passed

       Arguments: --gemm_kind=universal --split_k_mode=serial --m=4096 --n=4096 --k=4096 --A=f32:column --B=f32:column  \
                  --C=f32:column --alpha=1 --beta=0 --split_k_slices=1 --batch_count=1 --op_class=simt --accum=f32 --cta_m=128  \
                  --cta_n=256 --cta_k=8 --stages=4 --warps_m=2 --warps_n=4 --warps_k=1 --inst_m=1 --inst_n=1 --inst_k=1  \
                  --min_cc=50 --max_cc=1024

           Bytes: 201326592  bytes
           FLOPs: 137472507904  flops
           FLOPs/Byte: 682

         Runtime: 6.6142  ms
          Memory: 28.3481 GiB/s

            Math: 20784.4 GFLOP/s



=============================
  Problem ID: 1

        Provider: [1;37mCUTLASS[0m
   OperationKind: [1;37mgemm[0m
       Operation: cutlass_simt_sgemm_128x128_8x4_nn_align1

          Status: [1;37mSuccess[0m
    Verification: [1;37mON[0m
     Disposition: [1;32mPassed[0m

reference_device: Passed
          cuBLAS: Passed

       Arguments: --gemm_kind=universal --split_k_mode=serial --m=4096 --n=4096 --k=4096 --A=f32:column --B=f32:column  \
                  --C=f32:column --alpha=1 --beta=0 --split_k_slices=1 --batch_count=1 --op_class=simt --accum=f32 --cta_m=128  \
                  --cta_n=128 --cta_k=8 --stages=4 --warps_m=4 --warps_n=2 --warps_k=1 --inst_m=1 --inst_n=1 --inst_k=1  \
                  --min_cc=50 --max_cc=1024

           Bytes: 201326592  bytes
           FLOPs: 137472507904  flops
           FLOPs/Byte: 682

         Runtime: 7.83826  ms
          Memory: 23.9211 GiB/s

            Math: 17538.7 GFLOP/s



=============================
  Problem ID: 1

        Provider: [1;37mCUTLASS[0m
   OperationKind: [1;37mgemm[0m
       Operation: cutlass_simt_sgemm_128x64_8x5_nn_align1

          Status: [1;37mSuccess[0m
    Verification: [1;37mON[0m
     Disposition: [1;32mPassed[0m

reference_device: Passed
          cuBLAS: Passed

       Arguments: --gemm_kind=universal --split_k_mode=serial --m=4096 --n=4096 --k=4096 --A=f32:column --B=f32:column  \
                  --C=f32:column --alpha=1 --beta=0 --split_k_slices=1 --batch_count=1 --op_class=simt --accum=f32 --cta_m=128  \
                  --cta_n=64 --cta_k=8 --stages=5 --warps_m=2 --warps_n=2 --warps_k=1 --inst_m=1 --inst_n=1 --inst_k=1  \
                  --min_cc=50 --max_cc=1024

           Bytes: 201326592  bytes
           FLOPs: 137472507904  flops
           FLOPs/Byte: 682

         Runtime: 9.63449  ms
          Memory: 19.4613 GiB/s

            Math: 14268.8 GFLOP/s



=============================
  Problem ID: 1

        Provider: [1;37mCUTLASS[0m
   OperationKind: [1;37mgemm[0m
       Operation: cutlass_simt_sgemm_64x128_8x5_nn_align1

          Status: [1;37mSuccess[0m
    Verification: [1;37mON[0m
     Disposition: [1;32mPassed[0m

reference_device: Passed
          cuBLAS: Passed

       Arguments: --gemm_kind=universal --split_k_mode=serial --m=4096 --n=4096 --k=4096 --A=f32:column --B=f32:column  \
                  --C=f32:column --alpha=1 --beta=0 --split_k_slices=1 --batch_count=1 --op_class=simt --accum=f32 --cta_m=64  \
                  --cta_n=128 --cta_k=8 --stages=5 --warps_m=2 --warps_n=2 --warps_k=1 --inst_m=1 --inst_n=1 --inst_k=1  \
                  --min_cc=50 --max_cc=1024

           Bytes: 201326592  bytes
           FLOPs: 137472507904  flops
           FLOPs/Byte: 682

         Runtime: 7.78539  ms
          Memory: 24.0836 GiB/s

            Math: 17657.8 GFLOP/s



=============================
  Problem ID: 1

        Provider: [1;37mCUTLASS[0m
   OperationKind: [1;37mgemm[0m
       Operation: cutlass_simt_sgemm_64x64_8x5_nn_align1

          Status: [1;37mSuccess[0m
    Verification: [1;37mON[0m
     Disposition: [1;32mPassed[0m

reference_device: Passed
          cuBLAS: Passed

       Arguments: --gemm_kind=universal --split_k_mode=serial --m=4096 --n=4096 --k=4096 --A=f32:column --B=f32:column  \
                  --C=f32:column --alpha=1 --beta=0 --split_k_slices=1 --batch_count=1 --op_class=simt --accum=f32 --cta_m=64  \
                  --cta_n=64 --cta_k=8 --stages=5 --warps_m=2 --warps_n=1 --warps_k=1 --inst_m=1 --inst_n=1 --inst_k=1  \
                  --min_cc=50 --max_cc=1024

           Bytes: 201326592  bytes
           FLOPs: 137472507904  flops
           FLOPs/Byte: 682

         Runtime: 8.91975  ms
          Memory: 21.0208 GiB/s

            Math: 15412.2 GFLOP/s



=============================
  Problem ID: 1

        Provider: [1;37mCUTLASS[0m
   OperationKind: [1;37mgemm[0m
       Operation: cutlass_simt_sgemm_128x32_8x5_nn_align1

          Status: [1;37mSuccess[0m
    Verification: [1;37mON[0m
     Disposition: [1;32mPassed[0m

reference_device: Passed
          cuBLAS: Passed

       Arguments: --gemm_kind=universal --split_k_mode=serial --m=4096 --n=4096 --k=4096 --A=f32:column --B=f32:column  \
                  --C=f32:column --alpha=1 --beta=0 --split_k_slices=1 --batch_count=1 --op_class=simt --accum=f32 --cta_m=128  \
                  --cta_n=32 --cta_k=8 --stages=5 --warps_m=2 --warps_n=1 --warps_k=1 --inst_m=1 --inst_n=1 --inst_k=1  \
                  --min_cc=50 --max_cc=1024

           Bytes: 201326592  bytes
           FLOPs: 137472507904  flops
           FLOPs/Byte: 682

         Runtime: 12.3928  ms
          Memory: 15.1298 GiB/s

            Math: 11092.9 GFLOP/s



=============================
  Problem ID: 1

        Provider: [1;37mCUTLASS[0m
   OperationKind: [1;37mgemm[0m
       Operation: cutlass_simt_sgemm_32x128_8x5_nn_align1

          Status: [1;37mSuccess[0m
    Verification: [1;37mON[0m
     Disposition: [1;32mPassed[0m

reference_device: Passed
          cuBLAS: Passed

       Arguments: --gemm_kind=universal --split_k_mode=serial --m=4096 --n=4096 --k=4096 --A=f32:column --B=f32:column  \
                  --C=f32:column --alpha=1 --beta=0 --split_k_slices=1 --batch_count=1 --op_class=simt --accum=f32 --cta_m=32  \
                  --cta_n=128 --cta_k=8 --stages=5 --warps_m=1 --warps_n=2 --warps_k=1 --inst_m=1 --inst_n=1 --inst_k=1  \
                  --min_cc=50 --max_cc=1024

           Bytes: 201326592  bytes
           FLOPs: 137472507904  flops
           FLOPs/Byte: 682

         Runtime: 9.11887  ms
          Memory: 20.5617 GiB/s

            Math: 15075.6 GFLOP/s


=============================

CSV Results:

Problem,Provider,OperationKind,Operation,Disposition,Status,gemm_kind,split_k_mode,m,n,k,A,B,C,alpha,beta,split_k_slices,batch_count,op_class,accum,cta_m,cta_n,cta_k,stages,warps_m,warps_n,warps_k,inst_m,inst_n,inst_k,min_cc,max_cc,Bytes,Flops,Flops/Byte,Runtime,GB/s,GFLOPs
1,CUTLASS,gemm,cutlass_simt_sgemm_128x128_8x2_nn_align1,passed,success,universal,serial,4096,4096,4096,f32:column,f32:column,f32:column,1,0,1,1,simt,f32,128,128,8,2,4,2,1,1,1,1,50,1024,201326592,137472507904,682,7.55414,24.8208,18198.3
1,CUTLASS,gemm,cutlass_simt_sgemm_128x64_8x2_nn_align1,passed,success,universal,serial,4096,4096,4096,f32:column,f32:column,f32:column,1,0,1,1,simt,f32,128,64,8,2,2,2,1,1,1,1,50,1024,201326592,137472507904,682,8.00519,23.4223,17172.9
1,CUTLASS,gemm,cutlass_simt_sgemm_64x128_8x2_nn_align1,passed,success,universal,serial,4096,4096,4096,f32:column,f32:column,f32:column,1,0,1,1,simt,f32,64,128,8,2,2,2,1,1,1,1,50,1024,201326592,137472507904,682,7.94911,23.5876,17294.1
1,CUTLASS,gemm,cutlass_simt_sgemm_64x64_8x2_nn_align1,passed,success,universal,serial,4096,4096,4096,f32:column,f32:column,f32:column,1,0,1,1,simt,f32,64,64,8,2,2,1,1,1,1,1,50,1024,201326592,137472507904,682,8.41807,22.2735,16330.6
1,CUTLASS,gemm,cutlass_simt_sgemm_128x32_8x2_nn_align1,passed,success,universal,serial,4096,4096,4096,f32:column,f32:column,f32:column,1,0,1,1,simt,f32,128,32,8,2,2,1,1,1,1,1,50,1024,201326592,137472507904,682,9.41276,19.9198,14604.9
1,CUTLASS,gemm,cutlass_simt_sgemm_32x128_8x2_nn_align1,passed,success,universal,serial,4096,4096,4096,f32:column,f32:column,f32:column,1,0,1,1,simt,f32,32,128,8,2,1,2,1,1,1,1,50,1024,201326592,137472507904,682,8.82993,21.2346,15568.9
1,CUTLASS,gemm,cutlass_simt_sgemm_256x128_8x5_nn_align1,passed,success,universal,serial,4096,4096,4096,f32:column,f32:column,f32:column,1,0,1,1,simt,f32,256,128,8,5,4,2,1,1,1,1,50,1024,201326592,137472507904,682,6.76247,27.7266,20328.8
1,CUTLASS,gemm,cutlass_simt_sgemm_128x256_8x5_nn_align1,passed,success,universal,serial,4096,4096,4096,f32:column,f32:column,f32:column,1,0,1,1,simt,f32,128,256,8,5,2,4,1,1,1,1,50,1024,201326592,137472507904,682,6.54773,28.6359,20995.4
1,CUTLASS,gemm,cutlass_simt_sgemm_128x128_8x5_nn_align1,passed,success,universal,serial,4096,4096,4096,f32:column,f32:column,f32:column,1,0,1,1,simt,f32,128,128,8,5,4,2,1,1,1,1,50,1024,201326592,137472507904,682,7.81315,23.998,17595
1,CUTLASS,gemm,cutlass_simt_sgemm_256x128_8x4_nn_align1,passed,success,universal,serial,4096,4096,4096,f32:column,f32:column,f32:column,1,0,1,1,simt,f32,256,128,8,4,4,2,1,1,1,1,50,1024,201326592,137472507904,682,6.75114,27.7731,20362.9
1,CUTLASS,gemm,cutlass_simt_sgemm_128x256_8x4_nn_align1,passed,success,universal,serial,4096,4096,4096,f32:column,f32:column,f32:column,1,0,1,1,simt,f32,128,256,8,4,2,4,1,1,1,1,50,1024,201326592,137472507904,682,6.6142,28.3481,20784.4
1,CUTLASS,gemm,cutlass_simt_sgemm_128x128_8x4_nn_align1,passed,success,universal,serial,4096,4096,4096,f32:column,f32:column,f32:column,1,0,1,1,simt,f32,128,128,8,4,4,2,1,1,1,1,50,1024,201326592,137472507904,682,7.83826,23.9211,17538.7
1,CUTLASS,gemm,cutlass_simt_sgemm_128x64_8x5_nn_align1,passed,success,universal,serial,4096,4096,4096,f32:column,f32:column,f32:column,1,0,1,1,simt,f32,128,64,8,5,2,2,1,1,1,1,50,1024,201326592,137472507904,682,9.63449,19.4613,14268.8
1,CUTLASS,gemm,cutlass_simt_sgemm_64x128_8x5_nn_align1,passed,success,universal,serial,4096,4096,4096,f32:column,f32:column,f32:column,1,0,1,1,simt,f32,64,128,8,5,2,2,1,1,1,1,50,1024,201326592,137472507904,682,7.78539,24.0836,17657.8
1,CUTLASS,gemm,cutlass_simt_sgemm_64x64_8x5_nn_align1,passed,success,universal,serial,4096,4096,4096,f32:column,f32:column,f32:column,1,0,1,1,simt,f32,64,64,8,5,2,1,1,1,1,1,50,1024,201326592,137472507904,682,8.91975,21.0208,15412.2
1,CUTLASS,gemm,cutlass_simt_sgemm_128x32_8x5_nn_align1,passed,success,universal,serial,4096,4096,4096,f32:column,f32:column,f32:column,1,0,1,1,simt,f32,128,32,8,5,2,1,1,1,1,1,50,1024,201326592,137472507904,682,12.3928,15.1298,11092.9
1,CUTLASS,gemm,cutlass_simt_sgemm_32x128_8x5_nn_align1,passed,success,universal,serial,4096,4096,4096,f32:column,f32:column,f32:column,1,0,1,1,simt,f32,32,128,8,5,1,2,1,1,1,1,50,1024,201326592,137472507904,682,9.11887,20.5617,15075.6
