template-based/nn/cutlass_best_perf_async_only/M=1152_N=1152_K=1152/profiler_3.out



=============================
  Problem ID: 1

        Provider: [1;37mCUTLASS[0m
   OperationKind: [1;37mgemm[0m
       Operation: cutlass_simt_sgemm_128x128_8x2_nn_align1

          Status: [1;37mSuccess[0m
    Verification: [1;37mON[0m
     Disposition: [1;32mPassed[0m

reference_device: Passed
          cuBLAS: Passed

       Arguments: --gemm_kind=universal --split_k_mode=serial --m=1152 --n=1152 --k=1152 --A=f32:column --B=f32:column  \
                  --C=f32:column --alpha=1 --beta=0 --split_k_slices=1 --batch_count=1 --op_class=simt --accum=f32 --cta_m=128  \
                  --cta_n=128 --cta_k=8 --stages=2 --warps_m=4 --warps_n=2 --warps_k=1 --inst_m=1 --inst_n=1 --inst_k=1  \
                  --min_cc=50 --max_cc=1024

           Bytes: 15925248  bytes
           FLOPs: 3060301824  flops
           FLOPs/Byte: 192

         Runtime: 0.234537  ms
          Memory: 63.2376 GiB/s

            Math: 13048.3 GFLOP/s



=============================
  Problem ID: 1

        Provider: [1;37mCUTLASS[0m
   OperationKind: [1;37mgemm[0m
       Operation: cutlass_simt_sgemm_128x64_8x2_nn_align1

          Status: [1;37mSuccess[0m
    Verification: [1;37mON[0m
     Disposition: [1;32mPassed[0m

reference_device: Passed
          cuBLAS: Passed

       Arguments: --gemm_kind=universal --split_k_mode=serial --m=1152 --n=1152 --k=1152 --A=f32:column --B=f32:column  \
                  --C=f32:column --alpha=1 --beta=0 --split_k_slices=1 --batch_count=1 --op_class=simt --accum=f32 --cta_m=128  \
                  --cta_n=64 --cta_k=8 --stages=2 --warps_m=2 --warps_n=2 --warps_k=1 --inst_m=1 --inst_n=1 --inst_k=1  \
                  --min_cc=50 --max_cc=1024

           Bytes: 15925248  bytes
           FLOPs: 3060301824  flops
           FLOPs/Byte: 192

         Runtime: 0.245321  ms
          Memory: 60.4578 GiB/s

            Math: 12474.7 GFLOP/s



=============================
  Problem ID: 1

        Provider: [1;37mCUTLASS[0m
   OperationKind: [1;37mgemm[0m
       Operation: cutlass_simt_sgemm_64x128_8x2_nn_align1

          Status: [1;37mSuccess[0m
    Verification: [1;37mON[0m
     Disposition: [1;32mPassed[0m

reference_device: Passed
          cuBLAS: Passed

       Arguments: --gemm_kind=universal --split_k_mode=serial --m=1152 --n=1152 --k=1152 --A=f32:column --B=f32:column  \
                  --C=f32:column --alpha=1 --beta=0 --split_k_slices=1 --batch_count=1 --op_class=simt --accum=f32 --cta_m=64  \
                  --cta_n=128 --cta_k=8 --stages=2 --warps_m=2 --warps_n=2 --warps_k=1 --inst_m=1 --inst_n=1 --inst_k=1  \
                  --min_cc=50 --max_cc=1024

           Bytes: 15925248  bytes
           FLOPs: 3060301824  flops
           FLOPs/Byte: 192

         Runtime: 0.24831  ms
          Memory: 59.73 GiB/s

            Math: 12324.5 GFLOP/s



=============================
  Problem ID: 1

        Provider: [1;37mCUTLASS[0m
   OperationKind: [1;37mgemm[0m
       Operation: cutlass_simt_sgemm_64x64_8x2_nn_align1

          Status: [1;37mSuccess[0m
    Verification: [1;37mON[0m
     Disposition: [1;32mPassed[0m

reference_device: Passed
          cuBLAS: Passed

       Arguments: --gemm_kind=universal --split_k_mode=serial --m=1152 --n=1152 --k=1152 --A=f32:column --B=f32:column  \
                  --C=f32:column --alpha=1 --beta=0 --split_k_slices=1 --batch_count=1 --op_class=simt --accum=f32 --cta_m=64  \
                  --cta_n=64 --cta_k=8 --stages=2 --warps_m=2 --warps_n=1 --warps_k=1 --inst_m=1 --inst_n=1 --inst_k=1  \
                  --min_cc=50 --max_cc=1024

           Bytes: 15925248  bytes
           FLOPs: 3060301824  flops
           FLOPs/Byte: 192

         Runtime: 0.249631  ms
          Memory: 59.4139 GiB/s

            Math: 12259.3 GFLOP/s



=============================
  Problem ID: 1

        Provider: [1;37mCUTLASS[0m
   OperationKind: [1;37mgemm[0m
       Operation: cutlass_simt_sgemm_128x32_8x2_nn_align1

          Status: [1;37mSuccess[0m
    Verification: [1;37mON[0m
     Disposition: [1;32mPassed[0m

reference_device: Passed
          cuBLAS: Passed

       Arguments: --gemm_kind=universal --split_k_mode=serial --m=1152 --n=1152 --k=1152 --A=f32:column --B=f32:column  \
                  --C=f32:column --alpha=1 --beta=0 --split_k_slices=1 --batch_count=1 --op_class=simt --accum=f32 --cta_m=128  \
                  --cta_n=32 --cta_k=8 --stages=2 --warps_m=2 --warps_n=1 --warps_k=1 --inst_m=1 --inst_n=1 --inst_k=1  \
                  --min_cc=50 --max_cc=1024

           Bytes: 15925248  bytes
           FLOPs: 3060301824  flops
           FLOPs/Byte: 192

         Runtime: 0.222566  ms
          Memory: 66.6387 GiB/s

            Math: 13750.1 GFLOP/s



=============================
  Problem ID: 1

        Provider: [1;37mCUTLASS[0m
   OperationKind: [1;37mgemm[0m
       Operation: cutlass_simt_sgemm_32x128_8x2_nn_align1

          Status: [1;37mSuccess[0m
    Verification: [1;37mON[0m
     Disposition: [1;32mPassed[0m

reference_device: Passed
          cuBLAS: Passed

       Arguments: --gemm_kind=universal --split_k_mode=serial --m=1152 --n=1152 --k=1152 --A=f32:column --B=f32:column  \
                  --C=f32:column --alpha=1 --beta=0 --split_k_slices=1 --batch_count=1 --op_class=simt --accum=f32 --cta_m=32  \
                  --cta_n=128 --cta_k=8 --stages=2 --warps_m=1 --warps_n=2 --warps_k=1 --inst_m=1 --inst_n=1 --inst_k=1  \
                  --min_cc=50 --max_cc=1024

           Bytes: 15925248  bytes
           FLOPs: 3060301824  flops
           FLOPs/Byte: 192

         Runtime: 0.27221  ms
          Memory: 54.4857 GiB/s

            Math: 11242.4 GFLOP/s



=============================
  Problem ID: 1

        Provider: [1;37mCUTLASS[0m
   OperationKind: [1;37mgemm[0m
       Operation: cutlass_simt_sgemm_256x128_8x5_nn_align1

          Status: [1;37mSuccess[0m
    Verification: [1;37mON[0m
     Disposition: [1;32mPassed[0m

reference_device: Passed
          cuBLAS: Passed

       Arguments: --gemm_kind=universal --split_k_mode=serial --m=1152 --n=1152 --k=1152 --A=f32:column --B=f32:column  \
                  --C=f32:column --alpha=1 --beta=0 --split_k_slices=1 --batch_count=1 --op_class=simt --accum=f32 --cta_m=256  \
                  --cta_n=128 --cta_k=8 --stages=5 --warps_m=4 --warps_n=2 --warps_k=1 --inst_m=1 --inst_n=1 --inst_k=1  \
                  --min_cc=50 --max_cc=1024

           Bytes: 15925248  bytes
           FLOPs: 3060301824  flops
           FLOPs/Byte: 192

         Runtime: 0.238787  ms
          Memory: 62.1121 GiB/s

            Math: 12816.1 GFLOP/s



=============================
  Problem ID: 1

        Provider: [1;37mCUTLASS[0m
   OperationKind: [1;37mgemm[0m
       Operation: cutlass_simt_sgemm_128x256_8x5_nn_align1

          Status: [1;37mSuccess[0m
    Verification: [1;37mON[0m
     Disposition: [1;32mPassed[0m

reference_device: Passed
          cuBLAS: Passed

       Arguments: --gemm_kind=universal --split_k_mode=serial --m=1152 --n=1152 --k=1152 --A=f32:column --B=f32:column  \
                  --C=f32:column --alpha=1 --beta=0 --split_k_slices=1 --batch_count=1 --op_class=simt --accum=f32 --cta_m=128  \
                  --cta_n=256 --cta_k=8 --stages=5 --warps_m=2 --warps_n=4 --warps_k=1 --inst_m=1 --inst_n=1 --inst_k=1  \
                  --min_cc=50 --max_cc=1024

           Bytes: 15925248  bytes
           FLOPs: 3060301824  flops
           FLOPs/Byte: 192

         Runtime: 0.220817  ms
          Memory: 67.1667 GiB/s

            Math: 13859 GFLOP/s



=============================
  Problem ID: 1

        Provider: [1;37mCUTLASS[0m
   OperationKind: [1;37mgemm[0m
       Operation: cutlass_simt_sgemm_128x128_8x5_nn_align1

          Status: [1;37mSuccess[0m
    Verification: [1;37mON[0m
     Disposition: [1;32mPassed[0m

reference_device: Passed
          cuBLAS: Passed

       Arguments: --gemm_kind=universal --split_k_mode=serial --m=1152 --n=1152 --k=1152 --A=f32:column --B=f32:column  \
                  --C=f32:column --alpha=1 --beta=0 --split_k_slices=1 --batch_count=1 --op_class=simt --accum=f32 --cta_m=128  \
                  --cta_n=128 --cta_k=8 --stages=5 --warps_m=4 --warps_n=2 --warps_k=1 --inst_m=1 --inst_n=1 --inst_k=1  \
                  --min_cc=50 --max_cc=1024

           Bytes: 15925248  bytes
           FLOPs: 3060301824  flops
           FLOPs/Byte: 192

         Runtime: 0.284447  ms
          Memory: 52.1417 GiB/s

            Math: 10758.8 GFLOP/s



=============================
  Problem ID: 1

        Provider: [1;37mCUTLASS[0m
   OperationKind: [1;37mgemm[0m
       Operation: cutlass_simt_sgemm_256x128_8x4_nn_align1

          Status: [1;37mSuccess[0m
    Verification: [1;37mON[0m
     Disposition: [1;32mPassed[0m

reference_device: Passed
          cuBLAS: Passed

       Arguments: --gemm_kind=universal --split_k_mode=serial --m=1152 --n=1152 --k=1152 --A=f32:column --B=f32:column  \
                  --C=f32:column --alpha=1 --beta=0 --split_k_slices=1 --batch_count=1 --op_class=simt --accum=f32 --cta_m=256  \
                  --cta_n=128 --cta_k=8 --stages=4 --warps_m=4 --warps_n=2 --warps_k=1 --inst_m=1 --inst_n=1 --inst_k=1  \
                  --min_cc=50 --max_cc=1024

           Bytes: 15925248  bytes
           FLOPs: 3060301824  flops
           FLOPs/Byte: 192

         Runtime: 0.239882  ms
          Memory: 61.8284 GiB/s

            Math: 12757.5 GFLOP/s



=============================
  Problem ID: 1

        Provider: [1;37mCUTLASS[0m
   OperationKind: [1;37mgemm[0m
       Operation: cutlass_simt_sgemm_128x256_8x4_nn_align1

          Status: [1;37mSuccess[0m
    Verification: [1;37mON[0m
     Disposition: [1;32mPassed[0m

reference_device: Passed
          cuBLAS: Passed

       Arguments: --gemm_kind=universal --split_k_mode=serial --m=1152 --n=1152 --k=1152 --A=f32:column --B=f32:column  \
                  --C=f32:column --alpha=1 --beta=0 --split_k_slices=1 --batch_count=1 --op_class=simt --accum=f32 --cta_m=128  \
                  --cta_n=256 --cta_k=8 --stages=4 --warps_m=2 --warps_n=4 --warps_k=1 --inst_m=1 --inst_n=1 --inst_k=1  \
                  --min_cc=50 --max_cc=1024

           Bytes: 15925248  bytes
           FLOPs: 3060301824  flops
           FLOPs/Byte: 192

         Runtime: 0.222874  ms
          Memory: 66.5469 GiB/s

            Math: 13731.1 GFLOP/s



=============================
  Problem ID: 1

        Provider: [1;37mCUTLASS[0m
   OperationKind: [1;37mgemm[0m
       Operation: cutlass_simt_sgemm_128x128_8x4_nn_align1

          Status: [1;37mSuccess[0m
    Verification: [1;37mON[0m
     Disposition: [1;32mPassed[0m

reference_device: Passed
          cuBLAS: Passed

       Arguments: --gemm_kind=universal --split_k_mode=serial --m=1152 --n=1152 --k=1152 --A=f32:column --B=f32:column  \
                  --C=f32:column --alpha=1 --beta=0 --split_k_slices=1 --batch_count=1 --op_class=simt --accum=f32 --cta_m=128  \
                  --cta_n=128 --cta_k=8 --stages=4 --warps_m=4 --warps_n=2 --warps_k=1 --inst_m=1 --inst_n=1 --inst_k=1  \
                  --min_cc=50 --max_cc=1024

           Bytes: 15925248  bytes
           FLOPs: 3060301824  flops
           FLOPs/Byte: 192

         Runtime: 0.284539  ms
          Memory: 52.1248 GiB/s

            Math: 10755.3 GFLOP/s



=============================
  Problem ID: 1

        Provider: [1;37mCUTLASS[0m
   OperationKind: [1;37mgemm[0m
       Operation: cutlass_simt_sgemm_128x64_8x5_nn_align1

          Status: [1;37mSuccess[0m
    Verification: [1;37mON[0m
     Disposition: [1;32mPassed[0m

reference_device: Passed
          cuBLAS: Passed

       Arguments: --gemm_kind=universal --split_k_mode=serial --m=1152 --n=1152 --k=1152 --A=f32:column --B=f32:column  \
                  --C=f32:column --alpha=1 --beta=0 --split_k_slices=1 --batch_count=1 --op_class=simt --accum=f32 --cta_m=128  \
                  --cta_n=64 --cta_k=8 --stages=5 --warps_m=2 --warps_n=2 --warps_k=1 --inst_m=1 --inst_n=1 --inst_k=1  \
                  --min_cc=50 --max_cc=1024

           Bytes: 15925248  bytes
           FLOPs: 3060301824  flops
           FLOPs/Byte: 192

         Runtime: 0.28799  ms
          Memory: 51.5002 GiB/s

            Math: 10626.4 GFLOP/s



=============================
  Problem ID: 1

        Provider: [1;37mCUTLASS[0m
   OperationKind: [1;37mgemm[0m
       Operation: cutlass_simt_sgemm_64x128_8x5_nn_align1

          Status: [1;37mSuccess[0m
    Verification: [1;37mON[0m
     Disposition: [1;32mPassed[0m

reference_device: Passed
          cuBLAS: Passed

       Arguments: --gemm_kind=universal --split_k_mode=serial --m=1152 --n=1152 --k=1152 --A=f32:column --B=f32:column  \
                  --C=f32:column --alpha=1 --beta=0 --split_k_slices=1 --batch_count=1 --op_class=simt --accum=f32 --cta_m=64  \
                  --cta_n=128 --cta_k=8 --stages=5 --warps_m=2 --warps_n=2 --warps_k=1 --inst_m=1 --inst_n=1 --inst_k=1  \
                  --min_cc=50 --max_cc=1024

           Bytes: 15925248  bytes
           FLOPs: 3060301824  flops
           FLOPs/Byte: 192

         Runtime: 0.210258  ms
          Memory: 70.5398 GiB/s

            Math: 14555 GFLOP/s



=============================
  Problem ID: 1

        Provider: [1;37mCUTLASS[0m
   OperationKind: [1;37mgemm[0m
       Operation: cutlass_simt_sgemm_64x64_8x5_nn_align1

          Status: [1;37mSuccess[0m
    Verification: [1;37mON[0m
     Disposition: [1;32mPassed[0m

reference_device: Passed
          cuBLAS: Passed

       Arguments: --gemm_kind=universal --split_k_mode=serial --m=1152 --n=1152 --k=1152 --A=f32:column --B=f32:column  \
                  --C=f32:column --alpha=1 --beta=0 --split_k_slices=1 --batch_count=1 --op_class=simt --accum=f32 --cta_m=64  \
                  --cta_n=64 --cta_k=8 --stages=5 --warps_m=2 --warps_n=1 --warps_k=1 --inst_m=1 --inst_n=1 --inst_k=1  \
                  --min_cc=50 --max_cc=1024

           Bytes: 15925248  bytes
           FLOPs: 3060301824  flops
           FLOPs/Byte: 192

         Runtime: 0.287058  ms
          Memory: 51.6674 GiB/s

            Math: 10660.9 GFLOP/s



=============================
  Problem ID: 1

        Provider: [1;37mCUTLASS[0m
   OperationKind: [1;37mgemm[0m
       Operation: cutlass_simt_sgemm_128x32_8x5_nn_align1

          Status: [1;37mSuccess[0m
    Verification: [1;37mON[0m
     Disposition: [1;32mPassed[0m

reference_device: Passed
          cuBLAS: Passed

       Arguments: --gemm_kind=universal --split_k_mode=serial --m=1152 --n=1152 --k=1152 --A=f32:column --B=f32:column  \
                  --C=f32:column --alpha=1 --beta=0 --split_k_slices=1 --batch_count=1 --op_class=simt --accum=f32 --cta_m=128  \
                  --cta_n=32 --cta_k=8 --stages=5 --warps_m=2 --warps_n=1 --warps_k=1 --inst_m=1 --inst_n=1 --inst_k=1  \
                  --min_cc=50 --max_cc=1024

           Bytes: 15925248  bytes
           FLOPs: 3060301824  flops
           FLOPs/Byte: 192

         Runtime: 0.348631  ms
          Memory: 42.5422 GiB/s

            Math: 8778.05 GFLOP/s



=============================
  Problem ID: 1

        Provider: [1;37mCUTLASS[0m
   OperationKind: [1;37mgemm[0m
       Operation: cutlass_simt_sgemm_32x128_8x5_nn_align1

          Status: [1;37mSuccess[0m
    Verification: [1;37mON[0m
     Disposition: [1;32mPassed[0m

reference_device: Passed
          cuBLAS: Passed

       Arguments: --gemm_kind=universal --split_k_mode=serial --m=1152 --n=1152 --k=1152 --A=f32:column --B=f32:column  \
                  --C=f32:column --alpha=1 --beta=0 --split_k_slices=1 --batch_count=1 --op_class=simt --accum=f32 --cta_m=32  \
                  --cta_n=128 --cta_k=8 --stages=5 --warps_m=1 --warps_n=2 --warps_k=1 --inst_m=1 --inst_n=1 --inst_k=1  \
                  --min_cc=50 --max_cc=1024

           Bytes: 15925248  bytes
           FLOPs: 3060301824  flops
           FLOPs/Byte: 192

         Runtime: 0.233748  ms
          Memory: 63.4509 GiB/s

            Math: 13092.3 GFLOP/s


=============================

CSV Results:

Problem,Provider,OperationKind,Operation,Disposition,Status,gemm_kind,split_k_mode,m,n,k,A,B,C,alpha,beta,split_k_slices,batch_count,op_class,accum,cta_m,cta_n,cta_k,stages,warps_m,warps_n,warps_k,inst_m,inst_n,inst_k,min_cc,max_cc,Bytes,Flops,Flops/Byte,Runtime,GB/s,GFLOPs
1,CUTLASS,gemm,cutlass_simt_sgemm_128x128_8x2_nn_align1,passed,success,universal,serial,1152,1152,1152,f32:column,f32:column,f32:column,1,0,1,1,simt,f32,128,128,8,2,4,2,1,1,1,1,50,1024,15925248,3060301824,192,0.234537,63.2376,13048.3
1,CUTLASS,gemm,cutlass_simt_sgemm_128x64_8x2_nn_align1,passed,success,universal,serial,1152,1152,1152,f32:column,f32:column,f32:column,1,0,1,1,simt,f32,128,64,8,2,2,2,1,1,1,1,50,1024,15925248,3060301824,192,0.245321,60.4578,12474.7
1,CUTLASS,gemm,cutlass_simt_sgemm_64x128_8x2_nn_align1,passed,success,universal,serial,1152,1152,1152,f32:column,f32:column,f32:column,1,0,1,1,simt,f32,64,128,8,2,2,2,1,1,1,1,50,1024,15925248,3060301824,192,0.24831,59.73,12324.5
1,CUTLASS,gemm,cutlass_simt_sgemm_64x64_8x2_nn_align1,passed,success,universal,serial,1152,1152,1152,f32:column,f32:column,f32:column,1,0,1,1,simt,f32,64,64,8,2,2,1,1,1,1,1,50,1024,15925248,3060301824,192,0.249631,59.4139,12259.3
1,CUTLASS,gemm,cutlass_simt_sgemm_128x32_8x2_nn_align1,passed,success,universal,serial,1152,1152,1152,f32:column,f32:column,f32:column,1,0,1,1,simt,f32,128,32,8,2,2,1,1,1,1,1,50,1024,15925248,3060301824,192,0.222566,66.6387,13750.1
1,CUTLASS,gemm,cutlass_simt_sgemm_32x128_8x2_nn_align1,passed,success,universal,serial,1152,1152,1152,f32:column,f32:column,f32:column,1,0,1,1,simt,f32,32,128,8,2,1,2,1,1,1,1,50,1024,15925248,3060301824,192,0.27221,54.4857,11242.4
1,CUTLASS,gemm,cutlass_simt_sgemm_256x128_8x5_nn_align1,passed,success,universal,serial,1152,1152,1152,f32:column,f32:column,f32:column,1,0,1,1,simt,f32,256,128,8,5,4,2,1,1,1,1,50,1024,15925248,3060301824,192,0.238787,62.1121,12816.1
1,CUTLASS,gemm,cutlass_simt_sgemm_128x256_8x5_nn_align1,passed,success,universal,serial,1152,1152,1152,f32:column,f32:column,f32:column,1,0,1,1,simt,f32,128,256,8,5,2,4,1,1,1,1,50,1024,15925248,3060301824,192,0.220817,67.1667,13859
1,CUTLASS,gemm,cutlass_simt_sgemm_128x128_8x5_nn_align1,passed,success,universal,serial,1152,1152,1152,f32:column,f32:column,f32:column,1,0,1,1,simt,f32,128,128,8,5,4,2,1,1,1,1,50,1024,15925248,3060301824,192,0.284447,52.1417,10758.8
1,CUTLASS,gemm,cutlass_simt_sgemm_256x128_8x4_nn_align1,passed,success,universal,serial,1152,1152,1152,f32:column,f32:column,f32:column,1,0,1,1,simt,f32,256,128,8,4,4,2,1,1,1,1,50,1024,15925248,3060301824,192,0.239882,61.8284,12757.5
1,CUTLASS,gemm,cutlass_simt_sgemm_128x256_8x4_nn_align1,passed,success,universal,serial,1152,1152,1152,f32:column,f32:column,f32:column,1,0,1,1,simt,f32,128,256,8,4,2,4,1,1,1,1,50,1024,15925248,3060301824,192,0.222874,66.5469,13731.1
1,CUTLASS,gemm,cutlass_simt_sgemm_128x128_8x4_nn_align1,passed,success,universal,serial,1152,1152,1152,f32:column,f32:column,f32:column,1,0,1,1,simt,f32,128,128,8,4,4,2,1,1,1,1,50,1024,15925248,3060301824,192,0.284539,52.1248,10755.3
1,CUTLASS,gemm,cutlass_simt_sgemm_128x64_8x5_nn_align1,passed,success,universal,serial,1152,1152,1152,f32:column,f32:column,f32:column,1,0,1,1,simt,f32,128,64,8,5,2,2,1,1,1,1,50,1024,15925248,3060301824,192,0.28799,51.5002,10626.4
1,CUTLASS,gemm,cutlass_simt_sgemm_64x128_8x5_nn_align1,passed,success,universal,serial,1152,1152,1152,f32:column,f32:column,f32:column,1,0,1,1,simt,f32,64,128,8,5,2,2,1,1,1,1,50,1024,15925248,3060301824,192,0.210258,70.5398,14555
1,CUTLASS,gemm,cutlass_simt_sgemm_64x64_8x5_nn_align1,passed,success,universal,serial,1152,1152,1152,f32:column,f32:column,f32:column,1,0,1,1,simt,f32,64,64,8,5,2,1,1,1,1,1,50,1024,15925248,3060301824,192,0.287058,51.6674,10660.9
1,CUTLASS,gemm,cutlass_simt_sgemm_128x32_8x5_nn_align1,passed,success,universal,serial,1152,1152,1152,f32:column,f32:column,f32:column,1,0,1,1,simt,f32,128,32,8,5,2,1,1,1,1,1,50,1024,15925248,3060301824,192,0.348631,42.5422,8778.05
1,CUTLASS,gemm,cutlass_simt_sgemm_32x128_8x5_nn_align1,passed,success,universal,serial,1152,1152,1152,f32:column,f32:column,f32:column,1,0,1,1,simt,f32,32,128,8,5,1,2,1,1,1,1,50,1024,15925248,3060301824,192,0.233748,63.4509,13092.3
