nn/cutlass_best_perf/M=1024_N=1024_K=1024/profiler_2.out



=============================
  Problem ID: 1

        Provider: [1;37mCUTLASS[0m
   OperationKind: [1;37mgemm[0m
       Operation: cutlass_simt_sgemm_128x128_8x2_nn_align1

          Status: [1;37mSuccess[0m
    Verification: [1;37mON[0m
     Disposition: [1;32mPassed[0m

reference_device: Passed
          cuBLAS: Passed

       Arguments: --gemm_kind=universal --split_k_mode=serial --m=1024 --n=1024 --k=1024 --A=f32:column --B=f32:column  \
                  --C=f32:column --alpha=1 --beta=0 --split_k_slices=1 --batch_count=1 --op_class=simt --accum=f32 --cta_m=128  \
                  --cta_n=128 --cta_k=8 --stages=2 --warps_m=4 --warps_n=2 --warps_k=1 --inst_m=1 --inst_n=1 --inst_k=1  \
                  --min_cc=50 --max_cc=1024

           Bytes: 12582912  bytes
           FLOPs: 2149580800  flops
           FLOPs/Byte: 170

         Runtime: 0.117484  ms
          Memory: 99.748 GiB/s

            Math: 18296.9 GFLOP/s



=============================
  Problem ID: 1

        Provider: [1;37mCUTLASS[0m
   OperationKind: [1;37mgemm[0m
       Operation: cutlass_simt_sgemm_128x64_8x2_nn_align1

          Status: [1;37mSuccess[0m
    Verification: [1;37mON[0m
     Disposition: [1;32mPassed[0m

reference_device: Passed
          cuBLAS: Passed

       Arguments: --gemm_kind=universal --split_k_mode=serial --m=1024 --n=1024 --k=1024 --A=f32:column --B=f32:column  \
                  --C=f32:column --alpha=1 --beta=0 --split_k_slices=1 --batch_count=1 --op_class=simt --accum=f32 --cta_m=128  \
                  --cta_n=64 --cta_k=8 --stages=2 --warps_m=2 --warps_n=2 --warps_k=1 --inst_m=1 --inst_n=1 --inst_k=1  \
                  --min_cc=50 --max_cc=1024

           Bytes: 12582912  bytes
           FLOPs: 2149580800  flops
           FLOPs/Byte: 170

         Runtime: 0.11862  ms
          Memory: 98.7922 GiB/s

            Math: 18121.5 GFLOP/s



=============================
  Problem ID: 1

        Provider: [1;37mCUTLASS[0m
   OperationKind: [1;37mgemm[0m
       Operation: cutlass_simt_sgemm_64x128_8x2_nn_align1

          Status: [1;37mSuccess[0m
    Verification: [1;37mON[0m
     Disposition: [1;32mPassed[0m

reference_device: Passed
          cuBLAS: Passed

       Arguments: --gemm_kind=universal --split_k_mode=serial --m=1024 --n=1024 --k=1024 --A=f32:column --B=f32:column  \
                  --C=f32:column --alpha=1 --beta=0 --split_k_slices=1 --batch_count=1 --op_class=simt --accum=f32 --cta_m=64  \
                  --cta_n=128 --cta_k=8 --stages=2 --warps_m=2 --warps_n=2 --warps_k=1 --inst_m=1 --inst_n=1 --inst_k=1  \
                  --min_cc=50 --max_cc=1024

           Bytes: 12582912  bytes
           FLOPs: 2149580800  flops
           FLOPs/Byte: 170

         Runtime: 0.118815  ms
          Memory: 98.6305 GiB/s

            Math: 18091.9 GFLOP/s



=============================
  Problem ID: 1

        Provider: [1;37mCUTLASS[0m
   OperationKind: [1;37mgemm[0m
       Operation: cutlass_simt_sgemm_64x64_8x2_nn_align1

          Status: [1;37mSuccess[0m
    Verification: [1;37mON[0m
     Disposition: [1;32mPassed[0m

reference_device: Passed
          cuBLAS: Passed

       Arguments: --gemm_kind=universal --split_k_mode=serial --m=1024 --n=1024 --k=1024 --A=f32:column --B=f32:column  \
                  --C=f32:column --alpha=1 --beta=0 --split_k_slices=1 --batch_count=1 --op_class=simt --accum=f32 --cta_m=64  \
                  --cta_n=64 --cta_k=8 --stages=2 --warps_m=2 --warps_n=1 --warps_k=1 --inst_m=1 --inst_n=1 --inst_k=1  \
                  --min_cc=50 --max_cc=1024

           Bytes: 12582912  bytes
           FLOPs: 2149580800  flops
           FLOPs/Byte: 170

         Runtime: 0.124631  ms
          Memory: 94.0275 GiB/s

            Math: 17247.6 GFLOP/s



=============================
  Problem ID: 1

        Provider: [1;37mCUTLASS[0m
   OperationKind: [1;37mgemm[0m
       Operation: cutlass_simt_sgemm_128x32_8x2_nn_align1

          Status: [1;37mSuccess[0m
    Verification: [1;37mON[0m
     Disposition: [1;32mPassed[0m

reference_device: Passed
          cuBLAS: Passed

       Arguments: --gemm_kind=universal --split_k_mode=serial --m=1024 --n=1024 --k=1024 --A=f32:column --B=f32:column  \
                  --C=f32:column --alpha=1 --beta=0 --split_k_slices=1 --batch_count=1 --op_class=simt --accum=f32 --cta_m=128  \
                  --cta_n=32 --cta_k=8 --stages=2 --warps_m=2 --warps_n=1 --warps_k=1 --inst_m=1 --inst_n=1 --inst_k=1  \
                  --min_cc=50 --max_cc=1024

           Bytes: 12582912  bytes
           FLOPs: 2149580800  flops
           FLOPs/Byte: 170

         Runtime: 0.138905  ms
          Memory: 84.3654 GiB/s

            Math: 15475.2 GFLOP/s



=============================
  Problem ID: 1

        Provider: [1;37mCUTLASS[0m
   OperationKind: [1;37mgemm[0m
       Operation: cutlass_simt_sgemm_32x128_8x2_nn_align1

          Status: [1;37mSuccess[0m
    Verification: [1;37mON[0m
     Disposition: [1;32mPassed[0m

reference_device: Passed
          cuBLAS: Passed

       Arguments: --gemm_kind=universal --split_k_mode=serial --m=1024 --n=1024 --k=1024 --A=f32:column --B=f32:column  \
                  --C=f32:column --alpha=1 --beta=0 --split_k_slices=1 --batch_count=1 --op_class=simt --accum=f32 --cta_m=32  \
                  --cta_n=128 --cta_k=8 --stages=2 --warps_m=1 --warps_n=2 --warps_k=1 --inst_m=1 --inst_n=1 --inst_k=1  \
                  --min_cc=50 --max_cc=1024

           Bytes: 12582912  bytes
           FLOPs: 2149580800  flops
           FLOPs/Byte: 170

         Runtime: 0.130878  ms
          Memory: 89.5392 GiB/s

            Math: 16424.3 GFLOP/s



=============================
  Problem ID: 1

        Provider: [1;37mCUTLASS[0m
   OperationKind: [1;37mgemm[0m
       Operation: cutlass_simt_sgemm_256x128_8x5_nn_align1

          Status: [1;37mSuccess[0m
    Verification: [1;37mON[0m
     Disposition: [1;32mPassed[0m

reference_device: Passed
          cuBLAS: Passed

       Arguments: --gemm_kind=universal --split_k_mode=serial --m=1024 --n=1024 --k=1024 --A=f32:column --B=f32:column  \
                  --C=f32:column --alpha=1 --beta=0 --split_k_slices=1 --batch_count=1 --op_class=simt --accum=f32 --cta_m=256  \
                  --cta_n=128 --cta_k=8 --stages=5 --warps_m=4 --warps_n=2 --warps_k=1 --inst_m=1 --inst_n=1 --inst_k=1  \
                  --min_cc=50 --max_cc=1024

           Bytes: 12582912  bytes
           FLOPs: 2149580800  flops
           FLOPs/Byte: 170

         Runtime: 0.197386  ms
          Memory: 59.3696 GiB/s

            Math: 10890.2 GFLOP/s



=============================
  Problem ID: 1

        Provider: [1;37mCUTLASS[0m
   OperationKind: [1;37mgemm[0m
       Operation: cutlass_simt_sgemm_128x256_8x5_nn_align1

          Status: [1;37mSuccess[0m
    Verification: [1;37mON[0m
     Disposition: [1;32mPassed[0m

reference_device: Passed
          cuBLAS: Passed

       Arguments: --gemm_kind=universal --split_k_mode=serial --m=1024 --n=1024 --k=1024 --A=f32:column --B=f32:column  \
                  --C=f32:column --alpha=1 --beta=0 --split_k_slices=1 --batch_count=1 --op_class=simt --accum=f32 --cta_m=128  \
                  --cta_n=256 --cta_k=8 --stages=5 --warps_m=2 --warps_n=4 --warps_k=1 --inst_m=1 --inst_n=1 --inst_k=1  \
                  --min_cc=50 --max_cc=1024

           Bytes: 12582912  bytes
           FLOPs: 2149580800  flops
           FLOPs/Byte: 170

         Runtime: 0.191795  ms
          Memory: 61.1003 GiB/s

            Math: 11207.7 GFLOP/s



=============================
  Problem ID: 1

        Provider: [1;37mCUTLASS[0m
   OperationKind: [1;37mgemm[0m
       Operation: cutlass_simt_sgemm_128x128_8x5_nn_align1

          Status: [1;37mSuccess[0m
    Verification: [1;37mON[0m
     Disposition: [1;32mPassed[0m

reference_device: Passed
          cuBLAS: Passed

       Arguments: --gemm_kind=universal --split_k_mode=serial --m=1024 --n=1024 --k=1024 --A=f32:column --B=f32:column  \
                  --C=f32:column --alpha=1 --beta=0 --split_k_slices=1 --batch_count=1 --op_class=simt --accum=f32 --cta_m=128  \
                  --cta_n=128 --cta_k=8 --stages=5 --warps_m=4 --warps_n=2 --warps_k=1 --inst_m=1 --inst_n=1 --inst_k=1  \
                  --min_cc=50 --max_cc=1024

           Bytes: 12582912  bytes
           FLOPs: 2149580800  flops
           FLOPs/Byte: 170

         Runtime: 0.118221  ms
          Memory: 99.126 GiB/s

            Math: 18182.8 GFLOP/s



=============================
  Problem ID: 1

        Provider: [1;37mCUTLASS[0m
   OperationKind: [1;37mgemm[0m
       Operation: cutlass_simt_sgemm_256x128_8x4_nn_align1

          Status: [1;37mSuccess[0m
    Verification: [1;37mON[0m
     Disposition: [1;32mPassed[0m

reference_device: Passed
          cuBLAS: Passed

       Arguments: --gemm_kind=universal --split_k_mode=serial --m=1024 --n=1024 --k=1024 --A=f32:column --B=f32:column  \
                  --C=f32:column --alpha=1 --beta=0 --split_k_slices=1 --batch_count=1 --op_class=simt --accum=f32 --cta_m=256  \
                  --cta_n=128 --cta_k=8 --stages=4 --warps_m=4 --warps_n=2 --warps_k=1 --inst_m=1 --inst_n=1 --inst_k=1  \
                  --min_cc=50 --max_cc=1024

           Bytes: 12582912  bytes
           FLOPs: 2149580800  flops
           FLOPs/Byte: 170

         Runtime: 0.197581  ms
          Memory: 59.3112 GiB/s

            Math: 10879.5 GFLOP/s



=============================
  Problem ID: 1

        Provider: [1;37mCUTLASS[0m
   OperationKind: [1;37mgemm[0m
       Operation: cutlass_simt_sgemm_128x256_8x4_nn_align1

          Status: [1;37mSuccess[0m
    Verification: [1;37mON[0m
     Disposition: [1;32mPassed[0m

reference_device: Passed
          cuBLAS: Passed

       Arguments: --gemm_kind=universal --split_k_mode=serial --m=1024 --n=1024 --k=1024 --A=f32:column --B=f32:column  \
                  --C=f32:column --alpha=1 --beta=0 --split_k_slices=1 --batch_count=1 --op_class=simt --accum=f32 --cta_m=128  \
                  --cta_n=256 --cta_k=8 --stages=4 --warps_m=2 --warps_n=4 --warps_k=1 --inst_m=1 --inst_n=1 --inst_k=1  \
                  --min_cc=50 --max_cc=1024

           Bytes: 12582912  bytes
           FLOPs: 2149580800  flops
           FLOPs/Byte: 170

         Runtime: 0.193085  ms
          Memory: 60.692 GiB/s

            Math: 11132.8 GFLOP/s



=============================
  Problem ID: 1

        Provider: [1;37mCUTLASS[0m
   OperationKind: [1;37mgemm[0m
       Operation: cutlass_simt_sgemm_128x128_8x4_nn_align1

          Status: [1;37mSuccess[0m
    Verification: [1;37mON[0m
     Disposition: [1;32mPassed[0m

reference_device: Passed
          cuBLAS: Passed

       Arguments: --gemm_kind=universal --split_k_mode=serial --m=1024 --n=1024 --k=1024 --A=f32:column --B=f32:column  \
                  --C=f32:column --alpha=1 --beta=0 --split_k_slices=1 --batch_count=1 --op_class=simt --accum=f32 --cta_m=128  \
                  --cta_n=128 --cta_k=8 --stages=4 --warps_m=4 --warps_n=2 --warps_k=1 --inst_m=1 --inst_n=1 --inst_k=1  \
                  --min_cc=50 --max_cc=1024

           Bytes: 12582912  bytes
           FLOPs: 2149580800  flops
           FLOPs/Byte: 170

         Runtime: 0.117985  ms
          Memory: 99.3238 GiB/s

            Math: 18219.1 GFLOP/s



=============================
  Problem ID: 1

        Provider: [1;37mCUTLASS[0m
   OperationKind: [1;37mgemm[0m
       Operation: cutlass_simt_sgemm_128x64_8x5_nn_align1

          Status: [1;37mSuccess[0m
    Verification: [1;37mON[0m
     Disposition: [1;32mPassed[0m

reference_device: Passed
          cuBLAS: Passed

       Arguments: --gemm_kind=universal --split_k_mode=serial --m=1024 --n=1024 --k=1024 --A=f32:column --B=f32:column  \
                  --C=f32:column --alpha=1 --beta=0 --split_k_slices=1 --batch_count=1 --op_class=simt --accum=f32 --cta_m=128  \
                  --cta_n=64 --cta_k=8 --stages=5 --warps_m=2 --warps_n=2 --warps_k=1 --inst_m=1 --inst_n=1 --inst_k=1  \
                  --min_cc=50 --max_cc=1024

           Bytes: 12582912  bytes
           FLOPs: 2149580800  flops
           FLOPs/Byte: 170

         Runtime: 0.146708  ms
          Memory: 79.8778 GiB/s

            Math: 14652.1 GFLOP/s



=============================
  Problem ID: 1

        Provider: [1;37mCUTLASS[0m
   OperationKind: [1;37mgemm[0m
       Operation: cutlass_simt_sgemm_64x128_8x5_nn_align1

          Status: [1;37mSuccess[0m
    Verification: [1;37mON[0m
     Disposition: [1;32mPassed[0m

reference_device: Passed
          cuBLAS: Passed

       Arguments: --gemm_kind=universal --split_k_mode=serial --m=1024 --n=1024 --k=1024 --A=f32:column --B=f32:column  \
                  --C=f32:column --alpha=1 --beta=0 --split_k_slices=1 --batch_count=1 --op_class=simt --accum=f32 --cta_m=64  \
                  --cta_n=128 --cta_k=8 --stages=5 --warps_m=2 --warps_n=2 --warps_k=1 --inst_m=1 --inst_n=1 --inst_k=1  \
                  --min_cc=50 --max_cc=1024

           Bytes: 12582912  bytes
           FLOPs: 2149580800  flops
           FLOPs/Byte: 170

         Runtime: 0.115702  ms
          Memory: 101.284 GiB/s

            Math: 18578.6 GFLOP/s



=============================
  Problem ID: 1

        Provider: [1;37mCUTLASS[0m
   OperationKind: [1;37mgemm[0m
       Operation: cutlass_simt_sgemm_64x64_8x5_nn_align1

          Status: [1;37mSuccess[0m
    Verification: [1;37mON[0m
     Disposition: [1;32mPassed[0m

reference_device: Passed
          cuBLAS: Passed

       Arguments: --gemm_kind=universal --split_k_mode=serial --m=1024 --n=1024 --k=1024 --A=f32:column --B=f32:column  \
                  --C=f32:column --alpha=1 --beta=0 --split_k_slices=1 --batch_count=1 --op_class=simt --accum=f32 --cta_m=64  \
                  --cta_n=64 --cta_k=8 --stages=5 --warps_m=2 --warps_n=1 --warps_k=1 --inst_m=1 --inst_n=1 --inst_k=1  \
                  --min_cc=50 --max_cc=1024

           Bytes: 12582912  bytes
           FLOPs: 2149580800  flops
           FLOPs/Byte: 170

         Runtime: 0.134707  ms
          Memory: 86.9942 GiB/s

            Math: 15957.4 GFLOP/s



=============================
  Problem ID: 1

        Provider: [1;37mCUTLASS[0m
   OperationKind: [1;37mgemm[0m
       Operation: cutlass_simt_sgemm_128x32_8x5_nn_align1

          Status: [1;37mSuccess[0m
    Verification: [1;37mON[0m
     Disposition: [1;32mPassed[0m

reference_device: Passed
          cuBLAS: Passed

       Arguments: --gemm_kind=universal --split_k_mode=serial --m=1024 --n=1024 --k=1024 --A=f32:column --B=f32:column  \
                  --C=f32:column --alpha=1 --beta=0 --split_k_slices=1 --batch_count=1 --op_class=simt --accum=f32 --cta_m=128  \
                  --cta_n=32 --cta_k=8 --stages=5 --warps_m=2 --warps_n=1 --warps_k=1 --inst_m=1 --inst_n=1 --inst_k=1  \
                  --min_cc=50 --max_cc=1024

           Bytes: 12582912  bytes
           FLOPs: 2149580800  flops
           FLOPs/Byte: 170

         Runtime: 0.201298  ms
          Memory: 58.216 GiB/s

            Math: 10678.6 GFLOP/s



=============================
  Problem ID: 1

        Provider: [1;37mCUTLASS[0m
   OperationKind: [1;37mgemm[0m
       Operation: cutlass_simt_sgemm_32x128_8x5_nn_align1

          Status: [1;37mSuccess[0m
    Verification: [1;37mON[0m
     Disposition: [1;32mPassed[0m

reference_device: Passed
          cuBLAS: Passed

       Arguments: --gemm_kind=universal --split_k_mode=serial --m=1024 --n=1024 --k=1024 --A=f32:column --B=f32:column  \
                  --C=f32:column --alpha=1 --beta=0 --split_k_slices=1 --batch_count=1 --op_class=simt --accum=f32 --cta_m=32  \
                  --cta_n=128 --cta_k=8 --stages=5 --warps_m=1 --warps_n=2 --warps_k=1 --inst_m=1 --inst_n=1 --inst_k=1  \
                  --min_cc=50 --max_cc=1024

           Bytes: 12582912  bytes
           FLOPs: 2149580800  flops
           FLOPs/Byte: 170

         Runtime: 0.145111  ms
          Memory: 80.7571 GiB/s

            Math: 14813.4 GFLOP/s


=============================

CSV Results:

Problem,Provider,OperationKind,Operation,Disposition,Status,gemm_kind,split_k_mode,m,n,k,A,B,C,alpha,beta,split_k_slices,batch_count,op_class,accum,cta_m,cta_n,cta_k,stages,warps_m,warps_n,warps_k,inst_m,inst_n,inst_k,min_cc,max_cc,Bytes,Flops,Flops/Byte,Runtime,GB/s,GFLOPs
1,CUTLASS,gemm,cutlass_simt_sgemm_128x128_8x2_nn_align1,passed,success,universal,serial,1024,1024,1024,f32:column,f32:column,f32:column,1,0,1,1,simt,f32,128,128,8,2,4,2,1,1,1,1,50,1024,12582912,2149580800,170,0.117484,99.748,18296.9
1,CUTLASS,gemm,cutlass_simt_sgemm_128x64_8x2_nn_align1,passed,success,universal,serial,1024,1024,1024,f32:column,f32:column,f32:column,1,0,1,1,simt,f32,128,64,8,2,2,2,1,1,1,1,50,1024,12582912,2149580800,170,0.11862,98.7922,18121.5
1,CUTLASS,gemm,cutlass_simt_sgemm_64x128_8x2_nn_align1,passed,success,universal,serial,1024,1024,1024,f32:column,f32:column,f32:column,1,0,1,1,simt,f32,64,128,8,2,2,2,1,1,1,1,50,1024,12582912,2149580800,170,0.118815,98.6305,18091.9
1,CUTLASS,gemm,cutlass_simt_sgemm_64x64_8x2_nn_align1,passed,success,universal,serial,1024,1024,1024,f32:column,f32:column,f32:column,1,0,1,1,simt,f32,64,64,8,2,2,1,1,1,1,1,50,1024,12582912,2149580800,170,0.124631,94.0275,17247.6
1,CUTLASS,gemm,cutlass_simt_sgemm_128x32_8x2_nn_align1,passed,success,universal,serial,1024,1024,1024,f32:column,f32:column,f32:column,1,0,1,1,simt,f32,128,32,8,2,2,1,1,1,1,1,50,1024,12582912,2149580800,170,0.138905,84.3654,15475.2
1,CUTLASS,gemm,cutlass_simt_sgemm_32x128_8x2_nn_align1,passed,success,universal,serial,1024,1024,1024,f32:column,f32:column,f32:column,1,0,1,1,simt,f32,32,128,8,2,1,2,1,1,1,1,50,1024,12582912,2149580800,170,0.130878,89.5392,16424.3
1,CUTLASS,gemm,cutlass_simt_sgemm_256x128_8x5_nn_align1,passed,success,universal,serial,1024,1024,1024,f32:column,f32:column,f32:column,1,0,1,1,simt,f32,256,128,8,5,4,2,1,1,1,1,50,1024,12582912,2149580800,170,0.197386,59.3696,10890.2
1,CUTLASS,gemm,cutlass_simt_sgemm_128x256_8x5_nn_align1,passed,success,universal,serial,1024,1024,1024,f32:column,f32:column,f32:column,1,0,1,1,simt,f32,128,256,8,5,2,4,1,1,1,1,50,1024,12582912,2149580800,170,0.191795,61.1003,11207.7
1,CUTLASS,gemm,cutlass_simt_sgemm_128x128_8x5_nn_align1,passed,success,universal,serial,1024,1024,1024,f32:column,f32:column,f32:column,1,0,1,1,simt,f32,128,128,8,5,4,2,1,1,1,1,50,1024,12582912,2149580800,170,0.118221,99.126,18182.8
1,CUTLASS,gemm,cutlass_simt_sgemm_256x128_8x4_nn_align1,passed,success,universal,serial,1024,1024,1024,f32:column,f32:column,f32:column,1,0,1,1,simt,f32,256,128,8,4,4,2,1,1,1,1,50,1024,12582912,2149580800,170,0.197581,59.3112,10879.5
1,CUTLASS,gemm,cutlass_simt_sgemm_128x256_8x4_nn_align1,passed,success,universal,serial,1024,1024,1024,f32:column,f32:column,f32:column,1,0,1,1,simt,f32,128,256,8,4,2,4,1,1,1,1,50,1024,12582912,2149580800,170,0.193085,60.692,11132.8
1,CUTLASS,gemm,cutlass_simt_sgemm_128x128_8x4_nn_align1,passed,success,universal,serial,1024,1024,1024,f32:column,f32:column,f32:column,1,0,1,1,simt,f32,128,128,8,4,4,2,1,1,1,1,50,1024,12582912,2149580800,170,0.117985,99.3238,18219.1
1,CUTLASS,gemm,cutlass_simt_sgemm_128x64_8x5_nn_align1,passed,success,universal,serial,1024,1024,1024,f32:column,f32:column,f32:column,1,0,1,1,simt,f32,128,64,8,5,2,2,1,1,1,1,50,1024,12582912,2149580800,170,0.146708,79.8778,14652.1
1,CUTLASS,gemm,cutlass_simt_sgemm_64x128_8x5_nn_align1,passed,success,universal,serial,1024,1024,1024,f32:column,f32:column,f32:column,1,0,1,1,simt,f32,64,128,8,5,2,2,1,1,1,1,50,1024,12582912,2149580800,170,0.115702,101.284,18578.6
1,CUTLASS,gemm,cutlass_simt_sgemm_64x64_8x5_nn_align1,passed,success,universal,serial,1024,1024,1024,f32:column,f32:column,f32:column,1,0,1,1,simt,f32,64,64,8,5,2,1,1,1,1,1,50,1024,12582912,2149580800,170,0.134707,86.9942,15957.4
1,CUTLASS,gemm,cutlass_simt_sgemm_128x32_8x5_nn_align1,passed,success,universal,serial,1024,1024,1024,f32:column,f32:column,f32:column,1,0,1,1,simt,f32,128,32,8,5,2,1,1,1,1,1,50,1024,12582912,2149580800,170,0.201298,58.216,10678.6
1,CUTLASS,gemm,cutlass_simt_sgemm_32x128_8x5_nn_align1,passed,success,universal,serial,1024,1024,1024,f32:column,f32:column,f32:column,1,0,1,1,simt,f32,32,128,8,5,1,2,1,1,1,1,50,1024,12582912,2149580800,170,0.145111,80.7571,14813.4
