nn/cutlass_best_perf/M=1536_N=1536_K=1536/profiler_3.out



=============================
  Problem ID: 1

        Provider: [1;37mCUTLASS[0m
   OperationKind: [1;37mgemm[0m
       Operation: cutlass_simt_sgemm_128x128_8x2_nn_align1

          Status: [1;37mSuccess[0m
    Verification: [1;37mON[0m
     Disposition: [1;32mPassed[0m

reference_device: Passed
          cuBLAS: Passed

       Arguments: --gemm_kind=universal --split_k_mode=serial --m=1536 --n=1536 --k=1536 --A=f32:column --B=f32:column  \
                  --C=f32:column --alpha=1 --beta=0 --split_k_slices=1 --batch_count=1 --op_class=simt --accum=f32 --cta_m=128  \
                  --cta_n=128 --cta_k=8 --stages=2 --warps_m=4 --warps_n=2 --warps_k=1 --inst_m=1 --inst_n=1 --inst_k=1  \
                  --min_cc=50 --max_cc=1024

           Bytes: 28311552  bytes
           FLOPs: 7252475904  flops
           FLOPs/Byte: 256

         Runtime: 0.479949  ms
          Memory: 54.9375 GiB/s

            Math: 15110.9 GFLOP/s



=============================
  Problem ID: 1

        Provider: [1;37mCUTLASS[0m
   OperationKind: [1;37mgemm[0m
       Operation: cutlass_simt_sgemm_128x64_8x2_nn_align1

          Status: [1;37mSuccess[0m
    Verification: [1;37mON[0m
     Disposition: [1;32mPassed[0m

reference_device: Passed
          cuBLAS: Passed

       Arguments: --gemm_kind=universal --split_k_mode=serial --m=1536 --n=1536 --k=1536 --A=f32:column --B=f32:column  \
                  --C=f32:column --alpha=1 --beta=0 --split_k_slices=1 --batch_count=1 --op_class=simt --accum=f32 --cta_m=128  \
                  --cta_n=64 --cta_k=8 --stages=2 --warps_m=2 --warps_n=2 --warps_k=1 --inst_m=1 --inst_n=1 --inst_k=1  \
                  --min_cc=50 --max_cc=1024

           Bytes: 28311552  bytes
           FLOPs: 7252475904  flops
           FLOPs/Byte: 256

         Runtime: 0.431462  ms
          Memory: 61.1112 GiB/s

            Math: 16809.1 GFLOP/s



=============================
  Problem ID: 1

        Provider: [1;37mCUTLASS[0m
   OperationKind: [1;37mgemm[0m
       Operation: cutlass_simt_sgemm_64x128_8x2_nn_align1

          Status: [1;37mSuccess[0m
    Verification: [1;37mON[0m
     Disposition: [1;32mPassed[0m

reference_device: Passed
          cuBLAS: Passed

       Arguments: --gemm_kind=universal --split_k_mode=serial --m=1536 --n=1536 --k=1536 --A=f32:column --B=f32:column  \
                  --C=f32:column --alpha=1 --beta=0 --split_k_slices=1 --batch_count=1 --op_class=simt --accum=f32 --cta_m=64  \
                  --cta_n=128 --cta_k=8 --stages=2 --warps_m=2 --warps_n=2 --warps_k=1 --inst_m=1 --inst_n=1 --inst_k=1  \
                  --min_cc=50 --max_cc=1024

           Bytes: 28311552  bytes
           FLOPs: 7252475904  flops
           FLOPs/Byte: 256

         Runtime: 0.433347  ms
          Memory: 60.8455 GiB/s

            Math: 16736 GFLOP/s



=============================
  Problem ID: 1

        Provider: [1;37mCUTLASS[0m
   OperationKind: [1;37mgemm[0m
       Operation: cutlass_simt_sgemm_64x64_8x2_nn_align1

          Status: [1;37mSuccess[0m
    Verification: [1;37mON[0m
     Disposition: [1;32mPassed[0m

reference_device: Passed
          cuBLAS: Passed

       Arguments: --gemm_kind=universal --split_k_mode=serial --m=1536 --n=1536 --k=1536 --A=f32:column --B=f32:column  \
                  --C=f32:column --alpha=1 --beta=0 --split_k_slices=1 --batch_count=1 --op_class=simt --accum=f32 --cta_m=64  \
                  --cta_n=64 --cta_k=8 --stages=2 --warps_m=2 --warps_n=1 --warps_k=1 --inst_m=1 --inst_n=1 --inst_k=1  \
                  --min_cc=50 --max_cc=1024

           Bytes: 28311552  bytes
           FLOPs: 7252475904  flops
           FLOPs/Byte: 256

         Runtime: 0.451277  ms
          Memory: 58.428 GiB/s

            Math: 16071 GFLOP/s



=============================
  Problem ID: 1

        Provider: [1;37mCUTLASS[0m
   OperationKind: [1;37mgemm[0m
       Operation: cutlass_simt_sgemm_128x32_8x2_nn_align1

          Status: [1;37mSuccess[0m
    Verification: [1;37mON[0m
     Disposition: [1;32mPassed[0m

reference_device: Passed
          cuBLAS: Passed

       Arguments: --gemm_kind=universal --split_k_mode=serial --m=1536 --n=1536 --k=1536 --A=f32:column --B=f32:column  \
                  --C=f32:column --alpha=1 --beta=0 --split_k_slices=1 --batch_count=1 --op_class=simt --accum=f32 --cta_m=128  \
                  --cta_n=32 --cta_k=8 --stages=2 --warps_m=2 --warps_n=1 --warps_k=1 --inst_m=1 --inst_n=1 --inst_k=1  \
                  --min_cc=50 --max_cc=1024

           Bytes: 28311552  bytes
           FLOPs: 7252475904  flops
           FLOPs/Byte: 256

         Runtime: 0.517519  ms
          Memory: 50.9492 GiB/s

            Math: 14013.9 GFLOP/s



=============================
  Problem ID: 1

        Provider: [1;37mCUTLASS[0m
   OperationKind: [1;37mgemm[0m
       Operation: cutlass_simt_sgemm_32x128_8x2_nn_align1

          Status: [1;37mSuccess[0m
    Verification: [1;37mON[0m
     Disposition: [1;32mPassed[0m

reference_device: Passed
          cuBLAS: Passed

       Arguments: --gemm_kind=universal --split_k_mode=serial --m=1536 --n=1536 --k=1536 --A=f32:column --B=f32:column  \
                  --C=f32:column --alpha=1 --beta=0 --split_k_slices=1 --batch_count=1 --op_class=simt --accum=f32 --cta_m=32  \
                  --cta_n=128 --cta_k=8 --stages=2 --warps_m=1 --warps_n=2 --warps_k=1 --inst_m=1 --inst_n=1 --inst_k=1  \
                  --min_cc=50 --max_cc=1024

           Bytes: 28311552  bytes
           FLOPs: 7252475904  flops
           FLOPs/Byte: 256

         Runtime: 0.49794  ms
          Memory: 52.9525 GiB/s

            Math: 14564.9 GFLOP/s



=============================
  Problem ID: 1

        Provider: [1;37mCUTLASS[0m
   OperationKind: [1;37mgemm[0m
       Operation: cutlass_simt_sgemm_256x128_8x5_nn_align1

          Status: [1;37mSuccess[0m
    Verification: [1;37mON[0m
     Disposition: [1;32mPassed[0m

reference_device: Passed
          cuBLAS: Passed

       Arguments: --gemm_kind=universal --split_k_mode=serial --m=1536 --n=1536 --k=1536 --A=f32:column --B=f32:column  \
                  --C=f32:column --alpha=1 --beta=0 --split_k_slices=1 --batch_count=1 --op_class=simt --accum=f32 --cta_m=256  \
                  --cta_n=128 --cta_k=8 --stages=5 --warps_m=4 --warps_n=2 --warps_k=1 --inst_m=1 --inst_n=1 --inst_k=1  \
                  --min_cc=50 --max_cc=1024

           Bytes: 28311552  bytes
           FLOPs: 7252475904  flops
           FLOPs/Byte: 256

         Runtime: 0.64597  ms
          Memory: 40.818 GiB/s

            Math: 11227.3 GFLOP/s



=============================
  Problem ID: 1

        Provider: [1;37mCUTLASS[0m
   OperationKind: [1;37mgemm[0m
       Operation: cutlass_simt_sgemm_128x256_8x5_nn_align1

          Status: [1;37mSuccess[0m
    Verification: [1;37mON[0m
     Disposition: [1;32mPassed[0m

reference_device: Passed
          cuBLAS: Passed

       Arguments: --gemm_kind=universal --split_k_mode=serial --m=1536 --n=1536 --k=1536 --A=f32:column --B=f32:column  \
                  --C=f32:column --alpha=1 --beta=0 --split_k_slices=1 --batch_count=1 --op_class=simt --accum=f32 --cta_m=128  \
                  --cta_n=256 --cta_k=8 --stages=5 --warps_m=2 --warps_n=4 --warps_k=1 --inst_m=1 --inst_n=1 --inst_k=1  \
                  --min_cc=50 --max_cc=1024

           Bytes: 28311552  bytes
           FLOPs: 7252475904  flops
           FLOPs/Byte: 256

         Runtime: 0.585626  ms
          Memory: 45.024 GiB/s

            Math: 12384.2 GFLOP/s



=============================
  Problem ID: 1

        Provider: [1;37mCUTLASS[0m
   OperationKind: [1;37mgemm[0m
       Operation: cutlass_simt_sgemm_128x128_8x5_nn_align1

          Status: [1;37mSuccess[0m
    Verification: [1;37mON[0m
     Disposition: [1;32mPassed[0m

reference_device: Passed
          cuBLAS: Passed

       Arguments: --gemm_kind=universal --split_k_mode=serial --m=1536 --n=1536 --k=1536 --A=f32:column --B=f32:column  \
                  --C=f32:column --alpha=1 --beta=0 --split_k_slices=1 --batch_count=1 --op_class=simt --accum=f32 --cta_m=128  \
                  --cta_n=128 --cta_k=8 --stages=5 --warps_m=4 --warps_n=2 --warps_k=1 --inst_m=1 --inst_n=1 --inst_k=1  \
                  --min_cc=50 --max_cc=1024

           Bytes: 28311552  bytes
           FLOPs: 7252475904  flops
           FLOPs/Byte: 256

         Runtime: 0.588052  ms
          Memory: 44.8382 GiB/s

            Math: 12333 GFLOP/s



=============================
  Problem ID: 1

        Provider: [1;37mCUTLASS[0m
   OperationKind: [1;37mgemm[0m
       Operation: cutlass_simt_sgemm_256x128_8x4_nn_align1

          Status: [1;37mSuccess[0m
    Verification: [1;37mON[0m
     Disposition: [1;32mPassed[0m

reference_device: Passed
          cuBLAS: Passed

       Arguments: --gemm_kind=universal --split_k_mode=serial --m=1536 --n=1536 --k=1536 --A=f32:column --B=f32:column  \
                  --C=f32:column --alpha=1 --beta=0 --split_k_slices=1 --batch_count=1 --op_class=simt --accum=f32 --cta_m=256  \
                  --cta_n=128 --cta_k=8 --stages=4 --warps_m=4 --warps_n=2 --warps_k=1 --inst_m=1 --inst_n=1 --inst_k=1  \
                  --min_cc=50 --max_cc=1024

           Bytes: 28311552  bytes
           FLOPs: 7252475904  flops
           FLOPs/Byte: 256

         Runtime: 0.649155  ms
          Memory: 40.6177 GiB/s

            Math: 11172.2 GFLOP/s



=============================
  Problem ID: 1

        Provider: [1;37mCUTLASS[0m
   OperationKind: [1;37mgemm[0m
       Operation: cutlass_simt_sgemm_128x256_8x4_nn_align1

          Status: [1;37mSuccess[0m
    Verification: [1;37mON[0m
     Disposition: [1;32mPassed[0m

reference_device: Passed
          cuBLAS: Passed

       Arguments: --gemm_kind=universal --split_k_mode=serial --m=1536 --n=1536 --k=1536 --A=f32:column --B=f32:column  \
                  --C=f32:column --alpha=1 --beta=0 --split_k_slices=1 --batch_count=1 --op_class=simt --accum=f32 --cta_m=128  \
                  --cta_n=256 --cta_k=8 --stages=4 --warps_m=2 --warps_n=4 --warps_k=1 --inst_m=1 --inst_n=1 --inst_k=1  \
                  --min_cc=50 --max_cc=1024

           Bytes: 28311552  bytes
           FLOPs: 7252475904  flops
           FLOPs/Byte: 256

         Runtime: 0.588319  ms
          Memory: 44.8179 GiB/s

            Math: 12327.5 GFLOP/s



=============================
  Problem ID: 1

        Provider: [1;37mCUTLASS[0m
   OperationKind: [1;37mgemm[0m
       Operation: cutlass_simt_sgemm_128x128_8x4_nn_align1

          Status: [1;37mSuccess[0m
    Verification: [1;37mON[0m
     Disposition: [1;32mPassed[0m

reference_device: Passed
          cuBLAS: Passed

       Arguments: --gemm_kind=universal --split_k_mode=serial --m=1536 --n=1536 --k=1536 --A=f32:column --B=f32:column  \
                  --C=f32:column --alpha=1 --beta=0 --split_k_slices=1 --batch_count=1 --op_class=simt --accum=f32 --cta_m=128  \
                  --cta_n=128 --cta_k=8 --stages=4 --warps_m=4 --warps_n=2 --warps_k=1 --inst_m=1 --inst_n=1 --inst_k=1  \
                  --min_cc=50 --max_cc=1024

           Bytes: 28311552  bytes
           FLOPs: 7252475904  flops
           FLOPs/Byte: 256

         Runtime: 0.588851  ms
          Memory: 44.7773 GiB/s

            Math: 12316.3 GFLOP/s



=============================
  Problem ID: 1

        Provider: [1;37mCUTLASS[0m
   OperationKind: [1;37mgemm[0m
       Operation: cutlass_simt_sgemm_128x64_8x5_nn_align1

          Status: [1;37mSuccess[0m
    Verification: [1;37mON[0m
     Disposition: [1;32mPassed[0m

reference_device: Passed
          cuBLAS: Passed

       Arguments: --gemm_kind=universal --split_k_mode=serial --m=1536 --n=1536 --k=1536 --A=f32:column --B=f32:column  \
                  --C=f32:column --alpha=1 --beta=0 --split_k_slices=1 --batch_count=1 --op_class=simt --accum=f32 --cta_m=128  \
                  --cta_n=64 --cta_k=8 --stages=5 --warps_m=2 --warps_n=2 --warps_k=1 --inst_m=1 --inst_n=1 --inst_k=1  \
                  --min_cc=50 --max_cc=1024

           Bytes: 28311552  bytes
           FLOPs: 7252475904  flops
           FLOPs/Byte: 256

         Runtime: 0.670423  ms
          Memory: 39.3292 GiB/s

            Math: 10817.8 GFLOP/s



=============================
  Problem ID: 1

        Provider: [1;37mCUTLASS[0m
   OperationKind: [1;37mgemm[0m
       Operation: cutlass_simt_sgemm_64x128_8x5_nn_align1

          Status: [1;37mSuccess[0m
    Verification: [1;37mON[0m
     Disposition: [1;32mPassed[0m

reference_device: Passed
          cuBLAS: Passed

       Arguments: --gemm_kind=universal --split_k_mode=serial --m=1536 --n=1536 --k=1536 --A=f32:column --B=f32:column  \
                  --C=f32:column --alpha=1 --beta=0 --split_k_slices=1 --batch_count=1 --op_class=simt --accum=f32 --cta_m=64  \
                  --cta_n=128 --cta_k=8 --stages=5 --warps_m=2 --warps_n=2 --warps_k=1 --inst_m=1 --inst_n=1 --inst_k=1  \
                  --min_cc=50 --max_cc=1024

           Bytes: 28311552  bytes
           FLOPs: 7252475904  flops
           FLOPs/Byte: 256

         Runtime: 0.481741  ms
          Memory: 54.7331 GiB/s

            Math: 15054.7 GFLOP/s



=============================
  Problem ID: 1

        Provider: [1;37mCUTLASS[0m
   OperationKind: [1;37mgemm[0m
       Operation: cutlass_simt_sgemm_64x64_8x5_nn_align1

          Status: [1;37mSuccess[0m
    Verification: [1;37mON[0m
     Disposition: [1;32mPassed[0m

reference_device: Passed
          cuBLAS: Passed

       Arguments: --gemm_kind=universal --split_k_mode=serial --m=1536 --n=1536 --k=1536 --A=f32:column --B=f32:column  \
                  --C=f32:column --alpha=1 --beta=0 --split_k_slices=1 --batch_count=1 --op_class=simt --accum=f32 --cta_m=64  \
                  --cta_n=64 --cta_k=8 --stages=5 --warps_m=2 --warps_n=1 --warps_k=1 --inst_m=1 --inst_n=1 --inst_k=1  \
                  --min_cc=50 --max_cc=1024

           Bytes: 28311552  bytes
           FLOPs: 7252475904  flops
           FLOPs/Byte: 256

         Runtime: 0.599818  ms
          Memory: 43.9586 GiB/s

            Math: 12091.1 GFLOP/s



=============================
  Problem ID: 1

        Provider: [1;37mCUTLASS[0m
   OperationKind: [1;37mgemm[0m
       Operation: cutlass_simt_sgemm_128x32_8x5_nn_align1

          Status: [1;37mSuccess[0m
    Verification: [1;37mON[0m
     Disposition: [1;32mPassed[0m

reference_device: Passed
          cuBLAS: Passed

       Arguments: --gemm_kind=universal --split_k_mode=serial --m=1536 --n=1536 --k=1536 --A=f32:column --B=f32:column  \
                  --C=f32:column --alpha=1 --beta=0 --split_k_slices=1 --batch_count=1 --op_class=simt --accum=f32 --cta_m=128  \
                  --cta_n=32 --cta_k=8 --stages=5 --warps_m=2 --warps_n=1 --warps_k=1 --inst_m=1 --inst_n=1 --inst_k=1  \
                  --min_cc=50 --max_cc=1024

           Bytes: 28311552  bytes
           FLOPs: 7252475904  flops
           FLOPs/Byte: 256

         Runtime: 0.88065  ms
          Memory: 29.9406 GiB/s

            Math: 8235.36 GFLOP/s



=============================
  Problem ID: 1

        Provider: [1;37mCUTLASS[0m
   OperationKind: [1;37mgemm[0m
       Operation: cutlass_simt_sgemm_32x128_8x5_nn_align1

          Status: [1;37mSuccess[0m
    Verification: [1;37mON[0m
     Disposition: [1;32mPassed[0m

reference_device: Passed
          cuBLAS: Passed

       Arguments: --gemm_kind=universal --split_k_mode=serial --m=1536 --n=1536 --k=1536 --A=f32:column --B=f32:column  \
                  --C=f32:column --alpha=1 --beta=0 --split_k_slices=1 --batch_count=1 --op_class=simt --accum=f32 --cta_m=32  \
                  --cta_n=128 --cta_k=8 --stages=5 --warps_m=1 --warps_n=2 --warps_k=1 --inst_m=1 --inst_n=1 --inst_k=1  \
                  --min_cc=50 --max_cc=1024

           Bytes: 28311552  bytes
           FLOPs: 7252475904  flops
           FLOPs/Byte: 256

         Runtime: 0.572518  ms
          Memory: 46.0547 GiB/s

            Math: 12667.7 GFLOP/s


=============================

CSV Results:

Problem,Provider,OperationKind,Operation,Disposition,Status,gemm_kind,split_k_mode,m,n,k,A,B,C,alpha,beta,split_k_slices,batch_count,op_class,accum,cta_m,cta_n,cta_k,stages,warps_m,warps_n,warps_k,inst_m,inst_n,inst_k,min_cc,max_cc,Bytes,Flops,Flops/Byte,Runtime,GB/s,GFLOPs
1,CUTLASS,gemm,cutlass_simt_sgemm_128x128_8x2_nn_align1,passed,success,universal,serial,1536,1536,1536,f32:column,f32:column,f32:column,1,0,1,1,simt,f32,128,128,8,2,4,2,1,1,1,1,50,1024,28311552,7252475904,256,0.479949,54.9375,15110.9
1,CUTLASS,gemm,cutlass_simt_sgemm_128x64_8x2_nn_align1,passed,success,universal,serial,1536,1536,1536,f32:column,f32:column,f32:column,1,0,1,1,simt,f32,128,64,8,2,2,2,1,1,1,1,50,1024,28311552,7252475904,256,0.431462,61.1112,16809.1
1,CUTLASS,gemm,cutlass_simt_sgemm_64x128_8x2_nn_align1,passed,success,universal,serial,1536,1536,1536,f32:column,f32:column,f32:column,1,0,1,1,simt,f32,64,128,8,2,2,2,1,1,1,1,50,1024,28311552,7252475904,256,0.433347,60.8455,16736
1,CUTLASS,gemm,cutlass_simt_sgemm_64x64_8x2_nn_align1,passed,success,universal,serial,1536,1536,1536,f32:column,f32:column,f32:column,1,0,1,1,simt,f32,64,64,8,2,2,1,1,1,1,1,50,1024,28311552,7252475904,256,0.451277,58.428,16071
1,CUTLASS,gemm,cutlass_simt_sgemm_128x32_8x2_nn_align1,passed,success,universal,serial,1536,1536,1536,f32:column,f32:column,f32:column,1,0,1,1,simt,f32,128,32,8,2,2,1,1,1,1,1,50,1024,28311552,7252475904,256,0.517519,50.9492,14013.9
1,CUTLASS,gemm,cutlass_simt_sgemm_32x128_8x2_nn_align1,passed,success,universal,serial,1536,1536,1536,f32:column,f32:column,f32:column,1,0,1,1,simt,f32,32,128,8,2,1,2,1,1,1,1,50,1024,28311552,7252475904,256,0.49794,52.9525,14564.9
1,CUTLASS,gemm,cutlass_simt_sgemm_256x128_8x5_nn_align1,passed,success,universal,serial,1536,1536,1536,f32:column,f32:column,f32:column,1,0,1,1,simt,f32,256,128,8,5,4,2,1,1,1,1,50,1024,28311552,7252475904,256,0.64597,40.818,11227.3
1,CUTLASS,gemm,cutlass_simt_sgemm_128x256_8x5_nn_align1,passed,success,universal,serial,1536,1536,1536,f32:column,f32:column,f32:column,1,0,1,1,simt,f32,128,256,8,5,2,4,1,1,1,1,50,1024,28311552,7252475904,256,0.585626,45.024,12384.2
1,CUTLASS,gemm,cutlass_simt_sgemm_128x128_8x5_nn_align1,passed,success,universal,serial,1536,1536,1536,f32:column,f32:column,f32:column,1,0,1,1,simt,f32,128,128,8,5,4,2,1,1,1,1,50,1024,28311552,7252475904,256,0.588052,44.8382,12333
1,CUTLASS,gemm,cutlass_simt_sgemm_256x128_8x4_nn_align1,passed,success,universal,serial,1536,1536,1536,f32:column,f32:column,f32:column,1,0,1,1,simt,f32,256,128,8,4,4,2,1,1,1,1,50,1024,28311552,7252475904,256,0.649155,40.6177,11172.2
1,CUTLASS,gemm,cutlass_simt_sgemm_128x256_8x4_nn_align1,passed,success,universal,serial,1536,1536,1536,f32:column,f32:column,f32:column,1,0,1,1,simt,f32,128,256,8,4,2,4,1,1,1,1,50,1024,28311552,7252475904,256,0.588319,44.8179,12327.5
1,CUTLASS,gemm,cutlass_simt_sgemm_128x128_8x4_nn_align1,passed,success,universal,serial,1536,1536,1536,f32:column,f32:column,f32:column,1,0,1,1,simt,f32,128,128,8,4,4,2,1,1,1,1,50,1024,28311552,7252475904,256,0.588851,44.7773,12316.3
1,CUTLASS,gemm,cutlass_simt_sgemm_128x64_8x5_nn_align1,passed,success,universal,serial,1536,1536,1536,f32:column,f32:column,f32:column,1,0,1,1,simt,f32,128,64,8,5,2,2,1,1,1,1,50,1024,28311552,7252475904,256,0.670423,39.3292,10817.8
1,CUTLASS,gemm,cutlass_simt_sgemm_64x128_8x5_nn_align1,passed,success,universal,serial,1536,1536,1536,f32:column,f32:column,f32:column,1,0,1,1,simt,f32,64,128,8,5,2,2,1,1,1,1,50,1024,28311552,7252475904,256,0.481741,54.7331,15054.7
1,CUTLASS,gemm,cutlass_simt_sgemm_64x64_8x5_nn_align1,passed,success,universal,serial,1536,1536,1536,f32:column,f32:column,f32:column,1,0,1,1,simt,f32,64,64,8,5,2,1,1,1,1,1,50,1024,28311552,7252475904,256,0.599818,43.9586,12091.1
1,CUTLASS,gemm,cutlass_simt_sgemm_128x32_8x5_nn_align1,passed,success,universal,serial,1536,1536,1536,f32:column,f32:column,f32:column,1,0,1,1,simt,f32,128,32,8,5,2,1,1,1,1,1,50,1024,28311552,7252475904,256,0.88065,29.9406,8235.36
1,CUTLASS,gemm,cutlass_simt_sgemm_32x128_8x5_nn_align1,passed,success,universal,serial,1536,1536,1536,f32:column,f32:column,f32:column,1,0,1,1,simt,f32,32,128,8,5,1,2,1,1,1,1,50,1024,28311552,7252475904,256,0.572518,46.0547,12667.7
